title,topic,pred_val,authors,journal,links,full_title
tropisetron facilitates footshock suppression compulsive cocaine seeking,NEURAL,33.31465423107147,"Zhou YQ, Zhang LY, Yu ZP, Zhang XQ, Shi J, Shen HW,",*The international journal of neuropsychopharmacology*,* [Tropisetron facilitates footshock suppression of compulsive cocaine seeking.](https://www.ncbi.nlm.nih.gov/pubmed/31125405),Tropisetron facilitates footshock suppression of compulsive cocaine seeking.
regulation locomotor speed selection active sets neurons v1 neurons,NEURAL,93.78398656845093,"Kimura Y, Higashijima SI,",*Nature communications*,* [Regulation of locomotor speed and selection of active sets of neurons by V1 neurons.](https://www.ncbi.nlm.nih.gov/pubmed/31118414),Regulation of locomotor speed and selection of active sets of neurons by V1 neurons.
using upright preparation identify characterize locomotor related neurons across transverse plane neonatal mouse spinal cord,NEURAL,95.21121382713318,"Rancic V, Haque F, Ballanyi K, Gosgnach S,",*Journal of neuroscience methods*,* [Using an upright preparation to identify and characterize locomotor related neurons across the transverse plane of the neonatal mouse spinal cord.](https://www.ncbi.nlm.nih.gov/pubmed/31132372),Using an upright preparation to identify and characterize locomotor related neurons across the transverse plane of the neonatal mouse spinal cord.
radiographic dose dependency loperamide effects gastrointestinal motor function rat temporal relationship nausea like behavior,NEURAL,55.4822564125061,"Vera G, Girón R, Martín-Fontelles MI, Abalo R,",*Neurogastroenterology and motility : the official journal of the European Gastrointestinal Motility Society*,* [Radiographic dose-dependency study of loperamide effects on gastrointestinal motor function in the rat. Temporal relationship with nausea-like behavior.](https://www.ncbi.nlm.nih.gov/pubmed/31117152),Radiographic dose-dependency study of loperamide effects on gastrointestinal motor function in the rat. Temporal relationship with nausea-like behavior.
essential role mouse synapse associated protein syap1 circuits spontaneous motor activity rotarod balance,NEURAL,97.61528968811035,"von Collenberg CR, Schmitt D, Rülicke T, Sendtner M, Blum R, Buchner E,",*Biology open*,* [Essential role of the mouse synapse associated protein Syap1 in circuits for spontaneous motor activity and rotarod balance.](https://www.ncbi.nlm.nih.gov/pubmed/31118165),Essential role of the mouse synapse associated protein Syap1 in circuits for spontaneous motor activity and rotarod balance.
bioactivities serotonin transporter medicate antidepressant effects acorus tatarinowii schott,NEURAL,16.437621414661407,"Zhang FH, Wang ZM, Liu YT, Huang JS, Liang S, Wu HH, Xu YT,",*Journal of ethnopharmacology*,* [Bioactivities of serotonin transporter medicate antidepressant effects of Acorus tatarinowii Schott.](https://www.ncbi.nlm.nih.gov/pubmed/31128148),Bioactivities of serotonin transporter medicate antidepressant effects of Acorus tatarinowii Schott.
chronic nicotine exposure alters metabotropic glutamate receptor 5 longitudinal pet study behavioural assessment rats,NEURAL,53.390371799468994,"Müller Herde A, Mihov Y, Krämer SD, Mu L, Adamantidis A, Ametamey SM, Hasler G,",*Neurotoxicity research*,* [Chronic Nicotine Exposure Alters Metabotropic Glutamate Receptor 5: Longitudinal PET Study and Behavioural Assessment in Rats.](https://www.ncbi.nlm.nih.gov/pubmed/31119680),Chronic Nicotine Exposure Alters Metabotropic Glutamate Receptor 5: Longitudinal PET Study and Behavioural Assessment in Rats.
model neuroinflammation designed mimic delirium quetiapine reduces cortisol secretion preserves reversal learning attentional set shifting task,NEURAL,29.707905650138855,"Carr ZJ, Miller L, Ruiz-Velasco V, Kunselman AR, Karamchandani K,",*Journal of neuroimmune pharmacology : the official journal of the Society on NeuroImmune Pharmacology*,"* [In a Model of Neuroinflammation Designed to Mimic Delirium, Quetiapine Reduces Cortisol Secretion and Preserves Reversal Learning in the Attentional Set Shifting Task.](https://www.ncbi.nlm.nih.gov/pubmed/31119596)","In a Model of Neuroinflammation Designed to Mimic Delirium, Quetiapine Reduces Cortisol Secretion and Preserves Reversal Learning in the Attentional Set Shifting Task."
cinnamon metabolite protect nigrostriatum mouse model parkinson disease via astrocytic gdnf,NEURAL,97.06295728683472,"Patel D, Jana A, Roy A, Pahan K,",*Journal of neuroimmune pharmacology : the official journal of the Society on NeuroImmune Pharmacology*,* [Cinnamon and its Metabolite Protect the Nigrostriatum in a Mouse Model of Parkinson's Disease Via Astrocytic GDNF.](https://www.ncbi.nlm.nih.gov/pubmed/31119595),Cinnamon and its Metabolite Protect the Nigrostriatum in a Mouse Model of Parkinson's Disease Via Astrocytic GDNF.
impact repetitive mild traumatic brain injury behavioral hippocampal deficits mouse model chronic stress,NEURAL,81.98487758636475,"Algamal M, Saltiel N, Pearson AJ, Ager B, Burca I, Mouzon B, Diamond DM, Mullan M, Ojo JO, Crawford F,",*Journal of neurotrauma*,* [Impact of Repetitive Mild Traumatic Brain Injury on Behavioral and Hippocampal Deficits in a Mouse Model of Chronic Stress.](https://www.ncbi.nlm.nih.gov/pubmed/30963958),Impact of Repetitive Mild Traumatic Brain Injury on Behavioral and Hippocampal Deficits in a Mouse Model of Chronic Stress.
functional multipotency stem cells recovery neurobiology injured spinal cords,NEURAL,65.85150957107544,"Teng YD,",*Cell transplantation*,* [Functional Multipotency of Stem Cells and Recovery Neurobiology of Injured Spinal Cords.](https://www.ncbi.nlm.nih.gov/pubmed/31134830),Functional Multipotency of Stem Cells and Recovery Neurobiology of Injured Spinal Cords.
selective trpv4 channel antagonist hc 067047 attenuates mechanical allodynia diabetic mice,NEURAL,69.8488175868988,"Dias FC, Alves VS, Matias DO, Figueiredo CP, Miranda ALP, Passos GF, Costa R,",*European journal of pharmacology*,* [The selective TRPV4 channel antagonist HC-067047 attenuates mechanical allodynia in diabetic mice.](https://www.ncbi.nlm.nih.gov/pubmed/31129158),The selective TRPV4 channel antagonist HC-067047 attenuates mechanical allodynia in diabetic mice.
back pain movement b pam registry protocol,ORTHOPAEDICS/SPINE,30.982893705368042,"Desai MJ, Jonely H, Blackburn M, Wanasinghage S, Sheikh S, Taylor RS,",*BMC musculoskeletal disorders*,* [The Back Pain and Movement (B-PAM) registry; a study protocol.](https://www.ncbi.nlm.nih.gov/pubmed/31122221),The Back Pain and Movement (B-PAM) registry; a study protocol.
development retro odontoid pseudotumor absence atlantoaxial instability rheumatoid arthritis post laminoplasty case report,ORTHOPAEDICS/SPINE,92.95315742492676,"Alomari AA, Shigematsu H, Tanaka M, Kawasaki S, Masuda K, Yamamoto Y, Tanaka Y,",*British journal of neurosurgery*,* [Development of a Retro-Odontoid pseudotumor in the absence of atlantoaxial instability or rheumatoid arthritis Post-Laminoplasty: case report.](https://www.ncbi.nlm.nih.gov/pubmed/31122078),Development of a Retro-Odontoid pseudotumor in the absence of atlantoaxial instability or rheumatoid arthritis Post-Laminoplasty: case report.
advantage using stand alone cages numerical approach,ORTHOPAEDICS/SPINE,99.53448176383972,"Calvo-Echenique A, Cegoñino J, Perez Del Palomar A,",*Biomedical engineering online*,* [Is there any advantage of using stand-alone cages? A numerical approach.](https://www.ncbi.nlm.nih.gov/pubmed/31113423),Is there any advantage of using stand-alone cages? A numerical approach.
biomechanical analysis spinal implants different rod diameters static fatigue loads experimental,ORTHOPAEDICS/SPINE,59.3084990978241,"Kovacı H, Yetim AF, Çelik A,",*Biomedizinische Technik. Biomedical engineering*,* [Biomechanical analysis of spinal implants with different rod diameters under static and fatigue loads: an experimental study.](https://www.ncbi.nlm.nih.gov/pubmed/29935109),Biomechanical analysis of spinal implants with different rod diameters under static and fatigue loads: an experimental study.
kinematics following 3 screw integrated interbody spacers lumbar spine,ORTHOPAEDICS/SPINE,96.20404839515686,"Heary RF, Agarwal N, Parvathreddy NK, Hansberry DR, Ferrara LA,","*Operative neurosurgery (Hagerstown, Md.)*",* [Kinematics Following 3-Screw Integrated Interbody Spacers in the Lumbar Spine.](https://www.ncbi.nlm.nih.gov/pubmed/31131859),Kinematics Following 3-Screw Integrated Interbody Spacers in the Lumbar Spine.
supplementary delta rod configurations provide superior stiffness reduced rod stress compared traditional multiple rod configurations pedicle subtraction osteotomy finite element,ORTHOPAEDICS/SPINE,30.77547252178192,"Berjano P, Xu M, Damilano M, Scholl T, Lamartina C, Jekir M, Galbusera F,","*European spine journal : official publication of the European Spine Society, the European Spinal Deformity Society, and the European Section of the Cervical Spine Research Society*",* [Supplementary delta-rod configurations provide superior stiffness and reduced rod stress compared to traditional multiple-rod configurations after pedicle subtraction osteotomy: a finite element study.](https://www.ncbi.nlm.nih.gov/pubmed/31129763),Supplementary delta-rod configurations provide superior stiffness and reduced rod stress compared to traditional multiple-rod configurations after pedicle subtraction osteotomy: a finite element study.
biomechanical comparison six different fixation techniques treatment metacarpal neck fractures,ORTHOPAEDICS/SURGERY,83.7837815284729,"Gick S, Oppermann J, Owerst I, Pennig D, Dargel J,",*Der Unfallchirurg*,* [Biomechanical comparison of six different fixation techniques for treatment of metacarpal neck fractures]](https://www.ncbi.nlm.nih.gov/pubmed/31123800),[Biomechanical comparison of six different fixation techniques for treatment of metacarpal neck fractures].
deadman theory meets footprint decortication suture anchor biomechanical,ORTHOPAEDICS/SURGERY,79.0964424610138,"Hong CK, Hsu KL, Kuan FC, Wang PH, Hsu CC, Yeh ML, Su WR,",*Journal of orthopaedic surgery and research*,* [When deadman theory meets footprint decortication: a suture anchor biomechanical study.](https://www.ncbi.nlm.nih.gov/pubmed/31133036),When deadman theory meets footprint decortication: a suture anchor biomechanical study.
distal alignment procedures patellofemoral instability comprehensive review literature,ORTHOPAEDICS/SURGERY,46.68797552585602,"Migliorini F, Rath B, Tingart M, Niewiera M, Eschweiler J,",*European journal of orthopaedic surgery & traumatology : orthopedie traumatologie*,* [Distal alignment procedures for patellofemoral instability: comprehensive review of the literature.](https://www.ncbi.nlm.nih.gov/pubmed/31123829),Distal alignment procedures for patellofemoral instability: comprehensive review of the literature.
histological incorporation acellular dermal matrix failed superior capsule reconstruction shoulder,ORTHOPAEDICS/SURGERY,32.648152112960815,"Ravenscroft MJ, Riley JA, Morgan BW, Sandher DS, Odak SS, Joseph P,",*Journal of experimental orthopaedics*,* [Histological incorporation of acellular dermal matrix in the failed superior capsule reconstruction of the shoulder.](https://www.ncbi.nlm.nih.gov/pubmed/31129749),Histological incorporation of acellular dermal matrix in the failed superior capsule reconstruction of the shoulder.
novel method treatment posterolateral tibial plateau fractures,ORTHOPAEDICS/SURGERY,87.54618167877197,"Ren D, Liu Y, Chen Y, Lu J, Song Z, Zhou B, Wang P,",*The journal of knee surgery*,* [A Novel Method of the Treatment for Posterolateral Tibial Plateau Fractures.](https://www.ncbi.nlm.nih.gov/pubmed/31127602),A Novel Method of the Treatment for Posterolateral Tibial Plateau Fractures.
effects passive bi axial ankle stretching walking uneven terrains older adults chronic stroke,REHABILITATION,90.62569737434387,"Kim H, Cho S, Lee H,",*Journal of biomechanics*,* [Effects of passive Bi-axial ankle stretching while walking on uneven terrains in older adults with chronic stroke.](https://www.ncbi.nlm.nih.gov/pubmed/31060809),Effects of passive Bi-axial ankle stretching while walking on uneven terrains in older adults with chronic stroke.
perceived benefits rationale preferences exercises utilized within pilates group exercise programmes people chronic musculoskeletal conditions questionnaire pilates trained physiotherapists,REHABILITATION,70.60693502426147,"Gaskell L, Williams A, Preece S,",*Musculoskeletal care*,"* [Perceived benefits, rationale and preferences of exercises utilized within Pilates group exercise programmes for people with chronic musculoskeletal conditions: A questionnaire of Pilates-trained physiotherapists.](https://www.ncbi.nlm.nih.gov/pubmed/31125181)","Perceived benefits, rationale and preferences of exercises utilized within Pilates group exercise programmes for people with chronic musculoskeletal conditions: A questionnaire of Pilates-trained physiotherapists."
affirmative answers loco check predictor health related quality life locomotive syndrome progression elderly cross sectional,REHABILITATION,59.25702452659607,"Shigematsu H, Tanaka M, Munemoto M, Kawasaki S, Iwata E, Okuda A, Masuda K, Yamamoto Y, Suga Y, Tanaka Y,",*Modern rheumatology*,* [Affirmative answers on loco-check as a predictor of health-related quality of life and locomotive syndrome progression in the elderly: a cross-sectional study.](https://www.ncbi.nlm.nih.gov/pubmed/31116048),Affirmative answers on loco-check as a predictor of health-related quality of life and locomotive syndrome progression in the elderly: a cross-sectional study.
physical exercise human adipose derived mesenchymal stem cells ameliorate motor disturbances male rat model parkinson disease,REHABILITATION,69.44834589958191,"Cucarián JD, Berrío JP, Rodrigues C, Zancan M, Wink MR, de Oliveira A,",*Journal of neuroscience research*,* [Physical exercise and human adipose-derived mesenchymal stem cells ameliorate motor disturbances in a male rat model of Parkinson's disease.](https://www.ncbi.nlm.nih.gov/pubmed/31119788),Physical exercise and human adipose-derived mesenchymal stem cells ameliorate motor disturbances in a male rat model of Parkinson's disease.
lower limb tri joint synchrony running gait longitudinal age based,SPORT/EXERCISE,64.56202864646912,"Diss C, Vicinanza D, Smith L, Williams GKR,",*Human movement science*,* [Lower limb tri-joint synchrony during running gait: A longitudinal age-based study.](https://www.ncbi.nlm.nih.gov/pubmed/31132587),Lower limb tri-joint synchrony during running gait: A longitudinal age-based study.
systematic review biomechanical research methods used strongman studies,SPORT/EXERCISE,84.69682931900024,"Hindle BR, Lorimer A, Winwood P, Keogh JWL,",*Sports biomechanics*,* [A systematic review of the biomechanical research methods used in strongman studies.](https://www.ncbi.nlm.nih.gov/pubmed/31132028),A systematic review of the biomechanical research methods used in strongman studies.
influence structural components artificial turf systems impact attenuation amateur football players,SPORT/EXERCISE,58.83435606956482,"Sánchez-Sánchez J, Gallardo-Guerrero AM, García-Gallart A, Sánchez-Sáez JA, Felipe JL, Encarnación-Martínez A,",*Scientific reports*,* [Influence of the structural components of artificial turf systems on impact attenuation in amateur football players.](https://www.ncbi.nlm.nih.gov/pubmed/31123289),Influence of the structural components of artificial turf systems on impact attenuation in amateur football players.
sleep restriction impairs maximal jump performance joint coordination elite athletes,SPORT/EXERCISE,91.5145993232727,"Mah CD, Sparks AJ, Samaan MA, Souza RB, Luke A,",*Journal of sports sciences*,* [Sleep restriction impairs maximal jump performance and joint coordination in elite athletes.](https://www.ncbi.nlm.nih.gov/pubmed/31122131),Sleep restriction impairs maximal jump performance and joint coordination in elite athletes.
repair within first 48 h treatment acute achilles tendon ruptures achieves best biomechanical histological outcomes,TENDON/LIGAMENT,95.75561285018921,"Misir A, Kizkapan TB, Arikan Y, Akbulut D, Onder M, Yildiz KI, Ozkocer SE,","*Knee surgery, sports traumatology, arthroscopy : official journal of the ESSKA*",* [Repair within the first 48 h in the treatment of acute Achilles tendon ruptures achieves the best biomechanical and histological outcomes.](https://www.ncbi.nlm.nih.gov/pubmed/31119340),Repair within the first 48 h in the treatment of acute Achilles tendon ruptures achieves the best biomechanical and histological outcomes.
biomechanical evaluation patellar tendon repair using krackow suture technique,TENDON/LIGAMENT,85.25498509407043,"Yen CY, Tsai YJ, Hsiao CK, Kao FC, Tu YK,",*Biomedical engineering online*,* [Biomechanical evaluation of patellar tendon repair using Krackow suture technique.](https://www.ncbi.nlm.nih.gov/pubmed/31118104),Biomechanical evaluation of patellar tendon repair using Krackow suture technique.
triceps surae muscle subtendon interaction differs young older adults,TENDON/LIGAMENT,44.290974736213684,"Clark WH, Franz JR,",*Connective tissue research*,* [Triceps surae muscle-subtendon interaction differs between young and older adults.](https://www.ncbi.nlm.nih.gov/pubmed/31116576),Triceps surae muscle-subtendon interaction differs between young and older adults.
mesenchymal stem cells improve survival ischemic diabetic random skin flap via angiogenesis vegf expression,TISSUE/BIOMATERIAL,62.09768056869507,"Chehelcheraghi F, Chien S, Bayat M,",*Journal of cellular biochemistry*,* [Mesenchymal stem cells improve survival in ischemic diabetic random skin flap via increased angiogenesis and VEGF expression.](https://www.ncbi.nlm.nih.gov/pubmed/31127644),Mesenchymal stem cells improve survival in ischemic diabetic random skin flap via increased angiogenesis and VEGF expression.
evaluation anti nociceptive anti inflammatory activities methanol extract holigarna caustica dennst oken leaves,TISSUE/BIOMATERIAL,23.088398575782776,"Adnan M, Nazim Uddin Chy M, Mostafa Kamal ATM, Barlow JW, Faruque MO, Yang X, Uddin SB,",*Journal of ethnopharmacology*,* [Evaluation of anti-nociceptive and anti-inflammatory activities of the methanol extract of Holigarna caustica (Dennst.) Oken leaves.](https://www.ncbi.nlm.nih.gov/pubmed/30703495),Evaluation of anti-nociceptive and anti-inflammatory activities of the methanol extract of Holigarna caustica (Dennst.) Oken leaves.
corneal biomechanical changes trabeculectomy mitomycin c primary open angle glaucoma pseudoexfoliation glaucoma,TISSUE/BIOMATERIAL,65.06271958351135,"Sorkhabi R, Najafzadeh F, Sadeghi A, Ahoor M, Mahdavifard A,",*International ophthalmology*,* [Corneal biomechanical changes after trabeculectomy with mitomycin C in primary open-angle glaucoma and pseudoexfoliation glaucoma.](https://www.ncbi.nlm.nih.gov/pubmed/31134423),Corneal biomechanical changes after trabeculectomy with mitomycin C in primary open-angle glaucoma and pseudoexfoliation glaucoma.
water content related alterations macro micro scale tendon biomechanics,TISSUE/BIOMATERIAL,54.43856716156006,"Lozano PF, Scholze M, Babian C, Scheidt H, Vielmuth F, Waschke J, Ondruschka B, Hammer N,",*Scientific reports*,* [Water-content related alterations in macro and micro scale tendon biomechanics.](https://www.ncbi.nlm.nih.gov/pubmed/31133713),Water-content related alterations in macro and micro scale tendon biomechanics.
50 years scanning electron microscopy bone comprehensive overview important discoveries made insights gained bone material properties health disease taphonomy,TISSUE/BIOMATERIAL,55.6090772151947,"Shah FA, Ruscsák K, Palmquist A,",*Bone research*,"* [50 years of scanning electron microscopy of bone-a comprehensive overview of the important discoveries made and insights gained into bone material properties in health, disease, and taphonomy.](https://www.ncbi.nlm.nih.gov/pubmed/31123620)","50 years of scanning electron microscopy of bone-a comprehensive overview of the important discoveries made and insights gained into bone material properties in health, disease, and taphonomy."
transepithelial versus epithelium corneal collagen cross linking corneal ectasia protocol systematic review meta analysis trial sequential analysis randomised controlled trials,TISSUE/BIOMATERIAL,81.0209572315216,"Nath S, Shen C, Koziarz A, Banfield L, Fava MA, Hodge WG,",*BMJ open*,"* [Transepithelial versus epithelium-off corneal collagen cross-linking for corneal ectasia: protocol for a systematic review, meta-analysis and trial sequential analysis of randomised controlled trials.](https://www.ncbi.nlm.nih.gov/pubmed/31133582)","Transepithelial versus epithelium-off corneal collagen cross-linking for corneal ectasia: protocol for a systematic review, meta-analysis and trial sequential analysis of randomised controlled trials."
umbrella leaves biomechanics transition zone lamina petiole peltate leaves,TISSUE/BIOMATERIAL,28.10054123401642,"Sacher M, Lautenschläger T, Kempe A, Neinhuis C,",*Bioinspiration & biomimetics*,* [Umbrella leaves - Biomechanics of transition zone from lamina to petiole of peltate leaves.](https://www.ncbi.nlm.nih.gov/pubmed/31121570),Umbrella leaves - Biomechanics of transition zone from lamina to petiole of peltate leaves.
effect variability implantation depth intracorneal ring segments using femtosecond laser technology corneal ectasia,TISSUE/BIOMATERIAL,49.16026294231415,"Peris-Martínez C, Dualde-Beltrán C, Fernández-López E, Roig-Revert MJ, Hernández-Díaz M, Piñero DP,",*European journal of ophthalmology*,* [Effect of the variability in implantation depth of intracorneal ring segments using the femtosecond laser technology in corneal ectasia.](https://www.ncbi.nlm.nih.gov/pubmed/31113256),Effect of the variability in implantation depth of intracorneal ring segments using the femtosecond laser technology in corneal ectasia.
preparation optimization gelatin based biomimetic three layered vascular scaffold,TISSUE/BIOMATERIAL,95.64449191093445,"Hu Q, Wu C, Zhang H,",*Journal of biomaterials applications*,* [Preparation and optimization of a gelatin-based biomimetic three-layered vascular scaffold.](https://www.ncbi.nlm.nih.gov/pubmed/31126207),Preparation and optimization of a gelatin-based biomimetic three-layered vascular scaffold.
tensile properties human iliotibial tract depend height weight,TISSUE/BIOMATERIAL,29.594630002975464,"Zwirner J, Babian C, Ondruschka B, Schleifenbaum S, Scholze M, Waddell NJ, Hammer N,",*Medical engineering & physics*,* [Tensile properties of the human iliotibial tract depend on height and weight.](https://www.ncbi.nlm.nih.gov/pubmed/31133525),Tensile properties of the human iliotibial tract depend on height and weight.
suturable regenerated silk fibroin scaffold reinforced 3d printed polycaprolactone mesh biomechanical performance subcutaneous implantation,TISSUE/BIOMATERIAL,94.03083920478821,"Cengiz IF, Pereira H, Espregueira-Mendes J, Kwon IK, Reis RL, Oliveira JM,",*Journal of materials science. Materials in medicine*,* [Suturable regenerated silk fibroin scaffold reinforced with 3D-printed polycaprolactone mesh: biomechanical performance and subcutaneous implantation.](https://www.ncbi.nlm.nih.gov/pubmed/31127379),Suturable regenerated silk fibroin scaffold reinforced with 3D-printed polycaprolactone mesh: biomechanical performance and subcutaneous implantation.
comparison high hydrostatic pressure decellularized versus freeze thawed porcine menisci,TISSUE/BIOMATERIAL,53.469640016555786,"Watanabe N, Mizuno M, Matsuda J, Nakamura N, Otabe K, Katano H, Ozeki N, Kohno Y, Kimura T, Tsuji K, Koga H, Kishida A, Sekiya I,",*Journal of orthopaedic research : official publication of the Orthopaedic Research Society*,* [Comparison of high-hydrostatic-pressure decellularized versus freeze-thawed porcine menisci.](https://www.ncbi.nlm.nih.gov/pubmed/31115925),Comparison of high-hydrostatic-pressure decellularized versus freeze-thawed porcine menisci.
antinociceptive anti inflammatory activities philodendron bipinnatifidum schott ex endl araceae,VETERINARY/AGRICULTURAL,23.2839897274971,"Scapinello J, Müller LG, Schindler MSZ, Anzollin GS, Siebel AM, Boligon AA, Niero R, Saraiva TES, Maus NP, Betti AH, Oliveira JV, Magro JD, de Oliveira D,",*Journal of ethnopharmacology*,* [Antinociceptive and anti-inflammatory activities of Philodendron bipinnatifidum Schott ex Endl (Araceae).](https://www.ncbi.nlm.nih.gov/pubmed/30802613),Antinociceptive and anti-inflammatory activities of Philodendron bipinnatifidum Schott ex Endl (Araceae).
identification validation genetic variants predictive gait standardbred horses,VETERINARY/AGRICULTURAL,63.72164487838745,"McCoy AM, Beeson SK, Rubin CJ, Andersson L, Caputo P, Lykkjen S, Moore A, Piercy RJ, Mickelson JR, McCue ME,",*PLoS genetics*,* [Identification and validation of genetic variants predictive of gait in standardbred horses.](https://www.ncbi.nlm.nih.gov/pubmed/31136578),Identification and validation of genetic variants predictive of gait in standardbred horses.
use unstable surfaces instruction conscious abdominal contraction increase emg activity periscapular muscles dynamic push,unknown,45.2% REHABILITATION; 34.7% SPORT/EXERCISE,"de Araújo RC, Nascimento VYS, Torres RJB, Trombini-Souza F, Behm D, Pitangui ACR,",*Journal of sport rehabilitation*,* [Can the Use of Unstable Surfaces and Instruction for Conscious Abdominal Contraction Increase the EMG Activity of the Periscapular Muscles During the Dynamic Push-Up?](https://www.ncbi.nlm.nih.gov/pubmed/30676180),Can the Use of Unstable Surfaces and Instruction for Conscious Abdominal Contraction Increase the EMG Activity of the Periscapular Muscles During the Dynamic Push-Up?
