title,topic,pred_val,authors,journal,links,full_title
protective effect glycyrrhiza glabra roots extract bone mineral density ovariectomized rats,BONE,98.39895367622375,"Galanis D, Soultanis K, Lelovas P, Zervas A, Papadopoulos P, Galanos A, Argyropoulou K, Makropoulou M, Patsaki A, Passali C, Tsingotjidou A, Kourkoulis S, Mitakou S, Dontas I,",*BioMedicine*,* [Protective effect of Glycyrrhiza glabra roots extract on bone mineral density of ovariectomized rats.](https://www.ncbi.nlm.nih.gov/pubmed/31124454),Protective effect of Glycyrrhiza glabra roots extract on bone mineral density of ovariectomized rats.
characterization mechanical properties cranial bones 8 week old piglets effect strain rate region,BONE,70.56605815887451,"Li Z, Wang G, Ji C, Jiang J, Wang J, Wang J,",*Biomechanics and modeling in mechanobiology*,* [Characterization of the mechanical properties for cranial bones of 8-week-old piglets: the effect of strain rate and region.](https://www.ncbi.nlm.nih.gov/pubmed/31119413),Characterization of the mechanical properties for cranial bones of 8-week-old piglets: the effect of strain rate and region.
topical cutaneous application co sub 2 sub accelerates bone healing rat femoral defect model,BONE,73.30262064933777,"Kuroiwa Y, Fukui T, Takahara S, Lee SY, Oe K, Arakura M, Kumabe Y, Oda T, Matsumoto T, Matsushita T, Akisue T, Sakai Y, Kuroda R, Niikura T,",*BMC musculoskeletal disorders*,* [Topical cutaneous application of CO<sub>2</sub> accelerates bone healing in a rat femoral defect model.](https://www.ncbi.nlm.nih.gov/pubmed/31113412),Topical cutaneous application of CO<sub>2</sub> accelerates bone healing in a rat femoral defect model.
development open cell polyurethane based bone surrogates biomechanical testing pedicle screws,BONE,65.71614742279053,"Hollensteiner M, Esterer B, Fürst D, Schrempf A, Augat P,",*Journal of the mechanical behavior of biomedical materials*,* [Development of open-cell polyurethane-based bone surrogates for biomechanical testing of pedicle screws.](https://www.ncbi.nlm.nih.gov/pubmed/31132661),Development of open-cell polyurethane-based bone surrogates for biomechanical testing of pedicle screws.
spirometric assessment emphysema presence severity measured quantitative ct ct based radiomics copd,CARDIOVASCULAR/CARDIOPULMONARY,38.74143660068512,"Occhipinti M, Paoletti M, Bartholmai BJ, Rajagopalan S, Karwoski RA, Nardi C, Inchingolo R, Larici AR, Camiciottoli G, Lavorini F, Colagrande S, Brusasco V, Pistolesi M,",*Respiratory research*,* [Spirometric assessment of emphysema presence and severity as measured by quantitative CT and CT-based radiomics in COPD.](https://www.ncbi.nlm.nih.gov/pubmed/31122243),Spirometric assessment of emphysema presence and severity as measured by quantitative CT and CT-based radiomics in COPD.
mechanics tricuspid valve clinical diagnosis treatment vivo vitro investigations patient specific biomechanical modeling,CARDIOVASCULAR/CARDIOPULMONARY,98.62029552459717,"Lee CH, Laurence DW, Ross CJ, Kramer KE, Babu AR, Johnson EL, Hsu MC, Aggarwal A, Mir A, Burkhart HM, Towner RA, Baumwart R, Wu Y,","*Bioengineering (Basel, Switzerland)*","* [Mechanics of the Tricuspid Valve-From Clinical Diagnosis/Treatment, In-Vivo and In-Vitro Investigations, to Patient-Specific Biomechanical Modeling.](https://www.ncbi.nlm.nih.gov/pubmed/31121881)","Mechanics of the Tricuspid Valve-From Clinical Diagnosis/Treatment, In-Vivo and In-Vitro Investigations, to Patient-Specific Biomechanical Modeling."
large proportion patients small ruptured abdominal aortic aneurysms women chronic obstructive pulmonary disease,CARDIOVASCULAR/CARDIOPULMONARY,96.54972553253174,"Siika A, Lindquist Liljeqvist M, Zommorodi S, Nilsson O, Andersson P, Gasser TC, Roy J, Hultgren R,",*PloS one*,* [A large proportion of patients with small ruptured abdominal aortic aneurysms are women and have chronic obstructive pulmonary disease.](https://www.ncbi.nlm.nih.gov/pubmed/31136570),A large proportion of patients with small ruptured abdominal aortic aneurysms are women and have chronic obstructive pulmonary disease.
pressure ulcer summit 2018 interdisciplinary approach improve understanding risk pressure induced tissue damage,CARDIOVASCULAR/CARDIOPULMONARY,28.347837924957275,"Gould LJ, Bohn G, Bryant R, Paine T, Couch K, Cowan L, McFarland F, Simman R,",*Wound repair and regeneration : official publication of the Wound Healing Society [and] the European Tissue Repair Society*,* [Pressure Ulcer Summit 2018: An Interdisciplinary Approach to Improve Our Understanding of the Risk of Pressure-Induced Tissue Damage.](https://www.ncbi.nlm.nih.gov/pubmed/31120624),Pressure Ulcer Summit 2018: An Interdisciplinary Approach to Improve Our Understanding of the Risk of Pressure-Induced Tissue Damage.
mechanotransduction immunoregulation metabolic functions cd31 cardiovascular pathophysiology,CARDIOVASCULAR/CARDIOPULMONARY,68.6439037322998,"Caligiuri G,",*Cardiovascular research*,"* [Mechanotransduction, immunoregulation and metabolic functions of CD31 in cardiovascular pathophysiology.](https://www.ncbi.nlm.nih.gov/pubmed/31119265)","Mechanotransduction, immunoregulation and metabolic functions of CD31 in cardiovascular pathophysiology."
influence hematocrit hemodynamics artificial heart valve using fluid structure interaction analysis,CARDIOVASCULAR/CARDIOPULMONARY,99.56681728363037,"Yeh HH, Barannyk O, Grecov D, Oshkai P,",*Computers in biology and medicine*,* [The influence of hematocrit on the hemodynamics of artificial heart valve using fluid-structure interaction analysis.](https://www.ncbi.nlm.nih.gov/pubmed/31129417),The influence of hematocrit on the hemodynamics of artificial heart valve using fluid-structure interaction analysis.
search optimal design bioprosthetic venous valve silico vitro studies,CARDIOVASCULAR/CARDIOPULMONARY,96.90192937850952,"Chen HY, Tien WS, Chambers SD, Dabiri D, Kassab GS,",*European journal of vascular and endovascular surgery : the official journal of the European Society for Vascular Surgery*,* [Search for an Optimal Design of a Bioprosthetic Venous Valve: In silico and in vitro Studies.](https://www.ncbi.nlm.nih.gov/pubmed/31133446),Search for an Optimal Design of a Bioprosthetic Venous Valve: In silico and in vitro Studies.
measure characterization forces exerted growing multicellular spheroids using microdevice arrays,CELLULAR/SUBCELLULAR,39.046746492385864,"Aoun L, Larnier S, Weiss P, Cazales M, Herbulot A, Ducommun B, Vieu C, Lobjois V,",*PloS one*,* [Measure and characterization of the forces exerted by growing multicellular spheroids using microdevice arrays.](https://www.ncbi.nlm.nih.gov/pubmed/31120960),Measure and characterization of the forces exerted by growing multicellular spheroids using microdevice arrays.
drosophila adck1 critical maintaining mitochondrial structures functions muscle,CELLULAR/SUBCELLULAR,89.239901304245,"Yoon W, Hwang SH, Lee SH, Chung J,",*PLoS genetics*,* [Drosophila ADCK1 is critical for maintaining mitochondrial structures and functions in the muscle.](https://www.ncbi.nlm.nih.gov/pubmed/31125351),Drosophila ADCK1 is critical for maintaining mitochondrial structures and functions in the muscle.
responses cellular adhesion strength stiffness fluid shear stress tumor cell rolling motion,CELLULAR/SUBCELLULAR,99.16027188301086,"Li W, Mao S, Khan M, Zhang Q, Huang Q, Feng S, Lin JM,",*ACS sensors*,* [Responses of Cellular Adhesion Strength and Stiffness to Fluid Shear Stress during Tumor Cell Rolling Motion.](https://www.ncbi.nlm.nih.gov/pubmed/31094503),Responses of Cellular Adhesion Strength and Stiffness to Fluid Shear Stress during Tumor Cell Rolling Motion.
hspb1 phosphorylation regulates intramolecular dynamics mechanosensitive molecular chaperone interaction filamin c,CELLULAR/SUBCELLULAR,98.02581071853638,"Collier MP, Alderson TR, de Villiers CP, Nicholls D, Gastall HY, Allison TM, Degiacomi MT, Jiang H, Mlynek G, Fürst DO, van der Ven PFM, Djinovic-Carugo K, Baldwin AJ, Watkins H, Gehmlich K, Benesch JLP,",*Science advances*,* [HspB1 phosphorylation regulates its intramolecular dynamics and mechanosensitive molecular chaperone interaction with filamin C.](https://www.ncbi.nlm.nih.gov/pubmed/31131323),HspB1 phosphorylation regulates its intramolecular dynamics and mechanosensitive molecular chaperone interaction with filamin C.
enhancer zeste homolog 2 ezh2 regulates adipocyte lipid metabolism independent adipogenic differentiation role apolipoprotein e,CELLULAR/SUBCELLULAR,85.0073516368866,"Yiew NKH, Greenway C, Zarzour A, Ahmadieh S, Goo B, Kim D, Benson TW, Ogbi M, Tang YL, Chen W, Stepp D, Patel V, Hilton R, Lu XY, Hui DY, Kim HW, Weintraub NL,",*The Journal of biological chemistry*,* [Enhancer of zeste homolog 2 (EZH2) regulates adipocyte lipid metabolism independent of adipogenic differentiation: Role of apolipoprotein E.](https://www.ncbi.nlm.nih.gov/pubmed/30971429),Enhancer of zeste homolog 2 (EZH2) regulates adipocyte lipid metabolism independent of adipogenic differentiation: Role of apolipoprotein E.
cellular circadian period length inversely correlates hba sub 1c sub levels individuals type 2 diabetes,CELLULAR/SUBCELLULAR,38.46818804740906,"Sinturel F, Makhlouf AM, Meyer P, Tran C, Pataky Z, Golay A, Rey G, Howald C, Dermitzakis ET, Pichard C, Philippe J, Brown SA, Dibner C,",*Diabetologia*,* [Cellular circadian period length inversely correlates with HbA<sub>1c</sub> levels in individuals with type 2 diabetes.](https://www.ncbi.nlm.nih.gov/pubmed/31134308),Cellular circadian period length inversely correlates with HbA<sub>1c</sub> levels in individuals with type 2 diabetes.
microcurrent stimulation activates circadian machinery mice,CELLULAR/SUBCELLULAR,46.23388648033142,"Matsunaga N, Yoshida Y, Kitajou N, Shiraishi A, Kusunose N, Koyanagi S, Ohdo S,",*Biochemical and biophysical research communications*,* [Microcurrent stimulation activates the circadian machinery in mice.](https://www.ncbi.nlm.nih.gov/pubmed/30944082),Microcurrent stimulation activates the circadian machinery in mice.
hoatzin nestling locomotion acquisition quadrupedal limb coordination birds,COMPARATIVE,70.68012952804565,"Abourachid A, Herrel A, Decamps T, Pages F, Fabre AC, Van Hoorebeke L, Adriaens D, Garcia Amado MA,",*Science advances*,* [Hoatzin nestling locomotion: Acquisition of quadrupedal limb coordination in birds.](https://www.ncbi.nlm.nih.gov/pubmed/31131317),Hoatzin nestling locomotion: Acquisition of quadrupedal limb coordination in birds.
fem analysis excellent cushion characteristic ostrich struthio camelus toe pads,COMPARATIVE,34.26436483860016,"Zhang R, Ling L, Han D, Wang H, Yu G, Jiang L, Li D, Chang Z,",*PloS one*,* [FEM analysis in excellent cushion characteristic of ostrich (Struthio camelus) toe pads.](https://www.ncbi.nlm.nih.gov/pubmed/31116736),FEM analysis in excellent cushion characteristic of ostrich (Struthio camelus) toe pads.
circadian entrainment food drugs abuse,COMPARATIVE,62.05248832702637,"Gillman AG, Rebec GV, Pecoraro N, Kosobud AEK,",*Behavioural processes*,* [Circadian entrainment by food and drugs of abuse.](https://www.ncbi.nlm.nih.gov/pubmed/31132444),Circadian entrainment by food and drugs of abuse.
evaluation vertical box plating technique mandibular body fractures retrospective analysis patient outcomes,DENTAL/ORAL/FACIAL,59.2199444770813,"Demesh D, Leonard JA, Schechter CB, Dhillon P, Hsueh W, Stupak H,",*JAMA facial plastic surgery*,* [Evaluation of a Vertical Box Plating Technique for Mandibular Body Fractures and Retrospective Analysis of Patient Outcomes.](https://www.ncbi.nlm.nih.gov/pubmed/31120473),Evaluation of a Vertical Box Plating Technique for Mandibular Body Fractures and Retrospective Analysis of Patient Outcomes.
biomechanical effect exposed dental implant first thread three dimensional finite element analysis study,DENTAL/ORAL/FACIAL,98.76006841659546,"Hudieb MI, Wakabayashi N, Abu-Hammad OA, Kasugai S,",*Medical science monitor : international medical journal of experimental and clinical research*,* [Biomechanical Effect of an Exposed Dental Implant's First Thread: A Three-Dimensional Finite Element Analysis Study.](https://www.ncbi.nlm.nih.gov/pubmed/31131833),Biomechanical Effect of an Exposed Dental Implant's First Thread: A Three-Dimensional Finite Element Analysis Study.
biomechanical performance immature maxillary central incisor revitalization finite element analysis,DENTAL/ORAL/FACIAL,97.84426689147949,"Bucchi C, Marcé-Nogué J, Galler KM, Widbiller M,",*International endodontic journal*,* [Biomechanical performance of an immature maxillary central incisor after revitalization: A finite element analysis.](https://www.ncbi.nlm.nih.gov/pubmed/31116441),Biomechanical performance of an immature maxillary central incisor after revitalization: A finite element analysis.
evolution single toe horses causes consequences way forward,EVOLUTION/ANTHROPOLOGY,89.67575430870056,"McHorse BK, Biewener AA, Pierce SE,",*Integrative and comparative biology*,"* [The evolution of a single toe in horses: causes, consequences, and the way forward.](https://www.ncbi.nlm.nih.gov/pubmed/31127281)","The evolution of a single toe in horses: causes, consequences, and the way forward."
evolutionary dynamics mechanically complex systems,EVOLUTION/ANTHROPOLOGY,88.2001519203186,"Muñoz MM,",*Integrative and comparative biology*,* [The Evolutionary Dynamics of Mechanically Complex Systems.](https://www.ncbi.nlm.nih.gov/pubmed/31134268),The Evolutionary Dynamics of Mechanically Complex Systems.
variation facial bone growth remodeling prehistoric populations southern south america,EVOLUTION/ANTHROPOLOGY,81.03767037391663,"Brachetta-Aporta N, Gonzalez PN, Bernal V,",*American journal of physical anthropology*,* [Variation in facial bone growth remodeling in prehistoric populations from southern South America.](https://www.ncbi.nlm.nih.gov/pubmed/31125125),Variation in facial bone growth remodeling in prehistoric populations from southern South America.
bracket slot size selection matter taste,EVOLUTION/ANTHROPOLOGY,37.85189986228943,"Eliades T,",*European journal of orthodontics*,* [Bracket slot size selection: after all a matter of taste?](https://www.ncbi.nlm.nih.gov/pubmed/30184050),Bracket slot size selection: after all a matter of taste?
minimum predicted distance applying common metric collision avoidance strategies children adult walkers,GAIT/LOCOMOTION,76.96043252944946,"Rapos V, Cinelli M, Snyder N, Crétual A, Olivier AH,",*Gait & posture*,* [Minimum predicted distance: Applying a common metric to collision avoidance strategies between children and adult walkers.](https://www.ncbi.nlm.nih.gov/pubmed/31132592),Minimum predicted distance: Applying a common metric to collision avoidance strategies between children and adult walkers.
clinical automated gait analysis patients vestibular cerebellar functional gait disorders perspectives limitations,GAIT/LOCOMOTION,49.92158114910126,"Schniepp R, Möhwald K, Wuehr M,",*Journal of neurology*,"* [Clinical and automated gait analysis in patients with vestibular, cerebellar, and functional gait disorders: perspectives and limitations.](https://www.ncbi.nlm.nih.gov/pubmed/31134375)","Clinical and automated gait analysis in patients with vestibular, cerebellar, and functional gait disorders: perspectives and limitations."
muscle specific indices characterise functional behaviour human lower limb muscles locomotion,GAIT/LOCOMOTION,52.46027112007141,"Lai AKM, Biewener AA, Wakeling JM,",*Journal of biomechanics*,* [Muscle-specific indices to characterise the functional behaviour of human lower-limb muscles during locomotion.](https://www.ncbi.nlm.nih.gov/pubmed/31036379),Muscle-specific indices to characterise the functional behaviour of human lower-limb muscles during locomotion.
goats decrease hindlimb stiffness walking compliant surfaces,GAIT/LOCOMOTION,82.63553380966187,"Clites TR, Arnold AS, Singh NM, Kline E, Chen H, Tugman C, Billadeau B, Biewener AA, Herr HM,",*The Journal of experimental biology*,* [Goats decrease hindlimb stiffness when walking over compliant surfaces.](https://www.ncbi.nlm.nih.gov/pubmed/31085599),Goats decrease hindlimb stiffness when walking over compliant surfaces.
locomotor kinematics emg activity quadrupedal vs bipedal gait japanese macaque,GAIT/LOCOMOTION,76.41278505325317,"Higurashi Y, Maier MA, Nakajima K, Morita K, Fujiki S, Aoi S, Mori F, Murata A, Inase M,",*Journal of neurophysiology*,* [Locomotor kinematics and EMG activity during quadrupedal vs. bipedal gait in the Japanese macaque.](https://www.ncbi.nlm.nih.gov/pubmed/31116630),Locomotor kinematics and EMG activity during quadrupedal vs. bipedal gait in the Japanese macaque.
older adults cope cognitive complexity environmental constraints dual task walking role executive function involvement,GAIT/LOCOMOTION,88.230961561203,"Forte R, Pesce C, Di Baldassarre A, Shea J, Voelcker-Rehage C, Capranica L, Condello G,",*International journal of environmental research and public health*,* [How Older Adults Cope with Cognitive Complexity and Environmental Constraints during Dual-Task Walking: The Role of Executive Function Involvement.](https://www.ncbi.nlm.nih.gov/pubmed/31126116),How Older Adults Cope with Cognitive Complexity and Environmental Constraints during Dual-Task Walking: The Role of Executive Function Involvement.
effects medial knee unloading implant tibiofemoral joint mechanics walking,JOINT/CARTILAGE,89.46970701217651,"Morgan OJ, Hillstrom HJ, Ranawat A, Fragomen AT, Rozbruch SR, Hillstrom R,",*Journal of orthopaedic research : official publication of the Orthopaedic Research Society*,* [Effects of a medial knee unloading implant on tibiofemoral joint mechanics during walking.](https://www.ncbi.nlm.nih.gov/pubmed/31119801),Effects of a medial knee unloading implant on tibiofemoral joint mechanics during walking.
contrast enhanced computed tomography scoring system distinguishing early osteoarthritis disease states feasibility study,JOINT/CARTILAGE,92.30029582977295,"Stewart RC, Nelson BB, Kawcak CE, Freedman JD, Snyder BD, Goodrich LR, Grinstaff MW,",*Journal of orthopaedic research : official publication of the Orthopaedic Research Society*,* [A Contrast-Enhanced Computed Tomography Scoring System for Distinguishing Early Osteoarthritis Disease States: A Feasibility Study.](https://www.ncbi.nlm.nih.gov/pubmed/31136003),A Contrast-Enhanced Computed Tomography Scoring System for Distinguishing Early Osteoarthritis Disease States: A Feasibility Study.
bilateral anterior elevation prosthesis boosts chondrocytes proliferation mice mandibular condyle,JOINT/CARTILAGE,55.55199980735779,"Liu Q, Yang HX, Duan J, Zhang HY, Xie MJ, Ren HT, Zhang M, Zhang J, Lu L, Liu XD, Yu SB, Wang MQ,",*Oral diseases*,* [Bilateral anterior elevation prosthesis boosts chondrocytes proliferation in mice mandibular condyle.](https://www.ncbi.nlm.nih.gov/pubmed/31132303),Bilateral anterior elevation prosthesis boosts chondrocytes proliferation in mice mandibular condyle.
small sized lightweight flexible triboelectric nanogenerator enhanced ptfe pdms nanocomposite electret,METHODS,72.182697057724,"Li ZB, Li HY, Fan YJ, Liu L, Chen YH, Zhang C, Zhu G,",*ACS applied materials & interfaces*,"* [Small-Sized, Lightweight, and Flexible Triboelectric Nanogenerator Enhanced by PTFE/PDMS Nanocomposite Electret.](https://www.ncbi.nlm.nih.gov/pubmed/31081607)","Small-Sized, Lightweight, and Flexible Triboelectric Nanogenerator Enhanced by PTFE/PDMS Nanocomposite Electret."
validity reliability shoe embedded sensor module measuring foot progression angle ground walking,METHODS,93.68014335632324,"Charlton JM, Xia H, Shull PB, Hunt MA,",*Journal of biomechanics*,* [Validity and reliability of a shoe-embedded sensor module for measuring foot progression angle during over-ground walking.](https://www.ncbi.nlm.nih.gov/pubmed/31047695),Validity and reliability of a shoe-embedded sensor module for measuring foot progression angle during over-ground walking.
resolving form structure function relationships plants mri biomimetic transfer,METHODS,34.16617512702942,"Hesse L, Leupold J, Poppinga S, Wick M, Strobel K, Masselter T, Speck T,",*Integrative and comparative biology*,* [Resolving form-structure-function relationships in plants with MRI for biomimetic transfer.](https://www.ncbi.nlm.nih.gov/pubmed/31120532),Resolving form-structure-function relationships in plants with MRI for biomimetic transfer.
viscoelastic shear thinning effects aqueous exopolymer solution disk sphere settling,MODELING,24.73289668560028,"Mrokowska MM, Krztoń-Maziopa A,",*Scientific reports*,* [Viscoelastic and shear-thinning effects of aqueous exopolymer solution on disk and sphere settling.](https://www.ncbi.nlm.nih.gov/pubmed/31133719),Viscoelastic and shear-thinning effects of aqueous exopolymer solution on disk and sphere settling.
influence impact surface head kinematics brain tissue response impacts equestrian helmets,MODELING,32.06539452075958,"Clark JM, Connor TA, Post A, Hoshizaki TB, Gilchrist MD,",*Sports biomechanics*,* [The influence of impact surface on head kinematics and brain tissue response during impacts with equestrian helmets.](https://www.ncbi.nlm.nih.gov/pubmed/31124751),The influence of impact surface on head kinematics and brain tissue response during impacts with equestrian helmets.
structure activity acute neurobehavioral effects cyclohexane benzene xylene toluene rats,NEURAL,75.21024942398071,"Armenta-Reséndiz M, Ríos-Leal E, Rivera-García MT, López-Rubalcava C, Cruz SL,",*Toxicology and applied pharmacology*,"* [Structure-activity study of acute neurobehavioral effects of cyclohexane, benzene, m-xylene, and toluene in rats.](https://www.ncbi.nlm.nih.gov/pubmed/31128119)","Structure-activity study of acute neurobehavioral effects of cyclohexane, benzene, m-xylene, and toluene in rats."
differences morphometric measures uninjured porcine spinal cord dural sac predict histological behavioral outcomes traumatic spinal cord injury,NEURAL,43.823498487472534,"Kim KT, Streijger F, So K, Manouchehri N, Shortt K, Okon EB, Tigchelaar S, Fong A, Morrison C, Keung M, Sun J, Liu E, Cripton PA, Kwon BK,",*Journal of neurotrauma*,* [Differences in Morphometric Measures of the Uninjured Porcine Spinal Cord and Dural Sac Predict Histological and Behavioral Outcomes after Traumatic Spinal Cord Injury.](https://www.ncbi.nlm.nih.gov/pubmed/30816064),Differences in Morphometric Measures of the Uninjured Porcine Spinal Cord and Dural Sac Predict Histological and Behavioral Outcomes after Traumatic Spinal Cord Injury.
busted dope ring activity clocked dawn dusk,NEURAL,74.87226128578186,"Hulse BK, Jayaraman V,",*Neuron*,* [Busted! A Dope Ring with Activity Clocked at Dawn and Dusk.](https://www.ncbi.nlm.nih.gov/pubmed/31121121),Busted! A Dope Ring with Activity Clocked at Dawn and Dusk.
representation haltere oscillations integration visual inputs fly central complex,NEURAL,97.47089147567749,"Kathman ND, Fox JL,",*The Journal of neuroscience : the official journal of the Society for Neuroscience*,* [Representation of Haltere Oscillations and Integration with Visual Inputs in the Fly Central Complex.](https://www.ncbi.nlm.nih.gov/pubmed/30877172),Representation of Haltere Oscillations and Integration with Visual Inputs in the Fly Central Complex.
quantitation neural silencing activity anion channelrhodopsins caenorhabditis elegans applicability long term illumination,NEURAL,74.37773942947388,"Yamanashi T, Maki M, Kojima K, Shibukawa A, Tsukamoto T, Chowdhury S, Yamanaka A, Takagi S, Sudo Y,",*Scientific reports*,* [Quantitation of the neural silencing activity of anion channelrhodopsins in Caenorhabditis elegans and their applicability for long-term illumination.](https://www.ncbi.nlm.nih.gov/pubmed/31133660),Quantitation of the neural silencing activity of anion channelrhodopsins in Caenorhabditis elegans and their applicability for long-term illumination.
morning evening circadian pacemakers independently drive premotor centers via specific dopamine relay,NEURAL,94.68962550163269,"Liang X, Ho MCW, Zhang Y, Li Y, Wu MN, Holy TE, Taghert PH,",*Neuron*,* [Morning and Evening Circadian Pacemakers Independently Drive Premotor Centers via a Specific Dopamine Relay.](https://www.ncbi.nlm.nih.gov/pubmed/30981533),Morning and Evening Circadian Pacemakers Independently Drive Premotor Centers via a Specific Dopamine Relay.
cannabinoids stimulate trp channel dependent release serotonin dopamine modulate behavior c elegans,NEURAL,95.42291164398193,"Oakes M, Law WJ, Komuniecki R,",*The Journal of neuroscience : the official journal of the Society for Neuroscience*,* [Cannabinoids Stimulate the TRP Channel-Dependent Release of Both Serotonin and Dopamine to Modulate Behavior in <i>C. elegans</i>.](https://www.ncbi.nlm.nih.gov/pubmed/30886012),Cannabinoids Stimulate the TRP Channel-Dependent Release of Both Serotonin and Dopamine to Modulate Behavior in <i>C. elegans</i>.
longitudinal characterization cognitive motor deficits excitotoxic lesion model striatal dysfunction non human primates,NEURAL,99.13685917854309,"Lavisse S, Williams S, Lecourtois S, van Camp N, Guillermier M, Gipchtein P, Jan C, Goutal S, Eymin L, Valette J, Delzescaux T, Perrier AL, Hantraye P, Badin RA,",*Neurobiology of disease*,* [Longitudinal characterization of cognitive and motor deficits in an excitotoxic lesion model of striatal dysfunction in non-human primates.](https://www.ncbi.nlm.nih.gov/pubmed/31132407),Longitudinal characterization of cognitive and motor deficits in an excitotoxic lesion model of striatal dysfunction in non-human primates.
