,title,topic,pred_val,authors,journal,links,full_title,abstract,new_topic
251,optimal femur length trans femoral amputation mixed method scoping review expert opinions biomechanical analysis,REHABILITATION,22.8% REHABILITATION; 15.5% JOINT/CARTILAGE; 11.7% GAIT/LOCOMOTION,"Geertzen JHB, de Beus MC, Jutte PC, Otten E, Dekker R,",*Medical hypotheses*,"* [What is the optimal femur length in a trans-femoral amputation? A mixed method study: Scoping review, expert opinions and biomechanical analysis.](https://www.ncbi.nlm.nih.gov/pubmed/31371086)","What is the optimal femur length in a trans-femoral amputation? A mixed method study: Scoping review, expert opinions and biomechanical analysis.","In the Netherlands, 34% of all major lower limb amputations are at the trans-femoral level. Information and consensus is lacking on the optimal length of the residual length of the femur following the amputation. HYPOTHESIS: We hypothesize that femur length should be kept as long as possible considering construction of the knee unit beneath the socket. Evaluation of the hypothesis: Providing a comprehensive overview of considerations involved in choosing the optimal femur length in a trans-femoral amputation. This explorative study includes a scoping review, interviews with surgeons and certified prosthetists (expert opinions), and a biomechanical analysis. The scoping review resulted in 396 articles reduced to 6 articles after reviewing. All articles, the outcomes of the interviews with the experts and the biomechanical analysis suggest that it is important to maximize the length of the residual femur. CONCLUSION: A longer residual limb length is more beneficial for gait parameters, prevention of contractures, and providing lever arm. Furthermore, the femur should be transected sufficiently proximal to the medial knee joint in order to fit a prosthetic knee at the same height as the contralateral knee. However, it remains unclear what the minimum length of the residual limb should be. This will require further research.",
252,exploring object discrimination zebrafish behavioral performance scopolamine induced cognitive deficits different retention intervals,REHABILITATION,86.9% REHABILITATION; 7.7% GAIT/LOCOMOTION; 2.5% SPORT/EXERCISE,"Stefanello FV, Fontana BD, Ziani PR, Müller TE, Mezzomo NJ, Rosemberg DB,",*Zebrafish*,* [Exploring Object Discrimination in Zebrafish: Behavioral Performance and Scopolamine-Induced Cognitive Deficits at Different Retention Intervals.](https://www.ncbi.nlm.nih.gov/pubmed/31145046),Exploring Object Discrimination in Zebrafish: Behavioral Performance and Scopolamine-Induced Cognitive Deficits at Different Retention Intervals.,"The object discrimination test allows the testing of different memory retention periods. However, few behavioral endpoints have been measured in fish species such that retention is often assessed using a single parameter (time spent in object area). Here, we aimed to explore the object discrimination test in zebrafish by assessing their behavioral performance after 1 or 24 h retention interval periods. To characterize putative interaction-like behaviors, fish were tested in the absence or presence of scopolamine (1 h before test session). Zebrafish were habituated for 3 consecutive days in the experimental tank, and training session was performed for 10 min using two identical nonpreferred objects (black cube or sphere). After the retention intervals, a familiar object was replaced by a novel object (test session, 10 min). Fish were also exposed to the novel tank diving test to assess locomotion and anxiety-like behaviors. At 1 h retention interval, animals performed more circular-like investigation near the familiar object, whereas 24 h after training session, a prominent rapid investigation was observed when animals explore the nonfamiliar object. Because scopolamine abolished these phenotypes, as well as the increased time spent in the novel object area during the test without changing locomotion and anxiety-related parameters, the behavioral responses described here may predictively reflect interaction-like behaviors involved in object discrimination memory in zebrafish models.",
253,continuous control monte carlo tree search informed multiple experts,REHABILITATION,33.8% REHABILITATION; 18.9% SPORT/EXERCISE; 11.4% METHODS,"Rajamaki J, Hamalainen P,",*IEEE transactions on visualization and computer graphics*,* [Continuous Control Monte Carlo Tree Search Informed by Multiple Experts.](https://www.ncbi.nlm.nih.gov/pubmed/29994613),Continuous Control Monte Carlo Tree Search Informed by Multiple Experts.,"Efficient algorithms for 3D character control in continuous control setting remain an open problem in spite of the remarkable recent advances in the field. We present a sampling-based model-predictive controller that comes in the form of a Monte Carlo tree search (MCTS). The tree search utilizes information from multiple sources including two machine learning models. This allows rapid development of complex skills such as 3D humanoid locomotion with less than a million simulation steps, in less than a minute of computing on a modest personal computer. We demonstrate locomotion of 3D characters with varying topologies under disturbances such as heavy projectile hits and abruptly changing target direction. In this paper we also present a new way to combine information from the various sources such that minimal amount of information is lost. We furthermore extend the neural network, involved in the algorithm, to represent stochastic policies. Our approach yields a robust control algorithm that is easy to use. While learning, the algorithm runs in near real-time, and after learning the sampling budget can be reduced for real-time operation.",
254,real time detection spatial disorientation persons mild cognitive impairment dementia,REHABILITATION,24.6% REHABILITATION; 24.5% GAIT/LOCOMOTION; 20.7% METHODS,"Schaat S, Koldrack P, Yordanova K, Kirste T, Teipel S,",*Gerontology*,* [Real-Time Detection of Spatial Disorientation in Persons with Mild Cognitive Impairment and Dementia.](https://www.ncbi.nlm.nih.gov/pubmed/31362286),Real-Time Detection of Spatial Disorientation in Persons with Mild Cognitive Impairment and Dementia.,Detecting manifestations of spatial disorientation in real time is a key requirement for adaptive assistive navigation systems for people with dementia.,
255,underwater compensation exaggerated weaponry role morphology environment crab locomotor performance,REHABILITATION,46.5% REHABILITATION; 24.4% GAIT/LOCOMOTION; 14.4% SPORT/EXERCISE,"Benso-Lopes F, Santos S, Palaoro AV,","*Journal of experimental zoology. Part A, Ecological and integrative physiology*",* [Underwater compensation for exaggerated weaponry: The role of morphology and environment on crab locomotor performance.](https://www.ncbi.nlm.nih.gov/pubmed/31290237),Underwater compensation for exaggerated weaponry: The role of morphology and environment on crab locomotor performance.,"Exaggerated morphologies may increase fitness, but they might be costly to bear; heavy weight, for instance, might hinder locomotion. Evidence supporting these costs are sparse because animals that move on land or swim have traits reducing those costs, called compensatory traits. Animals that walk underwater, however, are under different environmental pressures than land animals. Buoyancy, for instance, reduces the effective weight of any object, which could decrease the locomotion costs of carrying exagerrated traits. Hence, underwater species might maintain performance without compensation. To test this, we compared males of the freshwater anomuran Aegla longirostri that bear an exaggerated claw to females (the natural control). We first tested whether the exaggerated claw decreased male locomotor performance. Next, we tested if sexual dimorphism in performance is associated with differences in leg asymmetry, length, and muscle size. Lastly, we tested if large males have proportionally heavier legs than smaller males. Unexpectedly, females are faster than males while also having relatively longer legs than males. Therefore, females might walk faster because of the longer legs, which might be unrelated to the male exaggerated claw. Furthermore, larger males did not have proportionally heavier legs than smaller males, further suggesting no compensation. Hence, even though aeglid's claw weigh ~25% of their total body weight, we did not find evidence for burden or compensation on males. The environment might thus decrease the costs of exaggerated traits.",
256,therapeutic mechanism pedunculopontine nucleus stimulation parkinson disease,REHABILITATION,73.6% REHABILITATION; 6.5% GAIT/LOCOMOTION; 5.5% NEURAL,"Thevathasan W, Moro E,",*Neurobiology of disease*,* [What is the therapeutic mechanism of pedunculopontine nucleus stimulation in Parkinson's disease?](https://www.ncbi.nlm.nih.gov/pubmed/29933055),What is the therapeutic mechanism of pedunculopontine nucleus stimulation in Parkinson's disease?,"Pedunculopontine nucleus (PPN) deep brain stimulation (DBS) is an experimental treatment for Parkinson's disease (PD) which offers a fairly circumscribed benefit for gait freezing and perhaps balance impairment. The benefit on gait freezing is variable and typically incomplete, which may reflect that the clinical application is yet to be optimised or reflect a fundamental limitation of the therapeutic mechanism. Thus, a better understanding of the therapeutic mechanism of PPN DBS may guide the further development of this therapy. The available evidence supports that the PPN is underactive in PD due to a combination of both degeneration and excessive inhibition. Low frequency PPN DBS could enhance PPN network activity, perhaps via disinhibition. A clinical implication is that in some PD patients, the PPN may be too degenerate for PPN DBS to work. Reaction time studies report that PPN DBS mediates a very specific benefit on pre-programmed movement. This seems relevant to the pathophysiology of gait freezing, which can be argued to reflect impaired release of pre-programmed adjustments to locomotion. Thus, the benefit of PPN DBS on gait freezing could be akin to that mediated by external cues. Alpha band activity is a prominent finding in local field potential recordings from PPN electrodes in PD patients. Alpha band activity is implicated in the suppression of task irrelevant processes and thus the effective allocation of attention (processing resources). Attentional deficits are prominent in patients with PD and gait freezing and PPN alpha activity has been observed to drop out prior to gait freezing episodes and to increase with levodopa. This raises the hypothesis that PPN DBS could support or emulate PPN alpha activity and consequently enhance the allocation of attention. Although PPN DBS has not been convincingly shown to increase general alertness or attention, it remains possible that PPN DBS may enhance the allocation of processing resources within the motor system, or ""motor attention"". For example, this could facilitate the 'switching' of motor state between continuation of pattern generated locomotion towards the intervention of pre-programmed adjustments. However, if the downstream consequence of PPN DBS on movement is limited to a circumscribed unblocking of pre-programmed movement, then this may have a similarly circumscribed degree of benefit for gait. If this is the case, then it may be possible to identify patients who may benefit most from PPN DBS. For example, those in whom pre-programmed deficits are the major contributors to gait freezing.",
257,protocol feasibility randomised controlled trial musculoskeletal exercise intervention versus usual care children haemophilia,REHABILITATION,90.7% REHABILITATION; 2.1% SPORT/EXERCISE; 1.7% JOINT/CARTILAGE,"Hashem F, Bladen M, Carroll L, Dodd C, Drechsler WI, Lowery D, Patel V, Pellatt-Higgins T, Saloniki E, Stephensen D,",*BMJ open*,* [Protocol for a feasibility randomised controlled trial of a musculoskeletal exercise intervention versus usual care for children with haemophilia.](https://www.ncbi.nlm.nih.gov/pubmed/31375620),Protocol for a feasibility randomised controlled trial of a musculoskeletal exercise intervention versus usual care for children with haemophilia.,"Haemophilia is a rare, inherited disorder in which blood does not clot normally, resulting in bleeding into joints and muscles. Long-term consequence is disabling joint pain, stiffness, muscle weakness, atrophy and reduced mobility. The purpose of this proposed feasibility of a randomised controlled trial (RCT) is to test the feasibility of an age-appropriate physiotherapy intervention designed to improve muscle strength, posture and the way boys use their joints during walking and everyday activities.",
258,effect low cost body weight supported treadmill trainer walking speed joint motion,REHABILITATION,85.8% REHABILITATION; 13.9% GAIT/LOCOMOTION; 0.1% SPORT/EXERCISE,"Ventura JD, Charrette AL, Roberts KJ,","*Medicina (Kaunas, Lithuania)*",* [The Effect of a Low-Cost Body Weight-Supported Treadmill Trainer on Walking Speed and Joint Motion.](https://www.ncbi.nlm.nih.gov/pubmed/31366161),The Effect of a Low-Cost Body Weight-Supported Treadmill Trainer on Walking Speed and Joint Motion.,"<i>Background and</i><i>Objectives</i><i>:</i> Gait training with body weight-support has been shown to improve the walking speed of individuals with movement disorders. The AccesSportAmerica Gait Trainer is a low-cost, pre-market gait rehabilitation device that alters the stride characteristics of participants walking on a standard treadmill. The purpose of this study was to examine the biomechanical outcomes that training on this device has for people with brain injuries that affect motor functioning. It was hypothesized that there would be an increase in walking speed post-intervention, and that there would be an increase in step length and joint range-of-motion. <i>Materials and Methods</i><i>:</i> An intervention study was conducted with 11 people with ambulatory difficulty caused by post-stroke hemiparesis (<i>n</i> = 7), traumatic brain injury (<i>n</i> = 3), and cerebral palsy (<i>n</i> = 1). The average time using the AccesSportAmerica Gait Trainer was 34.5 (SD = 6.0) minutes per session for 36.9 (SD = 21.8) sessions. Gait speed, step length and time, and joint flexion were measured during the 10 Meter Walk Test. <i>Results</i><i>:</i> From pre- to post-intervention, there was a mean increase in walking speed of 0.19 m/s (SD = 0.06, <i>p</i> = 0.016, <i>d</i> = 0.40) and a decrease in step time of both affected and unaffected legs (affected: <i>p</i> = 0.011, <i>d</i> = 0.37; unaffected: <i>p</i> = 0.004, <i>d</i> = 0.67). There was no significant change in stride length or joint angles. <i>Conclusions</i>: The AccesSportAmerica Gait Trainer has the potential to improve the walking speed of people with ambulatory difficulty.",
259,near infrared spectroscopy enables quantitative evaluation human cartilage biomechanical properties arthroscopy,ROBOTICS,98.9% ROBOTICS; 0.3% MODELING; 0.3% METHODS,"Prakash M, Joukainen A, Torniainen J, Honkanen MKM, Rieppo L, Afara IO, Kröger H, Töyräs J, Sarin JK,",*Osteoarthritis and cartilage*,* [Near-infrared spectroscopy enables quantitative evaluation of human cartilage biomechanical properties during arthroscopy.](https://www.ncbi.nlm.nih.gov/pubmed/31026649),Near-infrared spectroscopy enables quantitative evaluation of human cartilage biomechanical properties during arthroscopy.,To investigate the feasibility of near-infrared (NIR) spectroscopy (NIRS) for evaluation of human articular cartilage biomechanical properties during arthroscopy.,
260,comprehensive analysis efficient swimming using articulated legs fringed flexible appendages inspired water beetle,ROBOTICS,89.9% ROBOTICS; 3.7% COMPARATIVE; 2.4% MODELING,"Kwak B, Lee D, Bae J,",*Bioinspiration & biomimetics*,* [Comprehensive analysis of efficient swimming using articulated legs fringed with flexible appendages inspired by a water beetle.](https://www.ncbi.nlm.nih.gov/pubmed/31362269),Comprehensive analysis of efficient swimming using articulated legs fringed with flexible appendages inspired by a water beetle.,"Drag-based swimming is usually accompanied with the shape change of rowing appendages to generate asymmetric force during the power stroke and recovery stroke. To implement this in an aquatic robot, one may actively control the surface area of its legs during the swimming. However, a small sized robot with a limited number of actuators should adjust the surface area of legs in passive manner. For this reason, we proposed a novel articulated leg with flexible appendages inspired by a water beetle. This leg structures were designed to implement an efficient recovery stroke with less resistive force during the recovery stroke. While its surface area was increased again if suitable relaxation time was applied to perform improved power stroke. To identify an optimal leg design, 36 different types were fabricated by changing the passive joint thickness, appendage materials, length, and morphology. Several correlations and dominant parameters were identified, and it was shown that the swimming leg with fixed joint and appendage stiffness cannot always generate the largest torque in all the swimming frequency. Also, a two-dimensional dynamic model was proposed based on an underactuated manipulator, and the model validation was proceeded by comparing with two selected leg designs. In addition, a 5.5 cm long robot with one pair of legs was built to further investigate their locomotory performance. By varying the beating frequency and relaxation time, thorough analysis was addressed in terms of the position, velocity, non-dimensional traveled distance, Strouhal number, and quasi-propulsive efficiency. Here, some important relationships between dimensionless numbers were established. Furthermore, it was found that introducing a relaxation phase between the power stroke and recovery stroke can increase the traveled distance per stroke with slight expense of propulsive efficiency.",
261,influence composition artificial turf rotational traction athlete biomechanics,ROBOTICS,92.4% ROBOTICS; 5.5% MODELING; 0.8% METHODS,"Wannop JW, Foreman T, Madden R, Stefanyshyn D,",*Journal of sports sciences*,* [Influence of the composition of artificial turf on rotational traction and athlete biomechanics.](https://www.ncbi.nlm.nih.gov/pubmed/30922172),Influence of the composition of artificial turf on rotational traction and athlete biomechanics.,"Artificial turf advances have enabled surfaces to behave like natural grass, however, debate remains as to whether artificial turf is as safe as natural grass. To reduce injury risk, sport surfaces should have low rotational traction with artificial surfaces having a potential advantage as components can be manipulated to change surface properties and traction. The purpose of this study was to investigate the influence that different components of artificial turf have on rotational traction and athlete lower extremity joint loading. Twelve surfaces underwent mechanical testing to determine the influence of fibre density, fibre length, infill composition and compaction on rotational traction. Following mechanical testing, Control, Low and High Traction surfaces were selected for biomechanical analysis, where sixteen athletes performed maximum effort v-cuts while kinematic/kinetic data were recorded on each surface. Mechanically, fibre density, type of infill and compaction of the surface each independently influenced traction. The traction differences were substantial enough to alter the athlete kinematics and kinetics. Low traction surfaces reduced ankle and knee loading, while high traction surfaces increased ankle and knee loading . Reducing the rotational traction of sport surfaces is possible through alterations of individual components, which may reduce the joint loading at the knee and ankle joint.",
262,minimum area discrepancy method madm force displacement response correlation,ROBOTICS,92.1% ROBOTICS; 5.9% MODELING; 1.0% METHODS,"Peres J, Bastien C, Christensen J, Asgharpour Z,",*Computer methods in biomechanics and biomedical engineering*,* [A minimum area discrepancy method (MADM) for force displacement response correlation.](https://www.ncbi.nlm.nih.gov/pubmed/31074305),A minimum area discrepancy method (MADM) for force displacement response correlation.,"With the increasing use of Computer Aided Engineering, it has become vital to be able to evaluate the accuracy of numerical models. Specific methods such as CORA were developed to objectively evaluate the correlation between a physical test and a numerical simulation results in terms of parameter vs time. However, no metric has so far been developed for Force Vs Deflection (FvD) signals often used in crashworthiness and biomechanics. A unique method called the Minimum Area Discrepancy Method, or MADM, is proposed to address this deficiency. This new method initially calculates a parameter '<i>R</i>' which represents the area between numerical model and the average physical test response and then divides it by the average area generated by the upper and lower test corridors, based on the same standard deviation. The parameter '<i>R</i>' is then normalized between 0 (no correlation) and 1 (perfect correlation) to become the MADM correlation rating. The MADM method was then validated by comparing a one dimensional Finite Element (FE) model of a chest model, under 2 impact velocities, against reference Post Mortem Human Subject (PMHS) data. The MADM method was further used to improve the correlation of this thorax model, by varying model parameters and generating 81 model variations. Based on the MADM ratings, a set parameter values leading to the best fit was identified. The best fit exhibits a response significantly better than the original chest model. MADM is novel, unique, easy to use and fulfills an important gap in objectively evaluating FVD correlation responses. Abbreviations MADM Correlation rating value (Minimum Area Discrepancy Method) MADM<sub>n,m</sub> MADM correlation rating using a specific scaling value of 'n' and power rating 'm' FvD Force versus Displacement FvT Force versus Time DvT Displacement versus Time NM Numerical model PE Physical Experiment A<sub>model</sub> Area under the average signal and the Numerical Model A<sub>upper</sub> Area under the average signal +1 standard deviation A<sub>lower</sub> Area under the average signal -1 standard deviation R Ratio between A<sub>model</sub> and the average of A<sub>upper</sub> and A<sub>lower</sub>.",
263,changes corneal wound healing graft biomechanics primary penetrating keratoplasty versus repeat penetrating keratoplasty,ROBOTICS,98.7% ROBOTICS; 0.4% COMPARATIVE; 0.2% METHODS,"Abdelkader A,",*Cornea*,* [Changes in Corneal Wound Healing and Graft Biomechanics After Primary Penetrating Keratoplasty Versus Repeat Penetrating Keratoplasty.](https://www.ncbi.nlm.nih.gov/pubmed/30893112),Changes in Corneal Wound Healing and Graft Biomechanics After Primary Penetrating Keratoplasty Versus Repeat Penetrating Keratoplasty.,To evaluate and compare the influence of the wound healing process at the graft edge on corneal biomechanics after primary penetrating keratoplasty (PK) and repeat PK.,
264,soft pneumatic inchworm double balloon spid colonoscopy,ROBOTICS,90.0% ROBOTICS; 2.4% MODELING; 1.9% METHODS,"Manfredi L, Capoccia E, Ciuti G, Cuschieri A,",*Scientific reports*,* [A Soft Pneumatic Inchworm Double balloon (SPID) for colonoscopy.](https://www.ncbi.nlm.nih.gov/pubmed/31367005),A Soft Pneumatic Inchworm Double balloon (SPID) for colonoscopy.,"The design of a smart robot for colonoscopy is challenging because of the limited available space, slippery internal surfaces, and tortuous 3D shape of the human colon. Locomotion forces applied by an endoscopic robot may damage the colonic wall and/or cause pain and discomfort to patients. This study reports a Soft Pneumatic Inchworm Double balloon (SPID) mini-robot for colonoscopy consisting of two balloons connected by a 3 degrees of freedom soft pneumatic actuator. SPID has an external diameter of 18 mm, a total length of 60 mm, and weighs 10 g. The balloons provide anchorage into the colonic wall for a bio-inspired inchworm locomotion. The proposed design reduces the pressure applied to the colonic wall and consequently pain and discomfort during the procedure. The mini-robot has been tested in a deformable plastic colon phantom of similar shape and dimensions to the human anatomy, exhibiting efficient locomotion by its ability to deform and negotiate flexures and bends. The mini-robot is made of elastomer and constructed from 3D printed components, hence with low production costs essential for a disposable device.",
