title,topic,pred_val,authors,journal,links,full_title
relationship defecation symptoms posterior vaginal wall prolapse women undergoing pelvic organ prolapse surgery,unknown,26.3% TISSUE/BIOMATERIAL; 20.7% MODELING,"Karjalainen PK, Mattsson NK, Nieminen K, Tolppanen AM, Jalkanen JT,",*American journal of obstetrics and gynecology*,* [The relationship of defecation symptoms and posterior vaginal wall prolapse in women undergoing pelvic organ prolapse surgery.](https://www.ncbi.nlm.nih.gov/pubmed/31128111),The relationship of defecation symptoms and posterior vaginal wall prolapse in women undergoing pelvic organ prolapse surgery.
effects haloperidol cognitive function behavioural flexibility intellicage social home cage environment,unknown,29.2% NEURAL; 19.9% COMPARATIVE,"Marwari S, Dawe GS,",*Behavioural brain research*,* [Effects of haloperidol on cognitive function and behavioural flexibility in the IntelliCage social home cage environment.](https://www.ncbi.nlm.nih.gov/pubmed/31136773),Effects of haloperidol on cognitive function and behavioural flexibility in the IntelliCage social home cage environment.
neurobehavioral toxicological effects aqueous extract turnera diffusa willd turneraceae mice,unknown,12.5% METHODS; 9.6% CELLULAR/SUBCELLULAR,"Ana María DB, Rosa María VV, Lilian MN, Lucía MM, Oscar GP, Rosa ER,",*Journal of ethnopharmacology*,* [Neurobehavioral and toxicological effects of an aqueous extract of Turnera diffusa Willd (Turneraceae) in mice.](https://www.ncbi.nlm.nih.gov/pubmed/30818006),Neurobehavioral and toxicological effects of an aqueous extract of Turnera diffusa Willd (Turneraceae) in mice.
composite biomaterial repair strategy restore biomechanical function reduce herniation risk ex vivo large animal model intervertebral disc herniation varying injury severity,unknown,48.2% TISSUE/BIOMATERIAL; 42.2% ORTHOPAEDICS/SPINE,"Hom WW, Tschopp M, Lin HA, Nasser P, Laudier DM, Hecht AC, Nicoll SB, Iatridis JC,",*PloS one*,* [Composite biomaterial repair strategy to restore biomechanical function and reduce herniation risk in an ex vivo large animal model of intervertebral disc herniation with varying injury severity.](https://www.ncbi.nlm.nih.gov/pubmed/31136604),Composite biomaterial repair strategy to restore biomechanical function and reduce herniation risk in an ex vivo large animal model of intervertebral disc herniation with varying injury severity.
petite integration factor 1 pif1 helicase deficiency increases weight gain western diet fed female mice without inflammatory markers decreased glucose clearance,unknown,17.6% BONE; 17.4% CELLULAR/SUBCELLULAR,"Belmonte FR, Dedousis N, Sipula I, Desai NA, Singhi AD, Chu Y, Zhang Y, Bannwarth S, Paquis-Flucklinger V, Harrington L, Shiva S, Jurczak MJ, O'Doherty RM, Kaufman BA,",*PloS one*,* [Petite Integration Factor 1 (PIF1) helicase deficiency increases weight gain in Western diet-fed female mice without increased inflammatory markers or decreased glucose clearance.](https://www.ncbi.nlm.nih.gov/pubmed/31136580),Petite Integration Factor 1 (PIF1) helicase deficiency increases weight gain in Western diet-fed female mice without increased inflammatory markers or decreased glucose clearance.
modeling sports related mild traumatic brain injury animals systematic review,unknown,30.0% SPORT/EXERCISE; 21.5% NEURAL,"Hiskens MI, Angoa-Pérez M, Schneiders AG, Vella RK, Fenning AS,",*Journal of neuroscience research*,* [Modeling sports-related mild traumatic brain injury in animals-A systematic review.](https://www.ncbi.nlm.nih.gov/pubmed/31135069),Modeling sports-related mild traumatic brain injury in animals-A systematic review.
dna methylation mrna expression col6a3 antler mesenchyme female male reindeer,unknown,21.7% CELLULAR/SUBCELLULAR; 16.3% TENDON/LIGAMENT,"Zhai JC, Han RB, Wang SN, Wang QH, Xia YL, Liu WS, Yin YJ, Li HP,",*Genes & genomics*,* [DNA methylation and mRNA expression of COL6A3 in antler mesenchyme of female and male reindeer.](https://www.ncbi.nlm.nih.gov/pubmed/31134592),DNA methylation and mRNA expression of COL6A3 in antler mesenchyme of female and male reindeer.
fitting problem standardising shoe fit standards reduce related diabetic foot ulcers,unknown,17.5% METHODS; 13.6% MODELING,"Jones PJ, Bibb RJ, Davies MJ, Khunti K, McCarthy M, Fong DTP, Webb D,",*Diabetes research and clinical practice*,* [A Fitting Problem: Standardising Shoe Fit Standards to Reduce Related Diabetic Foot Ulcers.](https://www.ncbi.nlm.nih.gov/pubmed/31128134),A Fitting Problem: Standardising Shoe Fit Standards to Reduce Related Diabetic Foot Ulcers.
protein kinase cβ selective inhibitor enzastaurin attenuates amphetamine stimulated locomotor activity self administration behaviors rats,unknown,39.1% CELLULAR/SUBCELLULAR; 34.1% NEURAL,"Altshuler RD, Carpenter CC, Franke TJ, Gnegy ME, Jutkiewicz EM,",*Psychopharmacology*,"* [The protein kinase Cβ-selective inhibitor, enzastaurin, attenuates amphetamine-stimulated locomotor activity and self-administration behaviors in rats.](https://www.ncbi.nlm.nih.gov/pubmed/31134292)","The protein kinase Cβ-selective inhibitor, enzastaurin, attenuates amphetamine-stimulated locomotor activity and self-administration behaviors in rats."
sub lethal effects triazole fungicide propiconazole zebrafish danio rerio development oxidative respiration larval locomotor activity,unknown,35.6% COMPARATIVE; 25.8% NEURAL,"Souders CL, Xavier P, Perez-Rodriquez V, Ector N, Zhang JL, Martyniuk CJ,",*Neurotoxicology and teratology*,"* [Sub-lethal effects of the triazole fungicide propiconazole on zebrafish (Danio rerio) development, oxidative respiration, and larval locomotor activity.](https://www.ncbi.nlm.nih.gov/pubmed/31129159)","Sub-lethal effects of the triazole fungicide propiconazole on zebrafish (Danio rerio) development, oxidative respiration, and larval locomotor activity."
ground breaking innovations general psychology,unknown,17.4% COMPARATIVE; 15.2% EVOLUTION/ANTHROPOLOGY,"Aboulafia ALT, Dahl M,",*Integrative psychological & behavioral science*,* [Ground-Breaking Innovations in General Psychology.](https://www.ncbi.nlm.nih.gov/pubmed/31127534),Ground-Breaking Innovations in General Psychology.
cattle visually discriminate green dead forages short distance moving field,unknown,38.5% VETERINARY/AGRICULTURAL; 26.3% COMPARATIVE,"Hirata M, Arimoto C, Hattori N, Anzai H,",*Animal cognition*,* [Can cattle visually discriminate between green and dead forages at a short distance while moving in the field?](https://www.ncbi.nlm.nih.gov/pubmed/31127432),Can cattle visually discriminate between green and dead forages at a short distance while moving in the field?
metal trabecular bone reconstruction system better improves clinical efficacy biomechanical repair osteonecrosis femoral head free vascularized fibular graft case control,unknown,50.3% ORTHOPAEDICS/SURGERY; 36.4% BONE,"Chen XT, Zhu YJ, Liu YW, Chen K, Xu WW, Zhang LL, Liang DW, Li J, Ye Y, Tian KW, Zhang XD, Li HJ, Kang Z,",*Journal of cellular physiology*,* [Metal trabecular bone reconstruction system better improves clinical efficacy and biomechanical repair of osteonecrosis of the femoral head than free vascularized fibular graft: A case-control study.](https://www.ncbi.nlm.nih.gov/pubmed/31127611),Metal trabecular bone reconstruction system better improves clinical efficacy and biomechanical repair of osteonecrosis of the femoral head than free vascularized fibular graft: A case-control study.
anterior cruciate ligament injury mechanisms kinetic chain linkage effect proximal joint stiffness distal knee control bilateral landings,unknown,33.4% TENDON/LIGAMENT; 25.0% JOINT/CARTILAGE,"Cannon J, Cambridge EDJ, McGill SM,",*The Journal of orthopaedic and sports physical therapy*,* [Anterior Cruciate Ligament Injury Mechanisms and the Kinetic Chain Linkage: The Effect of Proximal Joint Stiffness on Distal Knee Control During Bilateral Landings.](https://www.ncbi.nlm.nih.gov/pubmed/31130059),Anterior Cruciate Ligament Injury Mechanisms and the Kinetic Chain Linkage: The Effect of Proximal Joint Stiffness on Distal Knee Control During Bilateral Landings.
age related differences δ⁹ tetrahydrocannabinol induced antinociception female male rats,unknown,19.9% SPORT/EXERCISE; 19.6% COMPARATIVE,"Craft RM, Britch SC, Buzitis NW, Clowers BH,",*Experimental and clinical psychopharmacology*,* [Age-related differences in Δ⁹-tetrahydrocannabinol-induced antinociception in female and male rats.](https://www.ncbi.nlm.nih.gov/pubmed/31120286),Age-related differences in Δ⁹-tetrahydrocannabinol-induced antinociception in female and male rats.
new methodology design manufacturing customized silicone partial foot prosthesis using indirect additive manufacturing,unknown,20.4% GAIT/LOCOMOTION; 19.5% METHODS,"Abdelaal O, Darwish S, Abd Elmougoud K, Aldahash S,",*The International journal of artificial organs*,* [A new methodology for design and manufacturing of a customized silicone partial foot prosthesis using indirect additive manufacturing.](https://www.ncbi.nlm.nih.gov/pubmed/31126192),A new methodology for design and manufacturing of a customized silicone partial foot prosthesis using indirect additive manufacturing.
influence locomotor training dynamic balance steady state walking post stroke,unknown,55.0% REHABILITATION; 44.1% GAIT/LOCOMOTION,"Vistamehr A, Kautz SA, Bowden MG, Neptune RR,",*Journal of biomechanics*,* [The influence of locomotor training on dynamic balance during steady-state walking post-stroke.](https://www.ncbi.nlm.nih.gov/pubmed/30981426),The influence of locomotor training on dynamic balance during steady-state walking post-stroke.
p2x7r panx 1 channel relevance zebrafish larvae copper induced inflammation model,unknown,21.6% CELLULAR/SUBCELLULAR; 15.5% COMPARATIVE,"de Marchi FO, Cruz FF, Menezes FP, Kist LW, Bogo MR, Morrone FB,",*Comparative biochemistry and physiology. Toxicology & pharmacology : CBP*,* [P2X7R and PANX-1 channel relevance in a zebrafish larvae copper-induced inflammation model.](https://www.ncbi.nlm.nih.gov/pubmed/31136852),P2X7R and PANX-1 channel relevance in a zebrafish larvae copper-induced inflammation model.
