title,keywords,everything,topic,authors,journal,links
lumbar spinal surgery improves locomotive syndrome in elderly patients with lumbar spinal canal stenosis: a multicenter prospective study.,,lumbar spinal surgery improves locomotive syndrome in elderly patients with lumbar spinal canal stenosis: a multicenter prospective study.,ORTHOPAEDICS/SPINE,"Fujita N, Michikawa T, Miyamoto A, Sakurai A, Otaka Y, Suzuki S, Tsuji O, Nagoshi N, Okada E, Yagi M, Tsuji T, Kono H, Ishii K, Nakamura M, Matsumoto M, Watanabe K,",*Journal of orthopaedic science : official journal of the Japanese Orthopaedic Association*,* [Lumbar spinal surgery improves locomotive syndrome in elderly patients with lumbar spinal canal stenosis: A multicenter prospective study.](https://www.ncbi.nlm.nih.gov/pubmed/30982707)
"modic i changes size increase from supine to standing mri correlates with increase in pain intensity in standing position: uncovering the ""biomechanical stress"" and ""active discopathy"" theories in low back pain.",low back pain modic changes weight-bearing mri,"modic i changes size increase from supine to standing mri correlates with increase in pain intensity in standing position: uncovering the ""biomechanical stress"" and ""active discopathy"" theories in low back pain.",ORTHOPAEDICS/SPINE,"Splendiani A, Bruno F, Marsecano C, Arrigoni F, Di Cesare E, Barile A, Masciocchi C,","*European spine journal : official publication of the European Spine Society, the European Spinal Deformity Society, and the European Section of the Cervical Spine Research Society*","* [Modic I changes size increase from supine to standing MRI correlates with increase in pain intensity in standing position: uncovering the ""biomechanical stress"" and ""active discopathy"" theories in low back pain.](https://www.ncbi.nlm.nih.gov/pubmed/30982938)"
analysis of cervical spine immobilization during patient transport in emergency medical services.,cervical collar cervical spine emergency medical service spine board vacuum mattress,analysis of cervical spine immobilization during patient transport in emergency medical services.,ORTHOPAEDICS/SPINE,"Nolte PC, Uzun DD, Häske D, Weerts J, Münzberg M, Rittmann A, Grützner PA, Kreinest M,",*European journal of trauma and emergency surgery : official publication of the European Trauma Society*,* [Analysis of cervical spine immobilization during patient transport in emergency medical services.](https://www.ncbi.nlm.nih.gov/pubmed/31030223)
biomechanical properties of pedicle screw fixation augmented with allograft bone particles in osteoporotic vertebrae: different sizes and amounts.,allograft biochemical phenomena bone transplantation osteoporosis pedicle screws,biomechanical properties of pedicle screw fixation augmented with allograft bone particles in osteoporotic vertebrae: different sizes and amounts.,ORTHOPAEDICS/SPINE,"Jia C, Zhang R, Xing T, Gao H, Li H, Dong F, Zhang J, Ge P, Song P, Xu P, Zhang H, Shen C,",*The spine journal : official journal of the North American Spine Society*,* [Biomechanical properties of pedicle screw fixation augmented with allograft bone particles in osteoporotic vertebrae: different sizes and amounts.](https://www.ncbi.nlm.nih.gov/pubmed/31009768)
differences in the kinematics of the cervical and thoracic spine during functional movement in individuals with or without chronic neck pain: a systematic review.,biomechanical phenomena cervical vertebrae kinematics neck,differences in the kinematics of the cervical and thoracic spine during functional movement in individuals with or without chronic neck pain: a systematic review.,ORTHOPAEDICS/SPINE,"Moghaddas D, de Zoete RMJ, Edwards S, Snodgrass SJ,",*Physiotherapy*,* [Differences in the kinematics of the cervical and thoracic spine during functional movement in individuals with or without chronic neck pain: a systematic review.](https://www.ncbi.nlm.nih.gov/pubmed/31005251)
biomechanics and clinical application of translaminar screws fixation in spine: a review of the literature.,axial spine posterior fixation posterior fusion subaxial spine thoracic spine translaminar screw,biomechanics and clinical application of translaminar screws fixation in spine: a review of the literature.,ORTHOPAEDICS/SPINE,"Chan JJ, Shepard N, Cho W,",*Global spine journal*,* [Biomechanics and Clinical Application of Translaminar Screws Fixation in Spine: A Review of the Literature.](https://www.ncbi.nlm.nih.gov/pubmed/30984502)
validation of a freehand technique for cortical bone trajectory screws in the lumbar spine.,cbt = cortical bone trajectory lis = less invasive surgery cortical bone trajectory freehand technique image guidance lumbar pedicle screw surgical technique,validation of a freehand technique for cortical bone trajectory screws in the lumbar spine.,ORTHOPAEDICS/SPINE,"Tan Z, McLachlin S, Whyne C, Finkelstein J,",*Journal of neurosurgery. Spine*,* [Validation of a freehand technique for cortical bone trajectory screws in the lumbar spine.](https://www.ncbi.nlm.nih.gov/pubmed/31003218)
asymmetric biomechanical characteristics of the paravertebral muscle in adolescent idiopathic scoliosis.,adolescent idiopathic scoliosis biomechanics paravertebral muscle,asymmetric biomechanical characteristics of the paravertebral muscle in adolescent idiopathic scoliosis.,ORTHOPAEDICS/SPINE,"Liu Y, Pan A, Hai Y, Li W, Yin L, Guo R,","*Clinical biomechanics (Bristol, Avon)*",* [Asymmetric biomechanical characteristics of the paravertebral muscle in adolescent idiopathic scoliosis.](https://www.ncbi.nlm.nih.gov/pubmed/31004964)
"biomechanical analysis of cortical versus pedicle screw fixation stability in tlif, plif, and xlif applications.",cortical screw lumbar interbody fusion screw fixation screw trajectory,"biomechanical analysis of cortical versus pedicle screw fixation stability in tlif, plif, and xlif applications.",ORTHOPAEDICS/SPINE,"Nomoto EK, Fogel GR, Rasouli A, Bundy JV, Turner AW,",*Global spine journal*,"* [Biomechanical Analysis of Cortical Versus Pedicle Screw Fixation Stability in TLIF, PLIF, and XLIF Applications.](https://www.ncbi.nlm.nih.gov/pubmed/30984495)"
recurrent lumbar disc herniation: a review.,discectomy fusion lumbar disc herniation microdiscectomy recurrent herniation,recurrent lumbar disc herniation: a review.,ORTHOPAEDICS/SPINE,"Shepard N, Cho W,",*Global spine journal*,* [Recurrent Lumbar Disc Herniation: A Review.](https://www.ncbi.nlm.nih.gov/pubmed/30984501)
biomechanical testing of trans-humeral all-suture anchors for rotator cuff repair.,all-suture anchors biomechanical testing rotator cuff repair,biomechanical testing of trans-humeral all-suture anchors for rotator cuff repair.,ORTHOPAEDICS/SURGERY,"Aramberri-Gutiérrez M, Martínez-Menduiña A, Boyle S, Valencia M,",*Shoulder & elbow*,* [Biomechanical testing of trans-humeral all-suture anchors for rotator cuff repair.](https://www.ncbi.nlm.nih.gov/pubmed/31019566)
position of the rotator cuff footprint in relation to the centre of rotation of the humeral head.,biomechanics rotator cuff shoulder,position of the rotator cuff footprint in relation to the centre of rotation of the humeral head.,ORTHOPAEDICS/SURGERY,"Caruana E, Wigderowitz C, Harrold F,",*Shoulder & elbow*,* [Position of the rotator cuff footprint in relation to the centre of rotation of the humeral head.](https://www.ncbi.nlm.nih.gov/pubmed/31019559)
kinematically aligned total knee arthroplasty reproduces more native rollback and laxity than mechanically aligned total knee arthroplasty: a matched pair cadaveric study.,biomechanics cadaver study kinematic alignment laxity mechanical alignment total knee arthroplasty,kinematically aligned total knee arthroplasty reproduces more native rollback and laxity than mechanically aligned total knee arthroplasty: a matched pair cadaveric study.,ORTHOPAEDICS/SURGERY,"Koh IJ, Lin CC, Patel NA, Chalmers CE, Maniglio M, Han SB, McGarry MH, Lee TQ,","*Orthopaedics & traumatology, surgery & research : OTSR*",* [Kinematically aligned total knee arthroplasty reproduces more native rollback and laxity than mechanically aligned total knee arthroplasty: A matched pair cadaveric study.](https://www.ncbi.nlm.nih.gov/pubmed/31006644)
a systematic review of proposed rehabilitation guidelines following anatomic and reverse shoulder arthroplasty.,arthroplasty protocol rehabilitation replacement shoulder,a systematic review of proposed rehabilitation guidelines following anatomic and reverse shoulder arthroplasty.,ORTHOPAEDICS/SURGERY,"Bullock GS, Garrigues GE, Ledbetter L, Kennedy J,",*The Journal of orthopaedic and sports physical therapy*,* [A Systematic Review of Proposed Rehabilitation Guidelines Following Anatomic and Reverse Shoulder Arthroplasty.](https://www.ncbi.nlm.nih.gov/pubmed/31021690)
biomechanical investigation of dynamic hip screw and wire fixation on an unstable intertrochanteric fracture.,dynamic hip screw intertrochanteric hip fracture lesser trochanteric fragment unstable type wire,biomechanical investigation of dynamic hip screw and wire fixation on an unstable intertrochanteric fracture.,ORTHOPAEDICS/SURGERY,"Wu HF, Chang CH, Wang GJ, Lai KA, Chen CH,",*Biomedical engineering online*,* [Biomechanical investigation of dynamic hip screw and wire fixation on an unstable intertrochanteric fracture.](https://www.ncbi.nlm.nih.gov/pubmed/31018860)
congenital pseudarthrosis of the tibia: biological and biomechanical considerations to achieve union and prevent refracture.,congenital pseudarthrosis of the tibia cross-union neurofibromatosis,congenital pseudarthrosis of the tibia: biological and biomechanical considerations to achieve union and prevent refracture.,ORTHOPAEDICS/SURGERY,"Paley D,",*Journal of children's orthopaedics*,* [Congenital pseudarthrosis of the tibia: biological and biomechanical considerations to achieve union and prevent refracture.](https://www.ncbi.nlm.nih.gov/pubmed/30996736)
comparison of less invasive stabilization system plate and retrograde intramedullary nail in the fixation of femoral supracondylar fractures in the elderly: a biomechanical study.,biomechanical testing comminuted femoral supracondylar fracture less invasive stabilization system plate retrograde intramedullary nail,comparison of less invasive stabilization system plate and retrograde intramedullary nail in the fixation of femoral supracondylar fractures in the elderly: a biomechanical study.,ORTHOPAEDICS/SURGERY,"Du YR, Ma JX, Wang S, Sun L, Wang Y, Lu B, Bai HH, Hu YC, Ma XL,",*Orthopaedic surgery*,* [Comparison of Less Invasive Stabilization System Plate and Retrograde Intramedullary Nail in the Fixation of Femoral Supracondylar Fractures in the Elderly: A Biomechanical Study.](https://www.ncbi.nlm.nih.gov/pubmed/30989797)
rationale for biologic augmentation of rotator cuff repairs.,,rationale for biologic augmentation of rotator cuff repairs.,ORTHOPAEDICS/SURGERY,"Mirzayan R, Weber AE, Petrigliano FA, Chahla J,",*The Journal of the American Academy of Orthopaedic Surgeons*,* [Rationale for Biologic Augmentation of Rotator Cuff Repairs.](https://www.ncbi.nlm.nih.gov/pubmed/31008877)
report on three porcine proof-of-concept studies: comparison of a dermatome with a rotating excision ring with conventional dermatomes for the harvesting of stsgs and excision of necrosis.,,report on three porcine proof-of-concept studies: comparison of a dermatome with a rotating excision ring with conventional dermatomes for the harvesting of stsgs and excision of necrosis.,ORTHOPAEDICS/SURGERY,"Hermans MH, Pittinger T, Bailey K, Powell HM,",*Wounds : a compendium of clinical research and practice*,* [Report on Three Porcine Proof-of-concept Studies: Comparison of a Dermatome With a Rotating Excision Ring With Conventional Dermatomes for the Harvesting of STSGs and Excision of Necrosis.](https://www.ncbi.nlm.nih.gov/pubmed/30990780)
fracture obliquity is a predictor for loss of reduction in supracondylar humeral fractures in older children.,,fracture obliquity is a predictor for loss of reduction in supracondylar humeral fractures in older children.,ORTHOPAEDICS/SURGERY,"Segal D, Cobb L, Little KJ,",*Journal of pediatric orthopedics. Part B*,* [Fracture obliquity is a predictor for loss of reduction in supracondylar humeral fractures in older children.](https://www.ncbi.nlm.nih.gov/pubmed/31033871)
external fixation of the lower extremities: biomechanical perspective and recent innovations.,biomechanics deformity correction external fixation fracture fixation hexapod history lower extremities review stiffness,external fixation of the lower extremities: biomechanical perspective and recent innovations.,ORTHOPAEDICS/SURGERY,"Bliven EK, Greinwald M, Hackl S, Augat P,",*Injury*,* [External fixation of the lower extremities: Biomechanical perspective and recent innovations.](https://www.ncbi.nlm.nih.gov/pubmed/31018903)
anatomic reinforced medial meniscal root reconstruction with gracilis autograft.,,anatomic reinforced medial meniscal root reconstruction with gracilis autograft.,ORTHOPAEDICS/SURGERY,"Holmes SW, Huff LW, Barnes AJ, Baier AJ,",*Arthroscopy techniques*,* [Anatomic Reinforced Medial Meniscal Root Reconstruction With Gracilis Autograft.](https://www.ncbi.nlm.nih.gov/pubmed/31016123)
cannulated screw prominence in tension band wiring of patella fractures increases fracture gapping: a cadaver study.,,cannulated screw prominence in tension band wiring of patella fractures increases fracture gapping: a cadaver study.,ORTHOPAEDICS/SURGERY,"Avery MC, Jo S, Chang A, Ricci WM, McAndrew C, Miller AN, Tang S,",*Clinical orthopaedics and related research*,* [Cannulated Screw Prominence in Tension Band Wiring of Patella Fractures Increases Fracture Gapping: A Cadaver Study.](https://www.ncbi.nlm.nih.gov/pubmed/30998643)
in utero efavirenz exposure and neurodevelopmental outcomes in hiv-exposed uninfected children in botswana.,,in utero efavirenz exposure and neurodevelopmental outcomes in hiv-exposed uninfected children in botswana.,ORTHOPAEDICS/SURGERY,"Cassidy AR, Williams PL, Leidner J, Mayondi G, Ajibola G, Makhema J, Holding PA, Powis KM, Batlang O, Petlo C, Shapiro R, Kammerer B, Lockman S,",*The Pediatric infectious disease journal*,* [In Utero Efavirenz Exposure and Neurodevelopmental Outcomes in HIV-exposed Uninfected Children in Botswana.](https://www.ncbi.nlm.nih.gov/pubmed/30985518)
correlation between preoperative imaging parameters and postoperative basic kinematics-based functional outcome in patients with tibial plateau fractures.,basic spatio-temporal gait parameters functional outcome preoperative imaging tibial plateau fractures,correlation between preoperative imaging parameters and postoperative basic kinematics-based functional outcome in patients with tibial plateau fractures.,ORTHOPAEDICS/SURGERY,"Warschawski Y, Drexler M, Batko B, Elias S, Goldstein Y, Frenkel Rutenberg T, Schermann H, Steinberg EL,","*Clinical biomechanics (Bristol, Avon)*",* [Correlation between preoperative imaging parameters and postoperative basic kinematics-based functional outcome in patients with tibial plateau fractures.](https://www.ncbi.nlm.nih.gov/pubmed/31005694)
mid-term outcomes of titanium modular neck femoral stems in revision total hip arthroplasty.,revision total hip arthroplasty (revision tha) clinical and radiographic outcome implant survival modular neck modular stem,mid-term outcomes of titanium modular neck femoral stems in revision total hip arthroplasty.,ORTHOPAEDICS/SURGERY,"Ouanezar H, Jalaguier T, Franck F, Pibarot V, Bothorel H, Saffarini M, Piton JP,",*Annals of translational medicine*,* [Mid-term outcomes of titanium modular neck femoral stems in revision total hip arthroplasty.](https://www.ncbi.nlm.nih.gov/pubmed/31019942)
the modified resisted internal rotation test for detection of gluteal tendon tears.,,the modified resisted internal rotation test for detection of gluteal tendon tears.,ORTHOPAEDICS/SURGERY,"Walker-Santiago R, Ortiz-Declet V, Maldonado DR, Wojnowski NM, Domb BG,",*Arthroscopy techniques*,* [The Modified Resisted Internal Rotation Test for Detection of Gluteal Tendon Tears.](https://www.ncbi.nlm.nih.gov/pubmed/31019887)
a biomechanical comparison of the arciero and laprade reconstruction for posterolateral corner knee injuries.,knee multiligament injury posterolateral corner reconstruction,a biomechanical comparison of the arciero and laprade reconstruction for posterolateral corner knee injuries.,ORTHOPAEDICS/SURGERY,"Treme GP, Salas C, Ortiz G, Gill GK, Johnson PJ, Menzer H, Richter DL, Qeadan F, Wascher DC, Schenck RC,",*Orthopaedic journal of sports medicine*,* [A Biomechanical Comparison of the Arciero and LaPrade Reconstruction for Posterolateral Corner Knee Injuries.](https://www.ncbi.nlm.nih.gov/pubmed/31019985)
biomechanical analysis of medial-row all-suture suture anchor fixation for rotator cuff repair in a pair-matched cadaveric model.,,biomechanical analysis of medial-row all-suture suture anchor fixation for rotator cuff repair in a pair-matched cadaveric model.,ORTHOPAEDICS/SURGERY,"Bernardoni ED, Frank RM, Veera SS, Waterman BR, Griffin JW, Shewman EF, Cole BJ, Romeo AA, Verma NN,",*Arthroscopy : the journal of arthroscopic & related surgery : official publication of the Arthroscopy Association of North America and the International Arthroscopy Association*,* [Biomechanical Analysis of Medial-Row All-Suture Suture Anchor Fixation for Rotator Cuff Repair in a Pair-Matched Cadaveric Model.](https://www.ncbi.nlm.nih.gov/pubmed/31000387)
"minimally invasive, arthroscopic-assisted, anatomic posterolateral corner reconstruction.",,"minimally invasive, arthroscopic-assisted, anatomic posterolateral corner reconstruction.",ORTHOPAEDICS/SURGERY,"Hermanowicz K, Malinowski K, Góralczyk A, Guszczyn T, LaPrade RF,",*Arthroscopy techniques*,"* [Minimally Invasive, Arthroscopic-Assisted, Anatomic Posterolateral Corner Reconstruction.](https://www.ncbi.nlm.nih.gov/pubmed/31019882)"
biomechanical analysis of latissimus dorsi tendon transfer with and without superior capsule reconstruction using dermal allograft.,superior capsule reconstruction cadaveric study latissimus dorsi subacromial contact pressure superior translation tendon transfer,biomechanical analysis of latissimus dorsi tendon transfer with and without superior capsule reconstruction using dermal allograft.,ORTHOPAEDICS/SURGERY,"Omid R, Stone MA, Lin CC, Patel NA, Itami Y, McGarry MH, Lee TQ,",*Journal of shoulder and elbow surgery*,* [Biomechanical analysis of latissimus dorsi tendon transfer with and without superior capsule reconstruction using dermal allograft.](https://www.ncbi.nlm.nih.gov/pubmed/31029520)
posterolateral plate fixation with pantalarlock<sup>®</sup> is more stable than nail fixation in tibiotalocalcaneal arthrodesis in a biomechanical cadaver study.,ankle arthrosis arthrodesis biomechanical testing hind foot deformity nail arthrodesis neuropathic hind foot deformity osteoporosis plate arthrodesis,posterolateral plate fixation with pantalarlock<sup>®</sup> is more stable than nail fixation in tibiotalocalcaneal arthrodesis in a biomechanical cadaver study.,ORTHOPAEDICS/SURGERY,"Gutteck N, Schilde S, Reichel M, Holtz A, Sahmel O, Hinz P, Kielstein H, Lange J, Delank KS, Martin H,",*Foot and ankle surgery : official journal of the European Society of Foot and Ankle Surgeons*,* [Posterolateral plate fixation with Pantalarlock<sup>®</sup> is more stable than nail fixation in tibiotalocalcaneal arthrodesis in a biomechanical cadaver study.](https://www.ncbi.nlm.nih.gov/pubmed/31031148)
the influence of radiographic markers of biomechanical variables on outcomes in reverse shoulder arthroplasty.,biomechanics acromial index critical shoulder angle outcomes range of motion reverse shoulder arthroplasty,the influence of radiographic markers of biomechanical variables on outcomes in reverse shoulder arthroplasty.,ORTHOPAEDICS/SURGERY,"Roberson TA, Shanley E, Abildgaard JT, Granade CM, Adams KJ, Griscom JT, Hunt Q, Nix Q, Kissenberth MJ, Tolan SJ, Hawkins RJ, Tokish JM,",*JSES open access*,* [The influence of radiographic markers of biomechanical variables on outcomes in reverse shoulder arthroplasty.](https://www.ncbi.nlm.nih.gov/pubmed/30984894)
first results of multicortical screw anchoring compared with conventional bicortical screw placement in the sacrum: a biomechanical investigation of a new screw design.,cement augmentation pedicle screw screw fixation screw loosening spondylodesis,first results of multicortical screw anchoring compared with conventional bicortical screw placement in the sacrum: a biomechanical investigation of a new screw design.,ORTHOPAEDICS/SURGERY,"Grevenstein D, Meyer C, Wegmann K, Hackl M, Bredow J, Eysel P, Prescher A, Scheyerer MJ,","*Clinical biomechanics (Bristol, Avon)*",* [First results of multicortical screw anchoring compared with conventional bicortical screw placement in the sacrum: A biomechanical investigation of a new screw design.](https://www.ncbi.nlm.nih.gov/pubmed/31005693)
biomechanical comparison between solid and cannulated intramedullary devices for midshaft clavicle fixation.,cannulated screw intramedullary device midshaft clavicle fracture,biomechanical comparison between solid and cannulated intramedullary devices for midshaft clavicle fixation.,ORTHOPAEDICS/SURGERY,"Wang SH, Lin HJ, Shen HC, Pan RY, Yang JJ,",*BMC musculoskeletal disorders*,* [Biomechanical comparison between solid and cannulated intramedullary devices for midshaft clavicle fixation.](https://www.ncbi.nlm.nih.gov/pubmed/31027505)
single sessions of high-definition transcranial direct current stimulation do not alter lower extremity biomechanical or corticomotor response variables post-stroke.,hd-tdcs tms anodal brain stimulation cathodal gait mobility tdcs,single sessions of high-definition transcranial direct current stimulation do not alter lower extremity biomechanical or corticomotor response variables post-stroke.,REHABILITATION,"Kindred JH, Kautz SA, Wonsetler EC, Bowden MG,",*Frontiers in neuroscience*,* [Single Sessions of High-Definition Transcranial Direct Current Stimulation Do Not Alter Lower Extremity Biomechanical or Corticomotor Response Variables Post-stroke.](https://www.ncbi.nlm.nih.gov/pubmed/31031579)
sarcopenia and lower limb pain are additively related to motor function and a history of falls and fracture in community-dwelling elderly people.,community elderly pain sarcopenia,sarcopenia and lower limb pain are additively related to motor function and a history of falls and fracture in community-dwelling elderly people.,REHABILITATION,"Maruya K, Fujita H, Arai T, Asahi R, Morita Y, Ishibashi H,",*Osteoporosis and sarcopenia*,* [Sarcopenia and lower limb pain are additively related to motor function and a history of falls and fracture in community-dwelling elderly people.](https://www.ncbi.nlm.nih.gov/pubmed/31008375)
differences in muscle activity and fatigue of the upper limb between task-specific training and robot assisted training among individuals post stroke.,electromyography occupational therapy rehabilitation,differences in muscle activity and fatigue of the upper limb between task-specific training and robot assisted training among individuals post stroke.,REHABILITATION,"Shahar N, Schwartz I, Portnoy S,",*Journal of biomechanics*,* [Differences in muscle activity and fatigue of the upper limb between Task-Specific training and robot assisted training among individuals post stroke.](https://www.ncbi.nlm.nih.gov/pubmed/30982537)
artificial neural network learns clinical assessment of spasticity in modified ashworth scale.,artificial intelligence modified ashworth scale relevance analysis spasticity assessment,artificial neural network learns clinical assessment of spasticity in modified ashworth scale.,REHABILITATION,"Park JH, Kim Y, Lee KJ, Yoon YS, Kang SH, Kim H, Park HS,",*Archives of physical medicine and rehabilitation*,* [Artificial Neural Network Learns Clinical Assessment of Spasticity in Modified Ashworth Scale.](https://www.ncbi.nlm.nih.gov/pubmed/31009599)
a randomized and controlled crossover study investigating the improvement of walking and posture functions in chronic stroke patients using hal exoskeleton - the halestro study (hal-exoskeleton stroke study).,exoskeleton hybrid assistive limb locomotor training physiotherapeutic approach stroke rehabilitation,a randomized and controlled crossover study investigating the improvement of walking and posture functions in chronic stroke patients using hal exoskeleton - the halestro study (hal-exoskeleton stroke study).,REHABILITATION,"Sczesny-Kaiser M, Trost R, Aach M, Schildhauer TA, Schwenkreis P, Tegenthoff M,",*Frontiers in neuroscience*,* [A Randomized and Controlled Crossover Study Investigating the Improvement of Walking and Posture Functions in Chronic Stroke Patients Using HAL Exoskeleton - The HALESTRO Study (HAL-Exoskeleton STROke Study).](https://www.ncbi.nlm.nih.gov/pubmed/30983953)
effects of performance-based training on gait and balance in individuals with incomplete spinal cord injury.,sci balance gait locomotor training performance,effects of performance-based training on gait and balance in individuals with incomplete spinal cord injury.,REHABILITATION,"Neville BT, Murray D, Rosen KB, Bryson CA, Collins JP, Guccione AA,",*Archives of physical medicine and rehabilitation*,* [Effects of Performance-Based Training on Gait and Balance in Individuals with Incomplete Spinal Cord Injury.](https://www.ncbi.nlm.nih.gov/pubmed/31026461)
