title,topic,pred_val,authors,journal,links,full_title,abstract
involvement d1 d2 like dopamine receptors within rat nucleus accumbens maintenance morphine rewarding properties rats,NEURAL,85.7% NEURAL; 2.1% CELLULAR/SUBCELLULAR; 1.9% TISSUE/BIOMATERIAL,"Namvar P, Zarrabian S, Nazari-Serenjeh F, Sadeghzadeh F, Haghparast A,",*Behavioral neuroscience*,* [Involvement of D1- and D2-like dopamine receptors within the rat nucleus accumbens in the maintenance of morphine rewarding properties in the rats.](https://www.ncbi.nlm.nih.gov/pubmed/31424230),Involvement of D1- and D2-like dopamine receptors within the rat nucleus accumbens in the maintenance of morphine rewarding properties in the rats.,"Previous studies on drug abuse have shown that response to drug-associated cues exist during prolonged abstinence. In succession to previous investigations in our laboratory on morphine dependence and our research on acquisition and expression phases of morphine-conditioned place preference (CPP), in this study we attempt to determine the effects of intraaccumbal administration of SCH-23390, as a D1-like receptor antagonist, and sulpiride, as a D2-like receptor antagonist, in the maintenance of morphine-induced CPP in rats. Seventy-nine adult male Wistar rats weighing 200-280 g were bilaterally implanted with cannulas into the nucleus accumbens. During the 3-day conditioning phase, the animals received daily subcutaneous administration of morphine (5 mg/kg). CPP score and locomotor activity of animals were recorded by Ethovision software. Different doses (0.25, 1, 4 μg per 0.5 μL vehicle) of D1- and D2-like antagonists were bilateral injected daily after the expression phase and during the extinction phase. Our findings revealed that intraaccumbal administration of D1-like and D2-like antagonists after the CPP test shortened the extinction phase in the rats. The results suggested that the existence of the dopamine receptors in the nucleus accumbens was important for the maintenance of morphine-rewarding properties during the extinction phase. Therefore, dopamine receptors may be considered as a promising therapeutic agent in preventing the maintenance of morphine-rewarding effects in dependent individuals. (PsycINFO Database Record (c) 2019 APA, all rights reserved)."
classical conditioning antidepressant placebo effects mice,NEURAL,20.0% NEURAL; 13.1% MODELING; 8.5% METHODS,"Krimmel SR, Zanos P, Georgiou P, Colloca L, Gould TD,",*Psychopharmacology*,* [Classical conditioning of antidepressant placebo effects in mice.](https://www.ncbi.nlm.nih.gov/pubmed/31422429),Classical conditioning of antidepressant placebo effects in mice.,Placebo effects in human clinical trials for depression treatment are robust and often comparable to drug effects. Placebo effects are traditionally difficult to study in rodents due to the slow-onset action of classical antidepressant drugs. We hypothesized that the rapid antidepressant actions of ketamine would allow modeling antidepressant placebo effects in rodents.
involvement orexin receptors within hippocampal dentate gyrus morphine induced reinstatement food deprived rats,NEURAL,81.8% NEURAL; 2.6% COMPARATIVE; 2.3% CELLULAR/SUBCELLULAR,"Pourhamzeh M, Mozafari R, Jamali S, Motamedi F, Ahadi R, Haghparast A,",*Behavioural brain research*,* [Involvement of orexin receptors within the hippocampal dentate gyrus in morphine-induced reinstatement in food-deprived rats.](https://www.ncbi.nlm.nih.gov/pubmed/31422071),Involvement of orexin receptors within the hippocampal dentate gyrus in morphine-induced reinstatement in food-deprived rats.,"The orexinergic system is found to cooperate in mediating stress-induced drug relapse. The orexinergic terminals innervate neurons of the hippocampal dentate gyrus (DG) which is a key structure in the maintenance and reinstatement of drug addiction. However, the specific contribution of intra-DG orexin receptors to stress-induced reinstatement has not been completely known. In the current study, the effects of intra-DG administration of SB334867, an orexin-1 receptor (OX1R) antagonist, and TCS OX2 29, an orexin-2 receptor (OX2R) antagonist, were investigated on the reinstatement induced by a sub-threshold dose of morphine and food deprivation (FD) stress. Adult male rats received different doses of SB334867 or TCS OX2 29 (3, 10, and 30 nM/0.5 µl DMSO 12%) bilaterally into the DG in separate groups, following the acquisition and extinction of morphine-induced conditioned place preference (CPP). Then, the reinstatement was evaluated by the 24 h FD stress and/or a sub-threshold dose of morphine (0.5 mg/kg, s.c.). CPP scores and locomotor activities were recorded during the test. The findings indicated that pre-treatment with the highest dose of SB334867 (30 nM) and two higher doses of TCS OX2 29 (10 and 30 nM) blocked the sub-threshold dose and FD stress-induced reinstatement of morphine. The effect of TCS OX2 29 on reduction of reinstatement was more pronounced than that of SB334867. It suggests a role for the orexin receptors, especially OX2R within the DG region in the stress-induced reinstatement of morphine-seeking behaviours in extinguished rats."
hippocampal deletion na sub v sub 1 1 channels mice causes thermal seizures cognitive deficit characteristic dravet syndrome,NEURAL,68.1% NEURAL; 11.8% CELLULAR/SUBCELLULAR; 3.2% METHODS,"Stein RE, Kaplan JS, Li J, Catterall WA,",*Proceedings of the National Academy of Sciences of the United States of America*,* [Hippocampal deletion of Na<sub>V</sub>1.1 channels in mice causes thermal seizures and cognitive deficit characteristic of Dravet Syndrome.](https://www.ncbi.nlm.nih.gov/pubmed/31346088),Hippocampal deletion of Na<sub>V</sub>1.1 channels in mice causes thermal seizures and cognitive deficit characteristic of Dravet Syndrome.,"Dravet Syndrome is a severe childhood epileptic disorder caused by haploinsufficiency of the <i>SCN1A</i> gene encoding brain voltage-gated sodium channel Na<sub>V</sub>1.1. Symptoms include treatment-refractory epilepsy, cognitive impairment, autistic-like behavior, and premature death. The specific loci of Na<sub>V</sub>1.1 function in the brain that underlie these global deficits remain unknown. Here we specifically deleted <i>Scn1a</i> in the hippocampus using the Cre-Lox method in weanling mice. Local gene deletion caused selective reduction of inhibitory neurotransmission measured in dentate granule cells. Mice with local Na<sub>V</sub>1.1 reduction had thermally evoked seizures and spatial learning deficits, but they did not have abnormalities of locomotor activity or social interaction. Our results show that local gene deletion in the hippocampus can induce two of the most severe dysfunctions of Dravet Syndrome: Epilepsy and cognitive deficit. Considering these results, the hippocampus may be a potential target for future gene therapy for Dravet Syndrome."
celecoxib ibuprofen indomethacin alleviate depression like behavior induced interferon alfa mice,NEURAL,25.2% NEURAL; 16.7% VETERINARY/AGRICULTURAL; 9.8% REHABILITATION,"Mesripour A, Shahnooshi S, Hajhashemi V,",*Journal of complementary & integrative medicine*,"* [Celecoxib, ibuprofen, and indomethacin alleviate depression-like behavior induced by interferon-alfa in mice.](https://www.ncbi.nlm.nih.gov/pubmed/31421042)","Celecoxib, ibuprofen, and indomethacin alleviate depression-like behavior induced by interferon-alfa in mice.","Background Interferon-α (IFNα) therapy causes psychiatric side effects, including depression that may result in poor compliance of therapy. It is important to find alternative therapies for the prevention of IFNα induced depression. Non-steroidal anti-inflammatory drugs (NSAIDs) have been useful in depressive disorder. Therefore the effects of celecoxib, ibuprofen, and indomethacin were evaluated following IFNα-induced depression in mice. Methods Male albino mice weighing 26 ± 2 g were used. Depression was induced by IFNα (16 × 105 IU/kg, SC) for six consecutive days. Animals were first subject to the locomotor test, then the splash test and finally the forced swimming test (FST) on the 7th day. The NSAIDs were administered (IP) either one single dose before the test, or simultaneously with IFNα. Results locomotor activity was only impaired by ibuprofen high dose (75 mg/kg), thus it was not further evaluated. Following IFNα therapy depression-like behaviors were observed; significant changes during the splash test (grooming time 24 ± 7 sec vs. control 63 ± 7 sec), the FST (immobility time 166  ± 15 sec vs. control 128  ± 6 sec), and sucrose preference reduced to 64 ± 0.8%. The NSAIDs noticeably reduced the immobility time in FST, while grooming time was increased. Celecoxib and indomethacin single doses were effective while ibuprofen showed better antidepressant effects when it was administered along with IFNα. Conclusions The NSAIDs were able to prevent IFNα induced depression in mice. NSAIDs administration with IFNα does not interfere with clinical benefit effects of IFNα and they could also be useful to prevent IFNα psychiatric side effects, thus further clinical trials are suggested."
rubral modulation breathing,NEURAL,60.6% NEURAL; 9.1% CARDIOVASCULAR/CARDIOPULMONARY; 5.6% CELLULAR/SUBCELLULAR,"Ghali MGZ,",*Experimental physiology*,* [Rubral modulation of breathing.](https://www.ncbi.nlm.nih.gov/pubmed/31408227),Rubral modulation of breathing.,The red nucleus contributes importantly to modulation of respiratory output. Stimulation of red nucleus mediates respiratory phase transitions and inhibitory or excitatory responses of medullary inspiratory and expiratory units. Rubromedullary and rubrospinal projections to zones mediating respiratory output have been well demonstrated. Red nucleus is critically required in mediating hypoxic ventilatory depression and may represent a zone mediating integration of respiratory output with various behaviors.
feedback future motor neuron contributions central pattern generator function,NEURAL,97.6% NEURAL; 0.8% COMPARATIVE; 0.6% GAIT/LOCOMOTION,"Barkan CL, Zornik E,",*The Journal of experimental biology*,* [Feedback to the future: motor neuron contributions to central pattern generator function.](https://www.ncbi.nlm.nih.gov/pubmed/31420449),Feedback to the future: motor neuron contributions to central pattern generator function.,"Motor behaviors depend on neural signals in the brain. Regardless of where in the brain behavior patterns arise, the central nervous system sends projections to motor neurons, which in turn project to and control temporally appropriate muscle contractions; thus, motor neurons are traditionally considered the last relay from the central nervous system to muscles. However, in an array of species and motor systems, an accumulating body of evidence supports a more complex role of motor neurons in pattern generation. These studies suggest that motor neurons not only relay motor patterns to the periphery, but directly contribute to pattern generation by providing feedback to upstream circuitry. In spinal and hindbrain circuits in a variety of animals - including flies, worms, leeches, crustaceans, rodents, birds, fish, amphibians and mammals - studies have indicated a crucial role for motor neuron feedback in maintaining normal behavior patterns dictated by the activity of a central pattern generator. Hence, in this Review, we discuss literature examining the role of motor neuron feedback across many taxa and behaviors, and set out to determine the prevalence of motor neuron participation in motor circuits."
amelioration neurobehavioral cognitive abilities f1 progeny following dietary supplementation spirulina protein malnourished mothers,NEURAL,49.8% NEURAL; 12.2% COMPARATIVE; 7.6% VETERINARY/AGRICULTURAL,"Sinha S, Patro N, Patro IK,","*Brain, behavior, and immunity*",* [Amelioration of neurobehavioral and cognitive abilities of F1 progeny following dietary supplementation with Spirulina to protein malnourished mothers.](https://www.ncbi.nlm.nih.gov/pubmed/31425827),Amelioration of neurobehavioral and cognitive abilities of F1 progeny following dietary supplementation with Spirulina to protein malnourished mothers.,"Early life adversities (stress, infection and mal/undernutrition) can affect neurocognitive, hippocampal and immunological functioning of the brain throughout life. Substantial evidence suggests that maternal protein malnutrition contributes to the progression of neurocognitive abnormalities and psychopathologies in adolescence and adulthood in offspring. Maternal malnutrition is prevalent in low and middle resource populations. The present study was therefore undertaken to evaluate the effects of dietary Spirulina supplementation of protein malnourished mothers during pregnancy and lactation on their offspring's reflex, neurobehavioral and cognitive development. Spirulina is a Cyanobacterium and a major source of protein and is being used extensively as a dynamic nutraceutical against aging and neurodegeneration. Sprague Dawley rats were switched to low protein (8% protein) or normal protein (20% protein) diet for 15 days before conception. Spirulina was orally administered (400 mg/kg/b.wt.) to subgroups of pregnant females from the day of conception throughout the lactational period. We examined several parameters including reproductive performance of dams, physical development, postnatal reflex ontogeny, locomotor behavior, neuromuscular strength, anxiety, anhedonic behavior, cognitive abilities and microglia populations in the F1 progeny. The study showed improved reproductive performance of Spirulina supplemented protein malnourished dams, accelerated acquisition of neurological reflexes, better physical appearance, enhanced neuromuscular strength, improved spatial learning and memory and partly normalized PMN induced hyperactivity, anxiolytic and anhedonic behavior in offspring. These beneficial effects of Spirulina consumption were also accompanied by reduced microglial activation which might assist in restoring the behavioral and cognitive skills in protein malnourished F1 rats. Maternal Spirulina supplementation is therefore proposed as an economical nutraceutical/supplement to combat malnutrition associated behavioral and cognitive deficits."
optic disc shape patients long lasting unilateral esotropia exotropia,NEURAL,16.5% NEURAL; 11.1% TISSUE/BIOMATERIAL; 7.9% ORTHOPAEDICS/SPINE,"Shang K, Dai Y, Liu H, Qu X, Wen W, Jonas JB,",*BMC ophthalmology*,* [Optic disc shape in patients with long-lasting unilateral esotropia and exotropia.](https://www.ncbi.nlm.nih.gov/pubmed/31420011),Optic disc shape in patients with long-lasting unilateral esotropia and exotropia.,"Horizontal eye movements have been proposed to induce biomechanical stress and strain on optic nerve head. Since strabismus may lead to sustained adduction or abduction, we investigate the effects of long lasting unilateral horizontal strabismus on the morphology of optic disc."
cortical tau burden behavioural dysfunctions mice exposed monosodium glutamate early life,NEURAL,70.3% NEURAL; 7.3% COMPARATIVE; 3.3% CELLULAR/SUBCELLULAR,"Hassaan PS, Dief AE, Zeitoun TM, Baraka AM, Deacon RMJ, Elshorbagy A,",*PloS one*,* [Cortical tau burden and behavioural dysfunctions in mice exposed to monosodium glutamate in early life.](https://www.ncbi.nlm.nih.gov/pubmed/31412065),Cortical tau burden and behavioural dysfunctions in mice exposed to monosodium glutamate in early life.,"Although monosodium glutamate (MSG)-induced neurotoxicity has been recognized for decades, the potential similarities of the MSG model to Alzheimer's disease (AD)-type neuropathology have only recently been investigated. MSG-treated mice were examined behaviourally and histologically in relation to some features of AD. Four-week old mice received 5 subcutaneous MSG (2 g/kg) injections on alternate days, or saline. At age 10-12 weeks, they were given a battery of behavioural tests for species-typical behaviours and working memory. The mice were killed at 12 weeks and the brains excised. Accumulation of hyperphosphorylated tau protein was assessed in cortical and hippocampal neurons by immunohistochemistry, and in cerebral cortical homogenates. A 78% increase in cortical concentrations of phosphorylated tau protein was observed in the MSG mice. Intracellular hyperphosphorylated tau immunostaining was observed diffusely in the cortex and hippocampus, together with cortical atrophic neurons, extensive vacuolation and dysmorphic neuropil suggestive of spongiform neurodegeneration. Nest-building was significantly impaired, and spontaneous T-maze alternation was reduced, suggesting defective short-term working memory. Subcutaneous MSG treatment also induced a 56% reduction in exploratory head dips in a holeboard (P = 0.009), and a non-significant tendency for decreased burrowing behaviour (P = 0.085). These effects occurred in the absence of MSG-induced obesity or gross locomotor deficits. The findings point to subcutaneous MSG administration in early life as a cause of tau pathology and compromised species-typical behaviour in rodents. Determining whether MSG can be useful in modelling AD requires further studies of longer duration and full behavioural characterization."
undeveloped properties gaba neurons ventral tegmental area promote energy intake growth juvenile rats,NEURAL,47.1% NEURAL; 20.4% COMPARATIVE; 7.9% VETERINARY/AGRICULTURAL,"Maejima Y, Yokota S, Horita S, Shimomura K,",*Scientific reports*,* [The undeveloped properties of GABA neurons in the ventral tegmental area promote energy intake for growth in juvenile rats.](https://www.ncbi.nlm.nih.gov/pubmed/31413349),The undeveloped properties of GABA neurons in the ventral tegmental area promote energy intake for growth in juvenile rats.,"Juvenile animals show higher energy intake (EI) per body weight (BW) to meet the energy requirements for growth. However, the underlying mechanisms that induce high EI/BW in juvenile animals remain unknown. The EI from a control diet (CD) and high fat diet (HFD), as well as BW changes were compared between juvenile (3 weeks old) and adult (8 weeks old) rats. BW gain and EI were increased in the HFD-fed adult rats compared to the CD-fed adult rats. However, in the juvenile rats, there were no differences in BW gain and EI between the CD-fed and HFD-fed groups. The locomotor activity was significantly increased in HFD group compared with the CD group in juvenile, but not in adult rats. Gamma-aminobutyric acid (GABA) neurons in the VTA were found to remain undeveloped with less GABAergic input into dopamine neurons in the juvenile rats. The deletion of the VTA GABA neurons in the adult rats significantly increased CD consumption, but showed almost no change in HFD consumption. These data suggest that undeveloped properties of VTA GABA neurons in juvenile rats can promote higher EI regardless of high or less palatable feeding, and contribute to growth promotion."
mechanical coupling skin affects whisker movements tactile information encoding,NEURAL,67.7% NEURAL; 12.8% COMPARATIVE; 4.4% MODELING,"Ego-Stengel V, Abbasi A, Larroche M, Lassagne H, Boubenec Y, Shulz DE,",*Journal of neurophysiology*,* [Mechanical coupling through the skin affects whisker movements and tactile information encoding.](https://www.ncbi.nlm.nih.gov/pubmed/31411931),Mechanical coupling through the skin affects whisker movements and tactile information encoding.,"Rats use their whiskers to extract sensory information from their environment. While exploring, they analyze peripheral stimuli distributed over several whiskers. Previous studies have reported cross-whisker integration of information at several levels of the neuronal pathways from whisker follicles to the somatosensory cortex. Here, we have investigated the possible coupling between whiskers at a preneuronal level, transmitted by the skin and muscles between follicles. First, we have quantified the movement induced on one whisker by deflecting another whisker. Our results show significant mechanical coupling, predominantly when a given whisker's caudal neighbor in the same row is deflected. The magnitude of the effect was correlated with the diameter of the deflected whisker. In addition to changes in whisker angle, we observed curvature changes when the whisker shaft was constrained distally from the base. Second, we found that trigeminal ganglion neurons innervating a given whisker follicle fire action potentials in response to high-magnitude deflections of an adjacent whisker. This functional coupling also shows a bias towards the caudal neighbor located in the same row. Finally, we designed a two-whisker biomechanical model to investigate transmission of forces across follicles. Analysis of the whisker-follicle contact forces suggests that activation of mechanoreceptors in the ring sinus region could account for our electrophysiological results. The model can fully explain the observed caudal bias by the gradient in whisker diameter, with possible contribution of the intrinsic muscles connecting follicles. Overall, our study demonstrates the functional relevance of mechanical coupling on early information processing in the whisker system."
novel behavioural characteristics superoxide dismutase 1 g93a sod1 sup g93a sup mouse model amyotrophic lateral sclerosis include sex dependent phenotypes,NEURAL,91.2% NEURAL; 1.9% GAIT/LOCOMOTION; 1.4% CELLULAR/SUBCELLULAR,"Kreilaus F, Guerra S, Masanetz R, Menne V, Yerbury J, Karl T,","*Genes, brain, and behavior*",* [Novel behavioural characteristics of the superoxide dismutase 1 G93A (SOD1<sup>G93A</sup> ) mouse model of amyotrophic lateral sclerosis include sex-dependent phenotypes.](https://www.ncbi.nlm.nih.gov/pubmed/31412164),Novel behavioural characteristics of the superoxide dismutase 1 G93A (SOD1<sup>G93A</sup> ) mouse model of amyotrophic lateral sclerosis include sex-dependent phenotypes.,"Amyotrophic lateral sclerosis involves the rapid degeneration of upper and lower motor neurons leading to weakening and paralysis of voluntary movements. Mutations in copper-zinc superoxide dismutase 1 (SOD1) are a known genetic cause of ALS and the SOD1<sup>G93A</sup> mouse has been used extensively to investigate molecular mechanisms in ALS. In recent years, evidence suggests that amyotrophic lateral sclerosis and frontotemporal dementia form a spectrum disorder ranging from motor to cognitive dysfunctions. Thus, we tested male and female SOD1<sup>G93A</sup> mice for the first time prior to the onset of debilitating motor impairments in behavioural domains relevant to both amyotrophic lateral sclerosis and frontotemporal dementia. SOD1<sup>G93A</sup> males displayed reduced locomotion, exploration and increased anxiety-like behaviours compared to control males. Intermediate-term spatial memory was impaired in SOD1<sup>G93A</sup> females, while long-term spatial memory deficits as well as lower acoustic startle response and prepulse inhibition were identified in SOD1<sup>G93A</sup> mice of both sexes compared to respective controls. Interestingly, SOD1<sup>G93A</sup> males exhibited an increased conditioned cue freezing response. Nosing behaviours were also elevated in both male and female SOD1<sup>G93A</sup> when assessed in social paradigms. In conclusion, SOD1<sup>G93A</sup> mice exhibit a variety of sex-specific behavioural deficits beyond motor impairments supporting the notion of an amyotrophic lateral sclerosis-frontotemporal spectrum disorder. Thus, SOD1<sup>G93A</sup> mice may represent a useful model to test the efficacy of therapeutic interventions on clinical symptoms in addition to declining motor abilities. This article is protected by copyright. All rights reserved."
morphine coordinates sst pv interneurons prelimbic cortex disinhibit pyramidal neurons enhance reward,NEURAL,94.2% NEURAL; 2.6% CELLULAR/SUBCELLULAR; 0.6% TISSUE/BIOMATERIAL,"Jiang C, Wang X, Le Q, Liu P, Liu C, Wang Z, He G, Zheng P, Wang F, Ma L,",*Molecular psychiatry*,* [Morphine coordinates SST and PV interneurons in the prelimbic cortex to disinhibit pyramidal neurons and enhance reward.](https://www.ncbi.nlm.nih.gov/pubmed/31413370),Morphine coordinates SST and PV interneurons in the prelimbic cortex to disinhibit pyramidal neurons and enhance reward.,"Opioids, such as morphine, are clinic analgesics which induce euphoria. Morphine exposure modifies the excitability and functional interactions between neurons, while the underlying cellular and molecular mechanisms, especially how morphine assembles heterogeneous interneurons (INs) in prelimbic cortex (PrL) to mediate disinhibition and reward, are not clear. Using approaches of optogenetics, electrophysiology, and cell type-specific RNA-seq, we show that morphine attenuates the inhibitory synaptic transmission from parvalbumin<sup>+</sup> (PV)-INs onto pyramidal neurons in PrL via μ-opioid receptor (MOR) in PV-INs. Meanwhile, morphine enhances the inhibitory inputs from somatostatin<sup>+</sup> (SST)-INs onto PV-INs, and thus disinhibits pyramidal neurons via δ-opioid receptor (DOR)-dependent Rac1 upregulation in SST-INs. We show that MOR in PV-INs is required for morphine-induced behavioral sensitization, while DOR as well as Rac1 activity in SST-INs is required for morphine-induced conditioned place preference and hyper-locomotion. These results reveal that SST- and PV-INs, functioning in PrL as a disinhibitory architecture, are coordinated by morphine via different opioid receptors to disinhibit pyramidal neurons and enhance reward."
