title,topic,pred_val,authors,journal,links,full_title,abstract
design development novel oral care simulator training nurses,DENTAL/ORAL/FACIAL,68.7% DENTAL/ORAL/FACIAL; 5.5% MODELING; 5.2% METHODS,"Herath B, Dewmin GHS, Sukumaran S, Amarasinghe YWR, De Silva AHTE, Mitani A, Wijethunge D, Sampath WHP,",*IEEE transactions on bio-medical engineering*,* [Design and Development of a Novel Oral Care Simulator for the Training of Nurses.](https://www.ncbi.nlm.nih.gov/pubmed/31425012),Design and Development of a Novel Oral Care Simulator for the Training of Nurses.,"A Novel Oral Care Simulator was designed and developed to measure and visualise the facial and lingual forces exerted on teeth by the action of tooth brushing, considering the irregular geometry and structural composition of human dentition and the emulation of the realistic biomechanical deflection of the teeth."
controller walking derived humans recover perturbations,GAIT/LOCOMOTION,81.3% GAIT/LOCOMOTION; 9.6% ROBOTICS; 4.2% MODELING,"Joshi V, Srinivasan M,","*Journal of the Royal Society, Interface*",* [A controller for walking derived from how humans recover from perturbations.](https://www.ncbi.nlm.nih.gov/pubmed/31409232),A controller for walking derived from how humans recover from perturbations.,"Humans can walk without falling despite some external perturbations, but the control mechanisms by which this stability is achieved have not been fully characterized. While numerous walking simulations and robots have been constructed, no full-state walking controller for even a simple model of walking has been derived from human walking data. Here, to construct such a feedback controller, we applied thousands of unforeseen perturbations to subjects walking on a treadmill and collected data describing their recovery to normal walking. Using these data, we derived a linear controller to make the classical inverted pendulum model of walking respond to perturbations like a human. The walking model consists of a point-mass with two massless legs and can be controlled only through the appropriate placement of the foot and the push-off impulse applied along the trailing leg. We derived how this foot placement and push-off impulse are modulated in response to upper-body perturbations in various directions. This feedback-controlled biped recovers from perturbations in a manner qualitatively similar to human recovery. The biped can recover from perturbations over twenty times larger than deviations experienced during normal walking and the biped's stability is robust to uncertainties, specifically, large changes in body and feedback parameters."
heuristic based ankle exoskeleton control co adaptive assistance human locomotion,GAIT/LOCOMOTION,59.7% GAIT/LOCOMOTION; 28.3% REHABILITATION; 2.9% NEURAL,"Jackson RW, Collins SH,",*IEEE transactions on neural systems and rehabilitation engineering : a publication of the IEEE Engineering in Medicine and Biology Society*,* [Heuristic-Based Ankle Exoskeleton Control for Co-Adaptive Assistance of Human Locomotion.](https://www.ncbi.nlm.nih.gov/pubmed/31425120),Heuristic-Based Ankle Exoskeleton Control for Co-Adaptive Assistance of Human Locomotion.,"Assisting human locomotion with exoskeletons is challenging, largely due to the complexity of the neuromusculoskeletal system, the time-varying dynamics that accompany motor learning, and the uniqueness of every individual's response to device assistance. Assistance strategies designed to keep the human ""in-the-loop"" can help overcome many of these challenges. The purpose of this study was to develop a human-in-theloop assistance strategy that uses co-adaptive control to slowly and continuously respond to biomechanical changes thought to encode the user's needs. Online measurements of muscle activity and joint kinematics were used to guide the evolution of an exoskeleton torque pattern based on the following heuristics: 1) muscle activity that acts cooperatively with the exoskeleton indicates the user wants more torque; 2) muscle activity that acts antagonistically to the exoskeleton indicates the user wants less torque; and 3) torque should stop increasing if the user is not adapting. We applied our controller to tethered, bilateral ankle exoskeletons worn by na(ve participants as they walked on a treadmill at 1.25 ms..1 for 30 minutes. The evolved torque profiles reduced the root-mean-square of soleus muscle activity by 35 ± 12% and metabolic rate by 22 ± 8% compared to walking with the exoskeletons while they provided no torque. This was equivalent to a 9 ± 12% reduction in metabolic rate when compared to normal walking. Furthermore, the algorithm was responsive to changes in each user's coordination patterns. These results confirm the effectiveness of the controller and suggest a new approach to exoskeleton assistance aimed at fostering co-adaptation with the user. This technique might particularly benefit individuals with age-related muscle weakness."
gait people nonhealing diabetes related plantar ulcers,GAIT/LOCOMOTION,48.9% GAIT/LOCOMOTION; 30.1% REHABILITATION; 3.6% SPORT/EXERCISE,"Fernando ME, Crowther RG, Lazzarini PA, Sangla KS, Wearing S, Buttner P, Golledge J,",*Physical therapy*,* [Gait in People With Nonhealing Diabetes-Related Plantar Ulcers.](https://www.ncbi.nlm.nih.gov/pubmed/31411324),Gait in People With Nonhealing Diabetes-Related Plantar Ulcers.,Abnormalities in gait have been associated with high plantar pressures and diabetes-related plantar foot ulcers. Whether these are a transient response to the ulcer or are representative of long-term lower limb biomechanical abnormalities is currently unknown.
reducing metabolic rate walking running versatile portable exosuit,GAIT/LOCOMOTION,84.0% GAIT/LOCOMOTION; 4.1% SPORT/EXERCISE; 4.0% COMPARATIVE,"Kim J, Lee G, Heimgartner R, Arumukhom Revi D, Karavas N, Nathanson D, Galiana I, Eckert-Erdheim A, Murphy P, Perry D, Menard N, Choe DK, Malcolm P, Walsh CJ,","*Science (New York, N.Y.)*","* [Reducing the metabolic rate of walking and running with a versatile, portable exosuit.](https://www.ncbi.nlm.nih.gov/pubmed/31416958)","Reducing the metabolic rate of walking and running with a versatile, portable exosuit.","Walking and running have fundamentally different biomechanics, which makes developing devices that assist both gaits challenging. We show that a portable exosuit that assists hip extension can reduce the metabolic rate of treadmill walking at 1.5 meters per second by 9.3% and that of running at 2.5 meters per second by 4.0% compared with locomotion without the exosuit. These reduction magnitudes are comparable to the effects of taking off 7.4 and 5.7 kilograms during walking and running, respectively, and are in a range that has shown meaningful athletic performance changes. The exosuit automatically switches between actuation profiles for both gaits, on the basis of estimated potential energy fluctuations of the wearer's center of mass. Single-participant experiments show that it is possible to reduce metabolic rates of different running speeds and uphill walking, further demonstrating the exosuit's versatility."
handrail holding treadmill walking reduces locomotor learning able bodied persons,GAIT/LOCOMOTION,87.3% GAIT/LOCOMOTION; 11.4% REHABILITATION; 0.4% NEURAL,"Buurke TJW, Lamoth CJC, van der Woude LHV, den Otter R,",*IEEE transactions on neural systems and rehabilitation engineering : a publication of the IEEE Engineering in Medicine and Biology Society*,* [Handrail Holding during Treadmill Walking Reduces Locomotor Learning in Able-Bodied Persons.](https://www.ncbi.nlm.nih.gov/pubmed/31425041),Handrail Holding during Treadmill Walking Reduces Locomotor Learning in Able-Bodied Persons.,"Treadmills used for gait training in clinical rehabilitation and experimental settings are commonly fitted with handrails to assist or support persons in locomotor tasks. However, the effects of balance support through handrail holding on locomotor learning are unknown. Locomotor learning can be studied on split-belt treadmills, where participants walk on two parallel belts with asymmetric left and right belt speeds, to which they adapt their stepping pattern within a few minutes. The aim of this study was to determine how handrail holding affects the walking pattern during split-belt adaptation and after-effects in able-bodied persons. Fifty healthy young participants in five experimental groups were instructed to hold handrails, swing arms freely throughout the experiment or hold handrails during adaptation and swing arms freely during after-effects. Step length asymmetry and double support asymmetry were measured to assess the spatiotemporal walking pattern. The results showed that holding handrails during split-belt adaptation reduces magnitude of initial perturbation of step length asymmetry and reduces after-effects in step length asymmetry upon return to symmetric belt speeds. The findings of this study imply that balance support during gait training reduces locomotor learning, which should be considered in daily clinical gait practice and future research on locomotor learning."
fault accounts consequences falling living rheumatoid arthritis,JOINT/CARTILAGE,19.0% JOINT/CARTILAGE; 12.9% GAIT/LOCOMOTION; 9.2% METHODS,"Graham K, Birt L, MacGregor A, Watts L, Poland F,",*Musculoskeletal care*,"* [""It's my own fault"": Accounts and consequences of falling when living with rheumatoid arthritis.](https://www.ncbi.nlm.nih.gov/pubmed/31419006)","""It's my own fault"": Accounts and consequences of falling when living with rheumatoid arthritis.","Rheumatoid arthritis (RA) leads to biomechanical joint changes, which increases the risk of falling. The consequence of falling may be physical injury. However, the psychological consequences, including the fear of falling, can be equally important."
posterior shoulder tightness risk factor scapular malposition cadaveric biomechanical,JOINT/CARTILAGE,58.0% JOINT/CARTILAGE; 12.3% ORTHOPAEDICS/SURGERY; 8.4% SPORT/EXERCISE,"Mihata T, McGarry MH, Akeda M, Peterson AB, Hunter RC, Nguyen L, Neo M, Lee TQ,",*Journal of shoulder and elbow surgery*,* [Posterior shoulder tightness can be a risk factor of scapular malposition: a cadaveric biomechanical study.](https://www.ncbi.nlm.nih.gov/pubmed/31420224),Posterior shoulder tightness can be a risk factor of scapular malposition: a cadaveric biomechanical study.,"Scapular malposition and posterior shoulder tightness are key pathologic processes in the shoulder of throwing athletes. The objective of this study was to investigate the effects of posterior capsule tightness, posterior rotator cuff muscle tightness, or both on scapular position."
inhibition cox 2 pathway potential prophylaxis arthrofibrogenesis rabbit model joint contracture,JOINT/CARTILAGE,66.8% JOINT/CARTILAGE; 11.6% TISSUE/BIOMATERIAL; 5.5% TENDON/LIGAMENT,"Salib CG, Reina N, Trousdale WH, Limberg AK, Tibbo ME, Jay AG, Robin JX, Turner TW, Jones CR, Paradise CR, Lewallen EA, Bolon B, Carter JM, Berry DJ, Morrey ME, Sanchez-Sotelo J, van Wijnen AJ, Abdel MP,",*Journal of orthopaedic research : official publication of the Orthopaedic Research Society*,* [Inhibition of COX-2 pathway as a potential prophylaxis against arthrofibrogenesis in a rabbit model of joint contracture.](https://www.ncbi.nlm.nih.gov/pubmed/31410880),Inhibition of COX-2 pathway as a potential prophylaxis against arthrofibrogenesis in a rabbit model of joint contracture.,"Arthrofibrosis is a common complication following total knee arthroplasty (TKA) caused by pathologic fibroblast activation and excessive collagen deposition around a synovial joint leading to debilitating loss of motion. Treatment options are limited because the pathologic mechanisms remain to be characterized. Dysregulation of the inflammatory cascade may lead to communication between myofibroblasts and immune cells triggering tissue metaplasia, and excessive collagen deposition described clinically as arthrofibrosis. We explored the novel use of celecoxib (selective COX-2 inhibitor) to disrupt the downstream effects of the post-traumatic inflammatory cascade and inhibit scar tissue formation in a validated rabbit model of arthrofibrosis combined with new parameters for quantifying the stiffness of the posterior capsule. Biomechanical and molecular analyses, of contracted rabbit knee posterior capsule tissue after COX-2 inhibition revealed increased maximal passive extension and down-regulation of collagen mRNA compared to controls. Histopathologic examination suggested a trend of decreased quantities of dense fibrous connective tissue with COX-2 inhibition. These data may suggest that inhibiting the inflammatory cascade could potentially reduce pathologic myofibroblast activation, thereby reducing scar tissue formation and increasing the range of motion in arthrofibrotic joints. Implementing a multi-modal pharmacologic approach may simultaneously target numerous cellular components contributing to the complex process of arthrofibrogenesis. This article is protected by copyright. All rights reserved."
viscoelasticity histology human cartilage healthy degenerated conditions knee,JOINT/CARTILAGE,95.3% JOINT/CARTILAGE; 1.6% TISSUE/BIOMATERIAL; 0.5% ORTHOPAEDICS/SURGERY,"Seidenstuecker M, Watrinet J, Bernstein A, Suedkamp NP, Latorre SH, Maks A, Mayr HO,",*Journal of orthopaedic surgery and research*,* [Viscoelasticity and histology of the human cartilage in healthy and degenerated conditions of the knee.](https://www.ncbi.nlm.nih.gov/pubmed/31409382),Viscoelasticity and histology of the human cartilage in healthy and degenerated conditions of the knee.,"There are many studies on osteoarthritis, but only a few studies deal with human arthrosis, comparing the mechanical properties of healthy and diseased samples. In most of these studies, only isolated areas of the tibia are examined. There is currently only one study investigating the complete mapping of cartilage tissue but not the difference between instantaneous modulus (IM) in healthy and diseased samples. The aim of this study is to investigate the relationship between the biomechanical and histological changes of articular cartilage in the pathogenesis of osteoarthritis."
resolving colliding larvae fitting asm random walker based pre segmentations,METHODS,81.0% METHODS; 8.9% MODELING; 3.8% NEURAL,"Bian A, Jiang X, Berh D, Risse B,",*IEEE/ACM transactions on computational biology and bioinformatics*,* [Resolving colliding larvae by fitting ASM to random walker-based pre-segmentations.](https://www.ncbi.nlm.nih.gov/pubmed/31425121),Resolving colliding larvae by fitting ASM to random walker-based pre-segmentations.,"Drosophila melanogaster is an important model organism for research in neuro- and behavioral biology. Automated studies of their locomotion are crucial to link sensory input and neural processing to motor output which has led to numerous vision-based tracking systems. However, most of these approaches share the inability to segment the contours of colliding animals causing identity losses, appearing and disappearing animals and the absence of posture and motion related measurements during the time of the collision. We present a novel collision resolution algorithm enabling an accurate contour segmentation of multiple touching Drosophila larvae. Our algorithm utilizes an adapted active shape model (ASM) to learn a low dimensional posture space which is fitted to random-walker generated pre-segmentations. We evaluate our collision resolution algorithm using three publicly available datasets and compare it with the current state-of-the-art methods. In addition, we introduce a refined dataset enabling a segmentation evaluation on the level of pixel accuracy. The results demonstrate that our approach outperforms the state-of-the-art approaches in both accuracy and computational time. We will incorporate this algorithm into our widely used tracking program to improve the statistical strength of the behavioral quantification and allow marker-free studies of interacting Drosophila larvae."
development quantitative method evaluating small intestinal motility using ultrasonography mice,METHODS,33.0% METHODS; 11.2% CELLULAR/SUBCELLULAR; 8.7% CARDIOVASCULAR/CARDIOPULMONARY,"Kishi K, Kaji N, Endo M, Tsuru Y, Oikawa T, Hori M,",*Experimental animals*,* [Development of a quantitative method for evaluating small intestinal motility using ultrasonography in mice.](https://www.ncbi.nlm.nih.gov/pubmed/30971623),Development of a quantitative method for evaluating small intestinal motility using ultrasonography in mice.,"Upper gastrointestinal (GI) motility is affected by various drugs and diseases. However, changes in upper GI motility during these conditions are not well understood, as there are few quantitative in vivo methods that assess small intestinal motility in mice. Ultrasonography is a noninvasive method for imaging and evaluating the condition of the abdominal organs. The aim of the present study was to establish a novel method for evaluating small intestinal motility by using ultrasonography in mice. We measured GI motility with and without loperamide, an antidiarrheal medication, by intestinal transit using an orally administered dye, a <sup>13</sup>C-octanoic acid breath test, and ultrasonography. Locomotion activity of the duodenal wall was used for quantifying the GI motility observed via ultrasonography. Our results showed that upper GI transit was significantly delayed by loperamide. The <sup>13</sup>C-octanoic acid breath test revealed decreased gastric emptying in loperamide-treated mice. Through ultrasonography, large peristaltic movements were observed in the duodenum of the control mice. In contrast, after treatment with loperamide, these peristaltic movements were suppressed, and the duodenal lumen was enlarged, suggesting decreased duodenal motility. In accordance with these results, quantifiable locomotion activity was also significantly decreased. In conclusion, ultrasonography is an effective in vivo method to quantify small intestinal motility in mice."
designing higher fourier harmonics tegotae function using genetic algorithm case earthworm locomotion,MODELING,40.7% MODELING; 18.0% ROBOTICS; 10.4% METHODS,"Kano T, Wakimoto R, Sato M, Shinohara A, Ishiguro A,",*Bioinspiration & biomimetics*,* [Designing higher fourier harmonics of Tegotae function using genetic algorithm-a case study with an earthworm locomotion.](https://www.ncbi.nlm.nih.gov/pubmed/31282385),Designing higher fourier harmonics of Tegotae function using genetic algorithm-a case study with an earthworm locomotion.,"'Tegotae' is a Japanese concept describing how well a perceived reaction matches a generated action. We previously proposed a novel decentralised control scheme for animals' adaptive locomotion based on a Tegotae function, a function which quantifies Tegotae and is generally given by the product of action and reaction terms. Although this scheme is helpful for extracting common control principles underlying various types of animal locomotion, there remains further room for improvement of its design. Specifically, while the previous works assumed that the action term is given by a sinusoidal function, it is expected that introducing higher Fourier harmonics in the action term improves locomotion performance. In this study, taking earthworm locomotion as an example, we design a Tegotae function whose action term includes higher Fourier harmonics by using a genetic algorithm. We demonstrate via simulations that the performance improves by implementing the higher Fourier harmonics."
modulation serotonin signaling putative oxaloacetate decarboxylase fahd 1 caenorhabditis elegans,NEURAL,67.5% NEURAL; 18.5% CELLULAR/SUBCELLULAR; 4.6% COMPARATIVE,"Baraldo G, Etemad S, Weiss AKH, Jansen-Dürr P, Mack HID,",*PloS one*,* [Modulation of serotonin signaling by the putative oxaloacetate decarboxylase FAHD-1 in Caenorhabditis elegans.](https://www.ncbi.nlm.nih.gov/pubmed/31412049),Modulation of serotonin signaling by the putative oxaloacetate decarboxylase FAHD-1 in Caenorhabditis elegans.,"Human fumarylacetoacetate hydrolase (FAH) domain containing protein 1 (FAHD1) is a mitochondrial oxalocatate decarboxylase, the first of its kind identified in eukaryotes. The physiological role of FAHD1 in other eukaryotes is still poorly understood. In C. elegans loss of the FAHD1 ortholog FAHD-1 was reported to impair mitochondrial function, locomotion and egg-laying behavior, yet the underlying mechanisms remained unclear. Using tissue-specific rescue of fahd-1(-) worms, we find that these phenotypic abnormalities are at least in part due to fahd-1's function in neurons. Moreover, we show that egg-laying defects in fahd-1(-) worms can be fully rescued by external dopamine administration and that depletion of fahd-1 expression induces expression of several enzymes involved in serotonin biosynthesis. Together, our results support a role for fahd-1 in modulating serotonin levels and suggest this protein as a novel link between metabolism and neurotransmitter signaling in the nervous system. Finally, we propose a model to explain how a metabolic defect could ultimately lead to marked changes in neuronal signaling."
neuronal myocyte specific enhancer factor 2d mef2d required normal circadian sleep behavior mice,NEURAL,78.7% NEURAL; 6.6% CELLULAR/SUBCELLULAR; 4.8% COMPARATIVE,"Mohawk JA, Cox KH, Sato M, Yoo SH, Yanagisawa M, Olson EN, Takahashi JS,",*The Journal of neuroscience : the official journal of the Society for Neuroscience*,* [Neuronal Myocyte-specific enhancer factor 2D (MEF2D) is required for normal circadian and sleep behavior in mice.](https://www.ncbi.nlm.nih.gov/pubmed/31420455),Neuronal Myocyte-specific enhancer factor 2D (MEF2D) is required for normal circadian and sleep behavior in mice.,"The transcription factor, myocyte enhancer factor-2 (MEF2), is required for normal circadian behavior in <i>Drosophila</i>; however, its role in the mammalian circadian system has not been established. Of the four mammalian <i>Mef2</i> genes, <i>Mef2d</i> is highly expressed in the suprachiasmatic nucleus (SCN) of the hypothalamus, a region critical for coordinating peripheral circadian clocks. Utilizing both conventional and brain-specific <i>Mef2d</i> knockout (<i>Mef2d<sup>-/-</sup></i> ) mouse lines, we demonstrate that MEF2D is essential for maintaining the length of the circadian free-running period of locomotor activity and normal sleep patterns in male mice. Crossing <i>Mef2d<sup>-/-</sup></i> with <i>Per2::luc</i> reporter mice, we show that these behavioral changes are achieved without altering the endogenous period of the master circadian oscillator in the SCN. Together, our data suggest that alterations in behavior in <i>Mef2d<sup>-/-</sup></i> mice may be the result of an effect on SCN output, rather than an effect on timekeeping within the SCN itself. These findings add to the growing body of evidence that MEF2 proteins play important roles in the brain.<b>SIGNIFICANCE STATEMENT</b>These studies are the first to show a role for MEF2 proteins in the brain outside of the hippocampus, and our findings suggest that these proteins may play diverse roles in the central nervous system. It is important to continue to build on our understanding of the roles of proteins acting in the SCN, because SCN dysfunction underlies jet lag in humans and influences the response to shift work schedules, which are now known as risk factors for the development of cancer. Our work on MEF2D could be the basis for opening new lines of research in the development and regulation of circadian rhythms."
persistent neuroinflammation brain specific immune priming novel survival model murine pneumosepsis,NEURAL,26.3% NEURAL; 25.0% CELLULAR/SUBCELLULAR; 12.3% TISSUE/BIOMATERIAL,"Denstaedt SJ, Spencer-Segal JL, Newstead M, Laborc K, Zeng X, Standiford TJ, Singer BH,","*Shock (Augusta, Ga.)*",* [Persistent Neuroinflammation and Brain Specific Immune Priming in A Novel Survival Model of Murine Pneumosepsis.](https://www.ncbi.nlm.nih.gov/pubmed/31415473),Persistent Neuroinflammation and Brain Specific Immune Priming in A Novel Survival Model of Murine Pneumosepsis.,"Pneumonia is the leading cause of sepsis and septic shock. Patients who survive pneumonia are vulnerable to long-term complications including increased risk of neurocognitive dysfunction. This study investigated the immune response and long-term complications of a non-surgical mouse model of Klebsiella pneumoniae pneumosepsis with antibiotic treatment. Pneumosepsis resulted in acutely enhanced expression of inflammatory cytokines, chemokines, and damage associated molecular patterns in the brain and spleen. Despite resolution of infection, murine pneumosepsis survivors demonstrated a deficit in exploratory locomotor behavior at two weeks. This was associated with brain specific persistent inflammatory gene expression and infiltrating myeloid cells in the brain. The brain inflammatory response was also primed in response to secondary challenge with lipopolysaccharide. The findings of this study demonstrate behavioral and inflammatory outcomes that parallel observations in other models of sepsis, but that have not previously been described in antibiotic treated pneumonia models, highlighting a common pathway to the development of chronic brain dysfunction in sepsis survival."
