,title,topic,pred_val,authors,journal,links,full_title,abstract,new_topic
81,cysteine rich protein 61 specific ultra early biomarker kidney ischemia reperfusion injury,EVOLUTION/ANTHROPOLOGY,97.4% EVOLUTION/ANTHROPOLOGY; 2.4% COMPARATIVE; 0.1% BONE,"Li C, Zhao L, Wang Y, Che L, Luan H, Luo C, Xu Y,","*Nephrology (Carlton, Vic.)*","* [Cysteine-rich protein 61, a specific ultra-early biomarker in kidney ischemia/reperfusion injury.](https://www.ncbi.nlm.nih.gov/pubmed/30328178)","Cysteine-rich protein 61, a specific ultra-early biomarker in kidney ischemia/reperfusion injury.","Studies have shown that cysteine-rich protein 61 (Cyr61) increased in the post-ischemic human kidney tissue. However, it is still unknown whether Cyr61 can be used as a biomarker in kidney ischemia/reperfusion (I/R) injury.",
82,allocation trade offs impact organ size muscle architecture invasive population xenopus laevis western france,EVOLUTION/ANTHROPOLOGY,54.2% EVOLUTION/ANTHROPOLOGY; 44.0% COMPARATIVE; 0.4% GAIT/LOCOMOTION,"Padilla P, Courant J, Herrel A,",*Journal of anatomy*,* [Allocation trade-offs impact organ size and muscle architecture in an invasive population of Xenopus laevis in Western France.](https://www.ncbi.nlm.nih.gov/pubmed/31373390),Allocation trade-offs impact organ size and muscle architecture in an invasive population of Xenopus laevis in Western France.,"Invasive species are a global scourge and often negatively impact native species. Understanding the expansion and dispersal limits of these species is essential. As previous studies have demonstrated increased locomotor performance for populations at the edge of the range of expanding populations, studies of locomotion including the anatomical and physiological traits underlying dispersal capacity are of interest. We focus here on an invasive population of Xenopus laevis introduced in France nearly forty years ago. Previous studies have demonstrated differences in mobility between populations from the centre and the edge of the invasive range, with individuals from the range edge possessing a higher endurance capacity. We test here whether range-edge frogs show anatomical differences in organs or muscles underlying these observed differences of performance. We dissected 10 males and 10 females from central and range-edge sites (40 animals in total) and measured the mass of their organs and the mass, the length, and the physiological cross-sectional area (PCSA) of 28 hind limb muscles. Our results show anatomical differences with individuals from the range edge possessing heavier, longer and more forceful muscles. Moreover, females from the range edge had a heavier heart but lighter stomach than those of the centre of the range. Future studies comparing the morphology between native and invasive populations in other regions or for other species will be especially insightful to better understand the possible adaptive changes in invasive populations and the limits on dispersal capacity.",
83,exposure utero inflammation increases locomotor activity alters cognitive performance drives vulnerability cognitive performance deficits acute immune activation,EVOLUTION/ANTHROPOLOGY,78.6% EVOLUTION/ANTHROPOLOGY; 21.2% COMPARATIVE; 0.0% GAIT/LOCOMOTION,"Makinson R, Lloyd K, Grissom N, Reyes TM,","*Brain, behavior, and immunity*","* [Exposure to in utero inflammation increases locomotor activity, alters cognitive performance and drives vulnerability to cognitive performance deficits after acute immune activation.](https://www.ncbi.nlm.nih.gov/pubmed/30797960)","Exposure to in utero inflammation increases locomotor activity, alters cognitive performance and drives vulnerability to cognitive performance deficits after acute immune activation.","Fetal exposure to intrauterine inflammation (IUI) affects brain development. Using intrauterine lipopolysaccharide (LPS) administration to induce a localized, rather than a systemic, inflammation, we have previously shown that IUI increases cytokine expression and microglia number, and reduces white matter in the brains of exposed offspring. Clinical data suggest that IUI may increase the risk for cognitive and neurodevelopmental disorders, however, IUI is often found in the context of preterm birth, making it difficult to disentangle the adverse effects of inflammation from those related to prematurity. Therefore, using a mouse model of IUI that does not involve preterm birth, operant tasks were used to evaluate motivation, attention, impulsivity, and locomotion. IUI-exposed offspring were found to have increased locomotion and increased motivation (females only), and testing in the 5-choice serial reaction time task (5-CSRTT) showed that IUI-exposed offspring performed more trials and could respond accurately at a shorter stimulus length. We have previously shown that IUI animals have a potentiated cytokine response to a ""second hit"" (acute LPS injection) in adulthood, so animals' performance in the 5CSRTT was evaluated following an acute injection of LPS. As opposed to the improved performance observed under baseline conditions, IUI exposed animals demonstrated a greater decrease in performance after an acute LPS administration. To identify putative molecular mechanisms underlying this potentiated decline in cognitive performance, PFC samples were collected immediately after post-LPS cognitive testing and targeted gene expression analysis was correlated with specific measures of cognitive performance. Three receptors important for neuron-microglia crosstalk were found to correlate with task performance in the males following acute LPS administration. These data demonstrate that early life exposure to localized inflammation of the uterus, in the absence of prematurity, increases locomotor activity and improves some aspects of cognitive performance, but drives a vulnerability for adult cognitive performance deficits in response to acute infection.",
84,moult related reduction aerobic scope passerine birds,GAIT/LOCOMOTION,36.7% GAIT/LOCOMOTION; 28.2% REHABILITATION; 18.8% NEURAL,"Buttemer WA, Bauer S, Emmenegger T, Dimitrov D, Peev S, Hahn S,","*Journal of comparative physiology. B, Biochemical, systemic, and environmental physiology*",* [Moult-related reduction of aerobic scope in passerine birds.](https://www.ncbi.nlm.nih.gov/pubmed/30874899),Moult-related reduction of aerobic scope in passerine birds.,"It is well established that the nutrient and energy requirements of birds increase substantially during moult, but it is not known if these increased demands affect their aerobic capacity. We quantified the absolute aerobic scope of house and Spanish sparrows, Passer domesticus and P. hispaniolensis, respectively, before and during sequential stages of their moult period. The absolute aerobic scope (AAS) is the difference between maximum metabolic rate (MMR) during peak locomotor activities and minimum resting metabolic rate (RMR<sub>min</sub>), thus representing the amount of aerobic power above that committed to maintenance needs available for other activities. As expected, RMR<sub>min</sub> increased over the moult period by up to 40 and 63% in house and Spanish sparrows, respectively. Surprisingly, the maximum metabolic rates also decreased during moult in both species, declining as much as 25 and 38% compared with pre-moult values of house and Spanish sparrows, respectively. The concurrent changes in RMR<sub>min</sub> and MMR during moult resulted in significant decreases in AAS, being up to 32 and 47% lower than pre-moult levels of house and Spanish sparrows, respectively, during moult stages having substantial feather replacement. We argue that the combination of reduced flight efficiency due to loss of wing feathers and reduced aerobic capacity places moulting birds at greater risk of predation. Such performance constraints likely contribute to most birds temporally separating moult from annual events requiring peak physiological capacity such as breeding and migration.",
85,evidence link fall related anxiety high risk patterns visual search older adults adaptive locomotion,GAIT/LOCOMOTION,79.7% GAIT/LOCOMOTION; 4.1% METHODS; 3.9% REHABILITATION,"Ellmers TJ, Cocks AJ, Young WR,","*The journals of gerontology. Series A, Biological sciences and medical sciences*",* [Evidence of a link between fall-related anxiety and high-risk patterns of visual search in older adults during adaptive locomotion.](https://www.ncbi.nlm.nih.gov/pubmed/31362302),Evidence of a link between fall-related anxiety and high-risk patterns of visual search in older adults during adaptive locomotion.,"Older adults deemed to be at a high-risk of falling will often display visual search behaviours likely to impair movement planning when negotiating environmental hazards. It has been proposed that these behaviours may be underpinned by fall-related anxiety. Thus, the aim of this study was to explore the effects of fall-related anxiety on visual search and stepping behaviours during adaptive gait.",
86,persons essential tremor adapt new walking patterns,GAIT/LOCOMOTION,96.4% GAIT/LOCOMOTION; 2.5% REHABILITATION; 0.6% NEURAL,"Roper JA, Brinkerhoff SA, Harrison BR, Schmitt AC, Roemmich RT, Hass CJ,",*Journal of neurophysiology*,* [Persons with Essential Tremor Can Adapt to New Walking Patterns.](https://www.ncbi.nlm.nih.gov/pubmed/31365318),Persons with Essential Tremor Can Adapt to New Walking Patterns.,"Essential tremor (ET) is a common movement disorder that causes motor deficits similar to those seen in cerebellar disorders. These include kinetic tremor, gait ataxia, and impaired motor adaptation. Previous studies of motor adaptation in ET have focused on reaching while the effects of ET on gait adaptation are currently unknown. The purpose of this study was to contrast locomotor adaptation in persons with and without ET. We hypothesized that persons with ET would show impaired gait adaptation. In a cross-sectional study, persons with ET (n=14) and healthy matched controls (n=12) walked on a split-belt treadmill. Participants walked with the belts moving at a 2:1 ratio, followed by overground walking to test transfer, followed by a readaptation period and finally a deadaptation period. Step length asymmetry was measured to assess the rate of adaptation, amount of transfer, and rates of readaptation and deadaptation. Spatial, temporal, and velocity contributions to¬ step length asymmetry were analyzed during adaptation. There were no group by condition interactions in step length asymmetry or contributions to step length asymmetry. Regardless of condition, persons with ET walked slower and exhibited lower temporal (p < 0.001) and velocity (p = 0.001) contributions to step length asymmetry than controls. Persons with ET demonstrated a preserved ability to adapt to, store, and transfer a new walking pattern. Despite probable cerebellar involvement in ET, locomotor adaptation is an available mechanism to teach persons with ET new gait patterns.",
87,disruption tcf4 regulatory networks leads abnormal cortical development mental disabilities,GAIT/LOCOMOTION,79.4% GAIT/LOCOMOTION; 8.4% REHABILITATION; 6.3% ROBOTICS,"Li H, Zhu Y, Morozov YM, Chen X, Page SC, Rannals MD, Maher BJ, Rakic P,",*Molecular psychiatry*,* [Disruption of TCF4 regulatory networks leads to abnormal cortical development and mental disabilities.](https://www.ncbi.nlm.nih.gov/pubmed/30705426),Disruption of TCF4 regulatory networks leads to abnormal cortical development and mental disabilities.,"The TCF4 gene is the subject of numerous and varied investigations of it's role in the genesis of neuropsychiatric disease. The gene has been identified as the cause of Pitt-Hopkins syndrome (PTHS) and it has been implicated in various other neuropsychiatric diseases, including schizophrenia, depression, and autism. However, the precise molecular mechanisms of the gene's involvement in neurogenesis, particularly, corticogenesis, are not well understood. Here, we present data showing that TCF4 is expressed in a region-specific manner in the radial glia and stem cells of transient embryonic zones at early gestational ages in both humans and mice. TCF4 haploinsufficiency mice exhibit a delay in neuronal migration, and a significant increase in the number of upper-layer cortical neurons, as well as abnormal dendrite and synapse formation. Our research also reveals that TCF3 up-regulates Tcf4 by binding to the specific ""E-box"" and its flank sequence in intron 2 of the Tcf4 gene. Additionally, our transcriptome study substantiates that Tcf4 transcriptional function is essential for locomotion, cognition, and learning. By activating expression of TCF4 in the regulation of neuronal proliferation and migration to the overlaying neocortex and subsequent differentiation leading to laminar formation TCF4 fulfills its normal function, but if not, abnormalities such as those reported here result. These findings provide new insight into the specific roles of Tcf4 molecular pathway in neocortical development and their relevance in the pathogenesis of neuropsychiatric diseases.",
88,biomechanical function foot pump venous return lower extremity human gait cycle expansion gait model foot pump,GAIT/LOCOMOTION,49.4% GAIT/LOCOMOTION; 16.3% MODELING; 7.1% SPORT/EXERCISE,"Horwood A,",*Medical hypotheses*,* [The biomechanical function of the foot pump in venous return from the lower extremity during the human gait cycle: An expansion of the gait model of the foot pump.](https://www.ncbi.nlm.nih.gov/pubmed/31371072),The biomechanical function of the foot pump in venous return from the lower extremity during the human gait cycle: An expansion of the gait model of the foot pump.,"The gait cycle has been modelled for energetics and musculoskeletal health and disease, but little has been published in relation to the function of gait as a mechanism in maintaining haemodynamic homeostasis through the lower limb. Blood returns from the lower limb drawn to the heart by the low pressure at the vena cava through hydrodynamic forces. Resisting these hydrodynamics forces are gravitational and frictional forces. The deficit between the forces acting for venous return from the lower limb by hydrodynamics and those acting against antegrade flow, is filled by extrinsic mechanical mechanisms including the respiratory pump, skeletal muscle pumps and the foot pump. The efficiency of the lower limb skeletal muscle pump and foot pump are likely linked to gait kinetics and kinematics. A model is proposed that attempts to expand upon previous gait models of the foot pump as part of the kinetic and kinematic events that occur during gait, whilst also developing the argument that the foot pump needs to be divided into passive-pressure phases, and combined active-muscular/passive-pressure phases during gait. This model suggests that non-weightbearing arch profiles will have little influence on the combined active/passive-pressure phases of the foot pump, while the ability to develop compliance and stiffness within the foot at the requisite periods of the gait cycle is likely to influence foot pump efficiency.",
89,gesture speech physics biomechanical basis emergence gesture speech synchrony,GAIT/LOCOMOTION,15.6% GAIT/LOCOMOTION; 14.6% NEURAL; 14.2% MODELING,"Pouw W, Harrison SJ, Dixon JA,",*Journal of experimental psychology. General*,* [Gesture-speech physics: The biomechanical basis for the emergence of gesture-speech synchrony.](https://www.ncbi.nlm.nih.gov/pubmed/31368760),Gesture-speech physics: The biomechanical basis for the emergence of gesture-speech synchrony.,"The phenomenon of gesture-speech synchrony involves tight coupling of prosodic contrasts in gesture movement (e.g., peak velocity) and speech (e.g., peaks in fundamental frequency; F0). Gesture-speech synchrony has been understood as completely governed by sophisticated neural-cognitive mechanisms. However, gesture-speech synchrony may have its original basis in the resonating forces that travel through the body. In the current preregistered study, movements with high physical impact affected phonation in line with gesture-speech synchrony as observed in natural contexts. Rhythmic beating of the arms entrained phonation acoustics (F0 and the amplitude envelope). Such effects were absent for a condition with low-impetus movements (wrist movements) and a condition without movement. Further, movement-phonation synchrony was more pronounced when participants were standing as opposed to sitting, indicating a mediating role for postural stability. We conclude that gesture-speech synchrony has a biomechanical basis, which will have implications for our cognitive, ontogenetic, and phylogenetic understanding of multimodal language. (PsycINFO Database Record (c) 2019 APA, all rights reserved).",
90,bone block augmentation iliac crest treatment deep osteochondral defects knee resembles biomechanical properties subchondral bone,GAIT/LOCOMOTION,89.4% GAIT/LOCOMOTION; 3.8% REHABILITATION; 2.3% NEURAL,"Grechenig S, Worlicek M, Penzkofer R, Zeman F, Kujat R, Heiss P, Pattappa G, Zellner J, Angele P,","*Knee surgery, sports traumatology, arthroscopy : official journal of the ESSKA*",* [Bone block augmentation from the iliac crest for treatment of deep osteochondral defects of the knee resembles biomechanical properties of the subchondral bone.](https://www.ncbi.nlm.nih.gov/pubmed/30370438),Bone block augmentation from the iliac crest for treatment of deep osteochondral defects of the knee resembles biomechanical properties of the subchondral bone.,"Bone block augmentation from the iliac crest can be used for reconstruction of the osteochondral unit to restore the underlying subchondral bone upon restoration of the cartilaginous layer via matrix-induced chondrocyte transplantation. To critically understand the successful restoration of the defect, biomechanical and histological analysis of the implanted bone blocks is required. The aim of the study was to analyse the ability of the bone block technique to restore huge bone defects by mimicking the physiological subchondral zone.",
91,biomechanical analysis proximal tibia bone grafting effect size osteotomy using validated finite element model,GAIT/LOCOMOTION,92.5% GAIT/LOCOMOTION; 2.8% REHABILITATION; 1.0% SPORT/EXERCISE,"Ng DQK, Lim CT, Ramruttun AK, Tan KJ, Wang W, Chong DYR,",*Medical & biological engineering & computing*,* [Biomechanical analysis of proximal tibia bone grafting and the effect of the size of osteotomy using a validated finite element model.](https://www.ncbi.nlm.nih.gov/pubmed/31197751),Biomechanical analysis of proximal tibia bone grafting and the effect of the size of osteotomy using a validated finite element model.,"Harvesting bone graft from the proximal tibia is gaining popularity, with lower complication rates and adequate quantity of cancellous bone. The amount of harvested bone is dependent on the size of the cortical window introduced via osteotomy onto the proximal tibia, and its mechanical strength after surgery could be compromised. The aim of the study was to investigate the proximal tibia's mechanical stability after bone harvesting and the effect of varying window sizes using a validated finite element model. Two cadaveric tibiae were tested with bone strains measured for different circular cortical window diameters (10-25 mm). Sixteen finite element models of the intact and harvested tibia were simulated and validated with experimental data. The experimental and predicted max/min principal bone strains were fitted into regression models and showed good correlations. It was predicted the maximum principal bone stresses were greatest and concentrated at postero-inferior and antero-superior regions of the cortical window. A stress line progressed from the edge of the window to the posterior side of the tibia, which became more prominent with the increase of size of the cortical window. It was found that large circular osteotomies for bone harvesting at the proximal tibia induced stress concentrations and stress lines which could lead to eventual failure. Graphical abstract The formation of a stress line in the harvested tibia initiated from the postero-inferior edge of the window and progressed to the medial side. The stress line became more prominent with the increase of the size of the cortical window from 10 to 25 mm in diameter.",
92,wearable insoles validated tool quantifying transfemoral amputee gait asymmetry,GAIT/LOCOMOTION,57.1% GAIT/LOCOMOTION; 15.2% REHABILITATION; 12.6% METHODS,"Loiret I, Villa C, Dauriac B, Bonnet X, Martinet N, Paysant J, Pillet H,",*Prosthetics and orthotics international*,* [Are wearable insoles a validated tool for quantifying transfemoral amputee gait asymmetry?](https://www.ncbi.nlm.nih.gov/pubmed/31364482),Are wearable insoles a validated tool for quantifying transfemoral amputee gait asymmetry?,"Amputee gait is known to be asymmetrical, especially during loading of the lower limb. Monitoring asymmetry could be useful in quantifying patient performance during rehabilitation. Wearable insoles can provide normal ground reaction force asymmetry in real-life conditions.",
93,towards wearable monitoring tool field ice hockey skating performance analysis,JOINT/CARTILAGE,94.0% JOINT/CARTILAGE; 2.0% TENDON/LIGAMENT; 1.4% REHABILITATION,"Stetter BJ, Buckeridge E, Nigg SR, Sell S, Stein T,",*European journal of sport science*,* [Towards a wearable monitoring tool for in-field ice hockey skating performance analysis.](https://www.ncbi.nlm.nih.gov/pubmed/30606093),Towards a wearable monitoring tool for in-field ice hockey skating performance analysis.,"The capturing of movements by means of wearable sensors has become increasingly popular in order to obtain sport performance measures during training or competition. The purpose of the current study was to investigate the feasibility of using body worn accelerometers to identify previous highlighted performance related biomechanical changes in terms of substantial differences across skill levels and skating phases. Twenty-two ice hockey players of different caliber were equipped with two 3D accelerometers, located on the skate and the waist, as they performed 30 m forward skating sprints on an ice rink. Two measures of the temporal stride characteristics (contact time and stride time) and one measure of the propulsive power (stride propulsion) of a skating stride were calculated and checked for discriminating effects across (i) skill levels and (ii) sprint phases as well as for their (iii) strength of association with the sprint performance (total sprint time). High caliber players showed an increased stride propulsion (+22%, <i>P </i><<i> </i>0.05) and shorter contact time (-5%, <i>P </i><<i> </i>0.05). All three analysed variables highlighted substantial biomechanical differences between the accelerative and constant velocity phases (<i>P </i>< 0.05). Stride propulsion of acceleration strides primarily correlated to total sprint time (<i>r </i>= -0.57, <i>P </i>< 0.05). The results demonstrate the potential of accelerometers to assess skating technique elements such as contact time or elements characterizing the propulsive power such as center of mass acceleration, to gauge skating performance. Thus, the findings of this study might contribute to establishing wearable sensors for in-field ice hockey skating performance analysis.",
94,release sodium pyruvate sacral prophylactic dressings computational model,JOINT/CARTILAGE,74.9% JOINT/CARTILAGE; 8.0% TISSUE/BIOMATERIAL; 5.3% TENDON/LIGAMENT,"Levy A, Kottner J, Gefen A,",*International wound journal*,* [Release of sodium pyruvate from sacral prophylactic dressings: A computational model.](https://www.ncbi.nlm.nih.gov/pubmed/31063243),Release of sodium pyruvate from sacral prophylactic dressings: A computational model.,"The use of sacral dressings for pressure ulcer prevention is growing rapidly. In addition to their passive biomechanical role in pressure and shear reduction, in the near future, prophylactic dressings may also provide active tissue protection by releasing preventive agents or drugs into skin and deeper tissues. We investigated delivery of sodium pyruvate (NaPy) from an active dressing to potentially protect the sacral skin and underlying tissues in addition. We used four finite element model variants describing different skin roughness levels to determine time profiles of NaPy diffusion from the dressing into the skin layers. The NaPy concentrations for the different modelled cases stabilised after 1 to 6.5 hours from the time of application of the dressings, at 1% to 3% of the NaPy concentration in the dressing reservoir, which is considered potent. We conclude that prophylactic sacral dressings have the potential to deliver NaPy into skin and subdermally, to potentially increase soft tissue tolerance to sustained bodyweight-caused cell and tissue deformations. The time durations to achieve the steady-state potent NaPy dermal concentrations are clinically feasible, for example, for preparation of patients for surgery or for use in intensive care units.",
