,title,topic,pred_val,authors,journal,links,full_title,abstract,new_topic
166,impact anti tumor agents er positive mcf 7 her2 positive skbr 3 breast cancer cells biomechanics,NEURAL,32.9% NEURAL; 15.1% TISSUE/BIOMATERIAL; 9.9% CELLULAR/SUBCELLULAR,"Metsiou DN, Siatis KE, Giannopoulou E, Papachristou DJ, Kalofonos HP, Koutras A, Athanassiou G,",*Annals of biomedical engineering*,* [The Impact of Anti-tumor Agents on ER-Positive MCF-7 and HER2-Positive SKBR-3 Breast Cancer Cells Biomechanics.](https://www.ncbi.nlm.nih.gov/pubmed/31098800),The Impact of Anti-tumor Agents on ER-Positive MCF-7 and HER2-Positive SKBR-3 Breast Cancer Cells Biomechanics.,"Studying human cancer from a biomechanical perspective may contribute to pathogenesis understanding which leads to the malignancy. In this study, biomechanics of suspended and adhered breast cancer cells were investigated via the micropipette aspiration method with special emphasis on comparing the cell stiffness and viscoelastic parameters of estrogen receptor positive, ER+, MCF-7 and human epidermal growth factor receptor 2 positive, HER2 +, SKBR-3 cancer cell lines prior to and post treatment with tamoxifen and trastuzumab, respectively. Alterations of mechanical parameters included significant increase in cell stiffness, especially after treatment with trastuzumab and changes in viscoelastic parameters, in both cancer cell lines post treatment. According to immunofluorescence analysis, the raised cell stiffness was corresponded to remodeling of F-actin, which peripherally located in tamoxifen treated and perinuclear accumulated in trastuzumab treated cancer cell cytoskeleton, implying a reduced potential for cell deformation and motility. Additionally, these results were in line with the study of single and collective cell migration through Boyden chamber and wound healing assays respectively, where the potential for migration was significantly decreased after treatment. Consequently, these findings lead to an increased interest in biomechanics of cancer progression after treatment with anti-tumor agents, importantly in understanding the effect of the alterations of mechanical properties upon the possibility for change in metastatic potential.",
167,pharmacological comparison methamphetamine l methamphetamine rats abuse related behavioral physiological indices,NEURAL,97.4% NEURAL; 0.9% GAIT/LOCOMOTION; 0.4% REHABILITATION,"Xue Z, Siemian JN, Zhu Q, Blough BE, Li JX,",*Behavioural pharmacology*,* [Further pharmacological comparison of D-methamphetamine and L-methamphetamine in rats: abuse-related behavioral and physiological indices.](https://www.ncbi.nlm.nih.gov/pubmed/30480551),Further pharmacological comparison of D-methamphetamine and L-methamphetamine in rats: abuse-related behavioral and physiological indices.,"Previous preclinical research suggests that L-methamphetamine (L -MA) has potential therapeutic utility to treat psychostimulant abuse. This study examined potential abuse-related and adverse physiological effects of D -MA and L -MA alone and in combination in rats, as these effects had not been previously characterized. Potential abuse-related effects were examined in locomotor sensitization and conditioned place preference paradigms. Body temperature was monitored to assess the physiological effects of these drugs or drug combinations. In the locomotor study, D-MA induced locomotor sensitization to both D-MA and L -MA. L -MA induced locomotor sensitization only to D-MA. Responses to a combination of L-MA and D -MA were not differentially affected by L-MA or D-MA conditioning. In the conditioned place preference study, D-MA and L -MA each induced significant place preference. L -MA did not attenuate D-MA-induced place preference. In the body temperature study, D-MA induced hyperthermia and L -MA induced hypothermia. In combination, L -MA did not affect D-MA-induced hyperthermia. These data suggest that L -MA alone produces less abuse-related and adverse physiological effects than D-MA, but modulates and is modulated by concurrent and subsequent D-MA exposure, which may enhance the abuse liability of both drugs. These findings should be considered when L -MA is proposed for replacement therapy.",
168,mammary tumors compromise time day differences hypothalamic gene expression circadian behavior physiology mice,NEURAL,34.6% NEURAL; 13.1% CELLULAR/SUBCELLULAR; 8.1% TISSUE/BIOMATERIAL,"Sullivan KA, Bever SR, McKim DB, Godbout JP, Sheridan JF, Obrietan K, Pyter LM,","*Brain, behavior, and immunity*",* [Mammary tumors compromise time-of-day differences in hypothalamic gene expression and circadian behavior and physiology in mice.](https://www.ncbi.nlm.nih.gov/pubmed/31108169),Mammary tumors compromise time-of-day differences in hypothalamic gene expression and circadian behavior and physiology in mice.,"Circadian rhythms influence various aspects of biology, including hormonal, immunological, and behavioral processes. These 24-hour oscillations are necessary to optimize cellular functions and to synchronize these processes with the environment. Breast cancer patients and survivors frequently report disruptions in circadian oscillations that adversely affect quality-of-life, including fragmented sleep-wake cycles and flattened cortisol rhythms, which are associated with negative behavioral comorbidities (e.g., fatigue). However, the potential causal role of tumor biology in circadian dysregulation has not been investigated. Here, we examined the extent to which sham surgery, non-metastatic mammary tumors, or mammary tumor removal in mice disrupts circadian rhythms in brain clock gene expression, locomotor behavior (free-running and entrained), and physiological rhythms that have been associated with cancer behavioral comorbidities. Tumors and tumor resection altered time-of-day differences in hypothalamic expression of eight circadian-regulated genes. The onset of activity in entrained running behavior was advanced in tumor-bearing mice, and the amplitude of free-running rhythms was increased in tumor-resected mice. Tumors flattened rhythms in circulating corticosterone and Ly6c<sup>Hi</sup> monocytes which were largely restored by surgical tumor resection. This work implies that tumors alone may directly impact central and/or peripheral circadian rhythmicity in breast cancer patients, and that these effects may persist in cancer survivors, potentially contributing to behavioral comorbidities.",
169,rigidity controls human desmoplastic matrix anisotropy enable pancreatic cancer cell spread via extracellular signal regulated kinase 2,NEURAL,76.4% NEURAL; 13.5% CELLULAR/SUBCELLULAR; 1.5% COMPARATIVE,"Malik R, Luong T, Cao X, Han B, Shah N, Franco-Barraza J, Han L, Shenoy VB, Lelkes PI, Cukierman E,",*Matrix biology : journal of the International Society for Matrix Biology*,* [Rigidity controls human desmoplastic matrix anisotropy to enable pancreatic cancer cell spread via extracellular signal-regulated kinase 2.](https://www.ncbi.nlm.nih.gov/pubmed/30412725),Rigidity controls human desmoplastic matrix anisotropy to enable pancreatic cancer cell spread via extracellular signal-regulated kinase 2.,"It is predicted that pancreatic ductal adenocarcinoma (PDAC) will become the second most lethal cancer in the US by 2030. PDAC includes a fibrous-like stroma, desmoplasia, encompassing most of the tumor mass, which is produced by cancer-associated fibroblasts (CAFs) and includes their cell-derived extracellular matrices (CDMs). Since elimination of desmoplasia has proven detrimental to patients, CDM reprogramming, as opposed to stromal ablation, is therapeutically desirable. Hence, efforts are being made to harness desmoplasia's anti-tumor functions. We conducted biomechanical manipulations, using variations of pathological and physiological substrates in vitro, to culture patient-harvested CAFs and generate CDMs that restrict PDAC growth and spread. We posited that extrinsic modulation of the environment, via substrate rigidity, influences CAF's cell-intrinsic forces affecting CDM production. Substrates used were polyacrylamide gels of physiological (~1.5 kPa) or pathological (~7 kPa) stiffnesses. Results showed that physiological substrates influenced CAFs to generate CDMs similar to normal/control fibroblasts. We found CDMs to be softer than the corresponding underlying substrates, and CDM fiber anisotropy (i.e., alignment) to be biphasic and informed via substrate-imparted morphological CAF aspect ratios. The biphasic nature of CDM fiber anisotropy was mathematically modeled and proposed a correlation between CAF aspect ratios and CDM alignment; regulated by extrinsic and intrinsic forces to conserve minimal free energy. Biomechanical manipulation of CDMs, generated on physiologically soft substrates, leads to reduction in nuclear translocation of pERK1/2 in KRAS mutated pancreatic cells. ERK2 was found essential for CDM-regulated tumor cell spread. In vitro findings correlated with in vivo observations; nuclear pERK1/2 is significantly high in human PDAC samples. The study suggests that altering underlying substrates enable CAFs to remodel CDMs and restrict pancreatic cancer cell spread in an ERK2 dependent manner.",
170,activity shelter related behavior rhodnius prolixus role host odours,NEURAL,56.6% NEURAL; 9.0% VETERINARY/AGRICULTURAL; 7.7% METHODS,"Ferreira RA, Guarneri AA, Lorenzo MG,",*Acta tropica*,* [Activity and shelter-related behavior in Rhodnius prolixus: The role of host odours.](https://www.ncbi.nlm.nih.gov/pubmed/31116968),Activity and shelter-related behavior in Rhodnius prolixus: The role of host odours.,"Triatomine bugs are considered nocturnal insects that feed on the blood of vertebrates and remain hidden inside narrow shelters during daylight hours. Nevertheless, it is not clear whether these insects become active and leave their shelters on a daily basis, less frequently or, even fortnightly. Activity patterns were studied in Rhodnius prolixus Stål, 1859 (Hemiptera: Triatominae) associated with shelters to evaluate whether the decision to leave a shelter depends on bug starvation and the presence of host odours. Experiments were conducted with groups of 5th instar nymphs released in an experimental arena offering an artificial shelter consisting of a piece of corrugated cardboard positioned in its centre. Results indicate that host odours promoted a significant increase in shelter related activity, i.e. shelter-leaving or entering movements, and also in bug locomotion. This increase could only be observed with bugs starved for 30 or 60 days, but not for 21 days. Most R. prolixus nymphs that left shelters and engaged in locomotory activity were starved and in the presence of host odours. Even though R. prolixus is mostly considered a very active and ""aggressive"" triatomine, our results contradict this perspective and suggest that its main strategy regarding hosts is to wait and carefully evaluate feeding chances before becoming exposed. This behavioural strategy might have arisen through their evolution in palm trees in association with a diverse fauna that may impose predation risks.",
171,age related differences δ⁹ tetrahydrocannabinol induced antinociception female male rats,NEURAL,55.5% NEURAL; 6.0% CELLULAR/SUBCELLULAR; 5.6% VETERINARY/AGRICULTURAL,"Craft RM, Britch SC, Buzitis NW, Clowers BH,",*Experimental and clinical psychopharmacology*,* [Age-related differences in Δ⁹-tetrahydrocannabinol-induced antinociception in female and male rats.](https://www.ncbi.nlm.nih.gov/pubmed/31120286),Age-related differences in Δ⁹-tetrahydrocannabinol-induced antinociception in female and male rats.,"Given the use of cannabis as an analgesic by a broadening age range of patients, the aim of this study was to determine whether the antinociceptive effects of Δ9-tetrahydrocannabinol (THC) differ by age. The antinociceptive potency and efficacy of THC (1.0-18 mg/kg ip) was compared in male and female rats aged postnatal day 35-40 (adolescent), 60-70 (young adult), and 291-325 (middle-aged adult), using warm water tail withdrawal and paw pressure tests. Motoric effects of THC were assessed using a locomotor activity test. On the tail withdrawal test, THC was significantly more effective in middle-aged adult than in young adult rats and significantly less effective in adolescent than in young adult rats. Similar but smaller age-related differences were observed on the paw pressure test. Sex differences in THC's antinociceptive effects were consistent across the 3 ages examined, with greater THC effects observed in females than males of each age. Age-related differences in THC's locomotor-suppressing effect were also observed, with the greatest effect in young adult female rats. Serum THC levels were slightly higher in adolescent than in young adult rats, and levels of the active metabolites 11-OH-THC and cannabinol, as well as the inactive metabolite 11-nor-9-carboxy-THC, did not differ between adolescent and young adult rats. These results suggest that the pain-relieving effects of THC may be more limited in adolescents than in adults and that these age-related differences in THC effect are not attributable to differential absorption or metabolism of THC. (PsycINFO Database Record (c) 2019 APA, all rights reserved).",
172,selective trpv4 channel antagonist hc 067047 attenuates mechanical allodynia diabetic mice,NEURAL,75.2% NEURAL; 6.0% GAIT/LOCOMOTION; 5.6% COMPARATIVE,"Dias FC, Alves VS, Matias DO, Figueiredo CP, Miranda ALP, Passos GF, Costa R,",*European journal of pharmacology*,* [The selective TRPV4 channel antagonist HC-067047 attenuates mechanical allodynia in diabetic mice.](https://www.ncbi.nlm.nih.gov/pubmed/31129158),The selective TRPV4 channel antagonist HC-067047 attenuates mechanical allodynia in diabetic mice.,"Painful diabetic neuropathy (PDN) is a serious symptom that compromises quality of life and remains without effective pharmacological treatment. The transient receptor vanilloid 4 (TRPV4) is a cation-permeable channel implicated in sensory transduction and pain signalling. Therefore, drugs that act on TRPV4 may have therapeutic applications to treat PDN. In the present work, we assessed the effect of the selective TRPV4 channel antagonist HC-067047 on painful neuropathy associated with streptozotocin (STZ)-induced diabetes in mice. STZ-treated animals presented both mechanical and cold allodynia at 6 weeks after diabetes induction. Notably, HC-067047 (1 mg/kg, s.c.) given daily between 2 and 6 weeks after diabetes induction significantly prevented the development of mechanical allodynia. Additionally, both single and repeated treatments with HC-067047 (10 mg/kg, s.c.) significantly reverted established mechanical allodynia induced by STZ. However, HC-067047 was not capable of affecting either thermal cold allodynia or hyperglycemia. Similarly, HC-067047 treatments showed no effect on body weight, temperature, locomotor activity or motor coordination of control mice. Immunohistochemistry assay showed that TRPV4 expression was not different in sciatic nerve, dorsal root ganglia (DRG) or hind paw plantar skin from diabetic and non-diabetic mice, suggesting that HC-067047 acts on constitutive receptors to inhibit mechanical allodynia. Taken together, the data generated in the present study show the potential relevance of using TRPV4 antagonists to treat painful neuropathy associated with diabetes.",
173,anterior cruciate ligament injury mechanisms kinetic chain linkage effect proximal joint stiffness distal knee control bilateral landings,NEURAL,69.8% NEURAL; 6.7% CELLULAR/SUBCELLULAR; 3.3% VETERINARY/AGRICULTURAL,"Cannon J, Cambridge EDJ, McGill SM,",*The Journal of orthopaedic and sports physical therapy*,* [Anterior Cruciate Ligament Injury Mechanisms and the Kinetic Chain Linkage: The Effect of Proximal Joint Stiffness on Distal Knee Control During Bilateral Landings.](https://www.ncbi.nlm.nih.gov/pubmed/31130059),Anterior Cruciate Ligament Injury Mechanisms and the Kinetic Chain Linkage: The Effect of Proximal Joint Stiffness on Distal Knee Control During Bilateral Landings.,"Neuromuscular deficits at the trunk and hip may contribute to dynamic knee valgus and anterior cruciate ligament injury mechanisms. However, comprehensive examination of neuromuscular patterns and their mechanical influence is lacking.",
174,circadian entrainment food drugs abuse,NEURAL,98.2% NEURAL; 0.6% CELLULAR/SUBCELLULAR; 0.2% GAIT/LOCOMOTION,"Gillman AG, Rebec GV, Pecoraro NC, Kosobud AEK,",*Behavioural processes*,* [Circadian entrainment by food and drugs of abuse.](https://www.ncbi.nlm.nih.gov/pubmed/31132444),Circadian entrainment by food and drugs of abuse.,"Circadian rhythms organize behavior and physiological processes to be appropriate to the predictable cycle of daily events. These rhythms are entrained by stimuli that provide time of day cues (zeitgebers), such as light, which regulates the sleep-wake cycle and associated rhythms. But other events, including meals, social cues, and bouts of locomotor activity, can act as zeitgebers. Recent evidence shows that most organs and tissues contain cells that are capable of some degree of independent circadian cycling, suggesting the circadian system is broadly and diffusely distributed. Within laboratory studies of behavior, circadian rhythms tend to be treated as a complication to be minimized, but they offer a useful model of predictable shifts in behavioral tendencies. In the present review, we summarize the evidence that formed the basis for a hypothesis that drugs of abuse can entrain circadian rhythms and describe the outcome of a series of experiments designed to test that hypothesis. We propose that such drug-entrained rhythms may contribute to demonstrated daily variations in drug metabolism, tolerance, and sensitivity to drug reward. Of particular importance, these rhythms may be evoked by a single episode of drug taking, strengthen with repeated episodes, and re-emerge after long periods of abstinence, thereby contributing to drug abuse, addiction, and relapse.",
175,mitochondrial dysfunction based cardiotoxicity neurotoxicity induced pyraclostrobin zebrafish larvae,NEURAL,84.8% NEURAL; 10.1% CELLULAR/SUBCELLULAR; 1.1% COMPARATIVE,"Li H, Zhao F, Cao F, Teng M, Yang Y, Qiu L,","*Environmental pollution (Barking, Essex : 1987)*",* [Mitochondrial dysfunction-based cardiotoxicity and neurotoxicity induced by pyraclostrobin in zebrafish larvae.](https://www.ncbi.nlm.nih.gov/pubmed/31078959),Mitochondrial dysfunction-based cardiotoxicity and neurotoxicity induced by pyraclostrobin in zebrafish larvae.,"Pyraclostrobin is widely used to control crop diseases, and was reported to be highly toxic to aquatic organisms. The molecular target of pyraclostrobin to fungus is the mitochondrion, but its effect on mitochondria of aquatic organisms has rarely been investigated. In this study, zebrafish larvae at 4 days post fertilization (dpf) were exposed to a range of pyraclostrobin for 96 h to assess its acute toxicity and effects on mitochondria. Pyraclostrobin at 36 μg/L or higher concentrations caused significant influences on larval heart and brain including pericardial edema, brain damage malformations, histological and mitochondrial structural damage of the two organs. The results of RNA-Seq revealed that the transcripts of genes related to oxidative phosphorylation, cardiac muscle contraction, mitochondrion, nervous system development and glutamate receptor activity were significantly influenced by 36 μg/L pyraclostrobin. Further tests showed that pyraclostrobin at 18 and 36 μg/L reduced the concentrations of proteins related to cardiac muscle contraction, impaired cardiac function, inhibited glutamate receptors activities and suppressed locomotor behavior of zebrafish larvae. Negative changes in mitochondrial complex activities, as well as reduced ATP content were also observed in larvae treated with 18 and 36 μg/L pyraclostrobin. These results suggested that pyraclostrobin exposure caused cardiotoxicity and neurotoxicity in zebrafish larvae and mitochondrial dysfunction might be the underlying mechanism of pyraclostrobin toxicity.",
176,pregnancies alters spine number cortical subcortical limbic brain regions old rats,NEURAL,95.1% NEURAL; 1.1% REHABILITATION; 0.9% CELLULAR/SUBCELLULAR,"Flores-Vivaldo YM, Camacho-Abrego I, Picazo O, Flores G,","*Synapse (New York, N.Y.)*",* [Pregnancies alters spine number in cortical and subcortical limbic brain regions of old rats.](https://www.ncbi.nlm.nih.gov/pubmed/30958589),Pregnancies alters spine number in cortical and subcortical limbic brain regions of old rats.,"Pregnancy is a complex process, involving a number of hormones and trophic factors, many of which are formed in the placenta. Several of these trophic factors have an effect at the neuronal level, such as BDNF. Consequently, recent reports have shown that exposure to these hormones (estrogen and progesterone) and trophic factors such as BDNF exert a neuroprotective effect. Here, we study the effect of the number of pregnancies on dendritic morphology of aged female rats (18 months of age). Rats of the 18-month-old Sprague Dawley strain with zero, one, two, and three gestations were evaluated for locomotor activity, and Golgi-Cox stain was performed to evaluate the dendritic morphology parameters, the number of dendritic spines, total dendritic length, and branching order number. Adult nulliparous rats (3 months of age) were used as another control group. Adult nulliparous and aging rats with two pregnancies showed an increase in locomotor activity. Adult nulliparous showed an increase in the dendritic spine number compared to old nulliparous rats in both layers of the PFC, the DG, and NAcc. Old rats with two and three pregnancies also showed an increase in the number of dendritic spines compared to old nulliparous rats in layers 3 and 5 of the PFC and in the CA1. Aging animals with one pregnancy also showed an increase in dendritic length compared to old nulliparous rats in the CA1. Our results clearly suggest that two and three pregnancies increase the dendritic spines number in the PFC and CA1 of aged female rats.",
177,transdermal delivery fluvastatin loaded nanoemulsion gel preparation characterization vivo anti osteoporosis activity,NEURAL,94.6% NEURAL; 1.8% TISSUE/BIOMATERIAL; 0.9% CELLULAR/SUBCELLULAR,"Kaur R, Ajitha M,",*European journal of pharmaceutical sciences : official journal of the European Federation for Pharmaceutical Sciences*,"* [Transdermal delivery of fluvastatin loaded nanoemulsion gel: Preparation, characterization and in vivo anti-osteoporosis activity.](https://www.ncbi.nlm.nih.gov/pubmed/31202895)","Transdermal delivery of fluvastatin loaded nanoemulsion gel: Preparation, characterization and in vivo anti-osteoporosis activity.","The objective of present study was to develop hydrogel based nanoemulsion (NE) drug delivery system for transdermal delivery and evaluate its potential in in vivo anti-osteoporotic activity. NE was prepared using aqueous phase titration method and characterized for droplet size, zeta potential and morphology. It was then formulated into hydrogel based NE gel using carbopol 940 as gelling agent. NE gel was evaluated for pH, viscosity, in vitro/ex vivo permeation studies and in vivo anti-osteoporotic activity. The results indicated formation of spherical, nano sized globules of NE ranging from 11.17 ± 0.24 to 128.8 ± 0.16 nm with polydispersity of <0.5. In vitro and ex vivo permeation studies showed significantly higher permeation of NE as well as NE gel in comparison to fluvastatin solution indicating that NE gel can effectively penetrate through skin layers. In vivo anti-osteoporotic results demonstrated formation of new bone in trabecular region of osteoporotic rat femurs through micro-CT scanning radiographs. Biomechanical strength testing demonstrated greater load bearing capacity of rat femurs in the treated animals in comparison with the osteoporotic group. Thus, developed NE gel formulation of fluvastatin demonstrated greater potential for transdermal delivery and in the treatment of osteoporosis.",
178,agomelatine tianeptine antidepressant activity mice behavioral despair tests enhanced dmpx selective adenosine sub 2a sub receptor antagonist dpcpx selective adenosine sub 1 sub receptor antagonist,NEURAL,92.2% NEURAL; 2.6% GAIT/LOCOMOTION; 1.0% COMPARATIVE,"Szopa A, Bogatko K, Serefko A, Wyska E, Wośko S, Świąder K, Doboszewska U, Wlaź A, Wróbel A, Wlaź P, Dudka J, Poleszak E,",*Pharmacological reports : PR*,"* [Agomelatine and tianeptine antidepressant activity in mice behavioral despair tests is enhanced by DMPX, a selective adenosine A<sub>2A</sub> receptor antagonist, but not DPCPX, a selective adenosine A<sub>1</sub> receptor antagonist.](https://www.ncbi.nlm.nih.gov/pubmed/31200233)","Agomelatine and tianeptine antidepressant activity in mice behavioral despair tests is enhanced by DMPX, a selective adenosine A<sub>2A</sub> receptor antagonist, but not DPCPX, a selective adenosine A<sub>1</sub> receptor antagonist.","Adenosine, an endogenous nucleoside, modulates the release of monoamines, e.g., noradrenaline, serotonin, and dopamine in the brain. Both nonselective and selective stimulation of adenosine receptors produce symptoms of depression in some animal models. Therefore, the main objective of our study was to assess the influence of a selective adenosine A<sub>1</sub> receptor antagonist (DPCPX) and a selective adenosine A<sub>2A</sub> receptor antagonist (DMPX) on the activity of agomelatine and tianeptine.",
